,company_name,description,href,full_complain
261,betano,Depositei 30 reais na conta betano dia 20 de agosto 2022 horario 22:26 e até hoje segunda feira dia 22 de agosto nao caiu na conta,fiz-um-deposito-pix-no-sabado-e-nao-caiu-na-conta-betano-ate-hoje_Qn9vBZem7mLurwfj,"voce deposita 300 reais e ganha 300, mas precisa apostar 3000 para poder SACAR O SEU PROPRIO DINHEIRO, e ainda nao tem extorno nem nada, ainda o suporte zomba da sua cara dizendo que nao e banco e sim cassino.nunca jamais depositem nada nessa merda!e cuidado com seus documentos"
262,betano,Faço apostas sempre na betano e nunca me deram bônus nem apostas grátis e nem dinheiro para apostar igual eles fazem com vários jo,bonus-em-dinheiro-ou-rodadas-gratis_eLh4XzNQQV3DK3u_,Depositei 30 reais na conta betano dia 20 de agosto 2022 horario 22:26 e até hoje segunda feira dia 22 de agosto nao caiu na conta ja entrei contato pelo chat e suporte e eles não estorna meu dinheiro. Quero meu dinheiro de volta. E não resolveram meu problema que é um ato simples de devolver meu dinheiro de volta ou seja o estorno.
263,betano,Ao criar conta para minha filha com usuário elisandraoli no site da Betano.com bloquearam a conta depois de realizado depósito de ,bloqueio-de-saque-do-dinheiro-depositado_RwnVSOAdjYiql2_v,"Faço apostas sempre na betano e nunca me deram bônus nem apostas grátis e nem dinheiro para apostar igual eles fazem com vários jogadores.Vejo várias pessoas postando que a betano deu 20 100 200 pra apostar e eu nunca recebo nada disso . Sempre dizem que ainda não me enquadro .Como não me enguadro se sou jogadora ativa ontem msm joguei 1000 . E até na roleta que eles colocam eu não ganho 1 centavo , não tem estou mais vendo vantagem em jogar na betano já que eles não me consideram jogadora "
264,betano,"Ontem indiquei meu primo Jhonatan para ingressar ao app de apostas Betano, meu primo depositou R$200,00 reais e obteve 200 de bônu",nao-recebi-pelo-bonus-de-indicacao_DILlEHH_E_-IEvES,"Ao criar conta para minha filha com usuário elisandraoli no site da Betano.com bloquearam a conta depois de realizado depósito de R$ 300,00 reais. Alegando algum tipo de [Editado pelo Reclame Aqui] para captação de bônus.Foi solicitado documentos e comprovante de residência, os quais foram enviados.Mesmo assim a empresa bloqueou o valor depositado e não estornar o valor ao cliente.Foi solicitado encerrado da conta e devolução do valor depositado e mesmo assim a empresa se nega a realizar o saque."
265,betano,"Efetuei uma solicitação de saque e até o presente momento não cumpriram. Na hora de cadastrar, oferecem N oportunidades e opções. ",demora-no-saque_s0h9GZnaT1y3uN5X,"Ontem indiquei meu primo Jhonatan para ingressar ao app de apostas Betano, meu primo depositou R$200,00 reais e obteve 200 de bônus, até ai ok, porém quando eu indico alguém, ganho uma aposta grátis de 30 reais e meu indicado também ganha mais uma, foi a qual não recebemos.. Entrei em contato e o atendente me informou que por ele estar conectado na mesma internet que eu, não foi creditado.. Estávamos em uma chácara do meu avô, comemorando 81 anos da minha avó, local com internet e sinal telefônico limitado, eu por ter um plano de internet bom e minha conexão estar funcionando, rotiei minha internet para a família toda.. Hoje meu primo está conectado e apostando a mais de 150km de distância de mim.. Não entendo porque eles não cumprem o que foi prometido, até porque assim que ele cadastrou, me chegou um email dizendo que ele se juntou a minha rede de amigos e que assim que fizesse o primeiro depósito ambos ganharíamos uma aposta de R$30,00 grátis."
266,betano,"Fiz duas solicitações de saque, uma de 600 reais e outra de 200 reais. porém nenhuma das duas realizada, sendo que pra receber ele",problema-no-saque_Qgq8olA1iT23wLgf,"Efetuei uma solicitação de saque e até o presente momento não cumpriram. Na hora de cadastrar, oferecem N oportunidades e opções. Inclusive saque via PIX em até uma hora.. só que quando você solicita o saque dizem que é por até 24 horas!!!Uma tremenda falta de respeito!Essa clausula, é mais uma daquelas letras minúsculas que compõem os contratos. Nos demais sites de apostas, não funciona assim.Abram o olho pessoal.Estou precisando do meu saque URGENTE!!AGUARDANDO  UMA RESPOSTA"
267,betano,"Solicitei saque, transferência via pix, ainda não me depositaram, envio mensagem por e-mail, pelo chat e nada.. Argsan",saque-betano_2Wmr39mqdUfOFuDc,"Fiz duas solicitações de saque, uma de 600 reais e outra de 200 reais. porém nenhuma das duas realizada, sendo que pra receber eles estão normalmente. entrei em contato por email, sem sucesso, dizendo pra eu enviar documentos, minha conta está atualizada e com mensagem deles agradecendo o envio dos documentos. todas essa informações enviadas por email, mais ate o momento sem sucesso."
268,betano,"FIZ UM DEPOSITO DIA 21 DE AGOSTO ÁS 11:30 PARA JOGAR, MAS NÃO CAIU NA CONTA DO BETANO, ENTÃO ELES INFORMARAM QUE IRIAM REEMBOLSAR ",nao-fui-reembolsada_mLbW4UAe1aF1MzH4,"Solicitei saque, transferência via pix, ainda não me depositaram, envio mensagem por e-mail, pelo chat e nada.. Argsantos13"
269,betano,desde ontem tento fazer saque na betano mas não entra nem em processamento. eu sempre fiz o saque tudo certinho mas dessa vez ta d,processo-de-saque_ZLYIsgzcwYE1oDB9,"FIZ UM DEPOSITO DIA 21 DE AGOSTO ÁS 11:30 PARA JOGAR, MAS NÃO CAIU NA CONTA DO BETANO, ENTÃO ELES INFORMARAM QUE IRIAM REEMBOLSAR ATÉ 24HRS. PASSOU DAS 24 HORAS E NÃO FUI REEMBOLSADA. ELES NÃO ME RESPONDEM SOMENTE COM EMAILS JÁ PRONTOS. PRECISO RESOLVER ESSA SITUAÇÃO"
270,betano,"fiz o deposito de 100 reais, joguei e acabei levando 2100 reais, mas gastei bastante grana no cassino ja, bem mais que 100 reais d",saque-pix-demorando-muito_diKjo3IwYByNSBUy,desde ontem tento fazer saque na betano mas não entra nem em processamento. eu sempre fiz o saque tudo certinho mas dessa vez ta dando isso. por favor resolva meu problema pois não quero entrar na justiça
271,betano,"Olá fiz um saque na última sexta não  foi creditado na minha conta , pedi o cancelamento e refiz o saque e ainda não  caiu , já ma",seque-nao--efetuado_aOTNBIXKnD02aIpJ,"fiz o deposito de 100 reais, joguei e acabei levando 2100 reais, mas gastei bastante grana no cassino ja, bem mais que 100 reais desse dinheiro, porem tento sacar, mesmo apos mandar os documentos para verificar a conta e o saque só fica pendente pra sempre, vi que isso é recorrente e só resolvem após abrir reclamação aqui. fico no aguardo da resolucao do problema, tentei diversos momentos o chat, porem nao aparece atendente para me atender. "
272,betano,"Não estou conseguindo saque meu dinheiro da betano, pois a empresa solicita que eu mande comprovante de residência em meu nome, p",liberacao-de-conta-para-saque_an3uzEBRbZfSY7qB,"Olá fiz um saque na última sexta não  foi creditado na minha conta , pedi o cancelamento e refiz o saque e ainda não  caiu , já mandei email pra eles mais não  resolveram nada ."
273,betano,Fiz uma transferência pix e nunca chegou na minha conta bancária.  Já cancelei e fiz o pix novamente mais nunca da certo. Por favo,transferencia-pix_UtNDJYEUe4OWgd_h," Não estou conseguindo saque meu dinheiro da betano, pois a empresa solicita que eu mande comprovante de residência em meu nome, para assim liberar meu saque.Pois bem! Já enviei diversos documentos  e mesmo assim, eles se recusam a liberar meu saque.Enviei uma declaração de residência, registrada em cartório juntamente com uma fatura de telefonia que está em meu nome, com o mesmo endereço da declaração. Com tudo isso, a betano ainda não liberou meu cadastro.Solicito encarecidamente que a Betano resolva o meu problema, pois já fiz diversos depósitos e justamente agora que preciso fazer um saque, eles não liberam.Me ajuda aí BETANO!!Logim: EDSOMBUAS"
274,betano,Fui me limitar para não entrar no cassino e por engano cancelei a conta. Entrei em contato com o chat e pediram para entrar em con,reativacao-de-conta_yd7HcUEHEfmjHJ8D,"Fiz uma transferência pix e nunca chegou na minha conta bancária.  Já cancelei e fiz o pix novamente mais nunca da certo. Por favor preciso de alguma informação. Porque quando é pra depositar quem menos de um segundo,mais quando é pra receber tem esse problema. "
275,betano,"Bom eu fiz um depósito de 20 reais (sem bônus) fiz algumas apostas e fui pra 140,00 saquei 100 e deixei 40$, acontece que o saque ",nao-estou-conseguindo-fazer-meu-saque-so-fica-pendente-nem-pra-cancelar-eu-consigo_6PncMmuPZcJBE0q3,"Fui me limitar para não entrar no cassino e por engano cancelei a conta. Entrei em contato com o chat e pediram para entrar em contato via email. Enviei o e-mail solicitando, o suporte responde pedindo os dados e dando um prazo de 14 dias para solução.Já enviei mais de 10 email, ninguém responde após eu enviar o que é pedido e não nenhum lugar para resolver meu problema.Tenho mais de 4 mil reais e ao que tudo indica, vou ser [Editado pelo Reclame Aqui] por essa empresa."
276,betano,"Boa noite, realizei um saque no dia 17/08 e ainda não caiu na minha conta. Gostaria de um esclarecimento, pois das outras vezes qu",saque-nao-recebido_RNalJdutBlaI6sO3,"Bom eu fiz um depósito de 20 reais (sem bônus) fiz algumas apostas e fui pra 140,00 saquei 100 e deixei 40$, acontece que o saque está pendente a mais de 7 hrs e não tem a opção de cancelar pra sacar novamente, vou dar 2 dias caso não resolvam eu processo vocês e aí vocês me pagam 10x esse valor enrolando os outros.Da só meu dinheiro que eu ganhei que eu nunca mais uso essa péssima plataforma, blaze e estrela bet da uma surra em vocês!"
277,betano,"Fiz um pix para a plataforma da betano no dia 21/08 ainda pela manhã, logo vi que ele não entrou, a partir daí comecei a entrar no",pix-nao-entrou-e-nao-resolveram_1TpEpJm3e17BKsUI,"Boa noite, realizei um saque no dia 17/08 e ainda não caiu na minha conta. Gostaria de um esclarecimento, pois das outras vezes que realizei saques recebi o montante quase que imediatamente, porém desta vez já começo a ficar preocupado, pois já se passaram 4 dias e nada.. "
278,betano,Já é A quarta vez que não consigo usar minhas rodadas grátis já tenho 25 rodadas grátis que sumiram porque não consegui usar e est,nao-consigo-usar-minhas-rodadas-gratis_Pm8Wj8OQ1SKX2-GS,"Fiz um pix para a plataforma da betano no dia 21/08 ainda pela manhã, logo vi que ele não entrou, a partir daí comecei a entrar no chat, só era pedido para guardar, na tarde do dia 21, pelo chat foi informada que o tempo de pix expirou, nisso mandei vários e-mails com o comprovante de conclusão do pix, e nada foi resolvido, então pelo chat do banco, tentei informações do pix pois ele não retornou, fui então informada que o pix foi concluído com sucesso, mesmo mandando todos os comprovantes por e-mail não tive nenhuma solução por parte da plataforma"
279,betano,"Já não é a primeira vez, estou há mais de 2 semanas tentando contatar o chat com eles, mas eles não respondem.. e quando tento pel",comeu-meu-dinheiro-de-apostas_McD9fXZPGhzeyy-N,"Já é A quarta vez que não consigo usar minhas rodadas grátis já tenho 25 rodadas grátis que sumiram porque não consegui usar e estou esperando desde sexta-feira passada dia 12/08/  e até agora nada de devolverem as rodadas Entro em contato só dizem que tem que aguardar primeiro deram prazo de 2 dia e passando uma semana não resolveram meu problema agora mais uma vez recebi sexta feira dia 19/08 25 rodadas no jogo Magic spins e sábado 20/08 recebi 60 no jogo musketeer megaways e não consigo usar nada, isso tudo fazendo missão e gastando dinheiro no total foram usados 400 reais para fazer. Tenho prints e histórico de e-mail enviado para suporte e o chat ao vivo e ninguém nunca resolveu meu problema "
280,betano,"Boa noite!Solicitei hoje um saque no valor de 3.555,38 as 21:00 e no próprio app diz que o valor seria pago em até 1 hora. A",empresa-nao-depositou-o-pix-em-1-hora_bKU7JeubLTq_8H6D,"Já não é a primeira vez, estou há mais de 2 semanas tentando contatar o chat com eles, mas eles não respondem.. e quando tento pelo e-mail, aparece um monte de email automático que eles enviam. São 4 pagamentos de apostas que eu acertei e eles não pagaram e dão como se eu tivesse errado os placares! "
281,betano,"Boa noite, exatamente  hoje as 18:07, fiz um saque pix no valor 347,97. No aplicativo diz que o processamento demora em torno de 3",saque-pix_CKSD7QEdr6n5pmAJ,"Boa noite!Solicitei hoje um saque no valor de 3.555,38 as 21:00 e no próprio app diz que o valor seria pago em até 1 hora. Acontece que não foi pago."
282,betano,"Efetuei depósito de R$ 50,00 via pix pela Caixa Econômica Federal no ultimo sábado dia 20/08/2022 e, até agora, Betano não credito",deposito-via-pix-a-betano_fyvICdRUkejma_dJ,"Boa noite, exatamente  hoje as 18:07, fiz um saque pix no valor 347,97. No aplicativo diz que o processamento demora em torno de 30 minutos a 1 hora para realizar o pix. Porém já se passaram 3 horas. Aguardo o retorno o mais rápido possível."
283,betano,"Toda semana deposito dinheiro e não ganho um bônus, após vários amigos inativos ganharem bônus e comentar cmg fiquei uma semana no",nao-da-valor-ao-cliente_ee9haNHh6duj3By-,"Efetuei depósito de R$ 50,00 via pix pela Caixa Econômica Federal no ultimo sábado dia 20/08/2022 e, até agora, Betano não creditou para eu efetuar minhas apostas. "
284,betano,Foi descontado  da minha conta um valor de 59.00 reais aonde fiz uma aposta em.um jogo no qual já  tinha cido encerrado segundo an,fiz-uma-aposta-aonde--o-jogo-ja-tinha-caido-encerrado_dLQoikBdG58xf4JH,"Toda semana deposito dinheiro e não ganho um bônus, após vários amigos inativos ganharem bônus e comentar cmg fiquei uma semana no chat pedindo (atendimento excelente) mas não sou elegível para o bônus, ou seja a lógica é ser inativo na casa para ganhar bônus, usuários fiéis não ganham.. Vou migrar de casa e ficar inativo para ganhar bônus tbm"
285,betano,"Já são 2 dias de apostas no jogo aVIATOR onde 5 apostas ganhas não foram creditadas como ganhas, não entrou no histórico com o ID ",apostas-nao-creditadas_UqddpQilwO8mMzcD,"Foi descontado  da minha conta um valor de 59.00 reais aonde fiz uma aposta em.um jogo no qual já  tinha cido encerrado segundo antes, conversei no chat da Betano  aonde o atendente  não  soube  me passa  horário  da aposta e  término do jogo entre Cruzeiro x grêmio  ,.quero meu valor de volta  "
286,betano,"Fiz uma aposta no jogo do Bayern de Munique, logo após o sexto gol do Bayern fui fazer o cash out do valor já gerido, isso ainda f",cash-out_vtap490wWEXRwVOz,"Já são 2 dias de apostas no jogo aVIATOR onde 5 apostas ganhas não foram creditadas como ganhas, não entrou no histórico com o ID de apostas na bETANO já mandei email e nada de resposta, são respostas automáticas, não jogam esse jogo, vai acontecer a mesma coisa com voces, podem ver o historico de reclamaçoes parecidas. Eles ficam com o seu dinheiro, ou quando voce vai encerrar, trava o servidor, já sao 5 apostas e eles não querem devolver, ainda mais que não entrou no historico, nao joguem , escolham outros jogos, mas esse nao entrem..quero meu dinheiro de volta, com os lucros que tive nos 5.tenho fotos onde da o erro"
287,betano,"Na data de hoje fiz uma aposta no valor de 30 reais em uma múltipla de 2 jogos, envolvendo uma dupla chance para o 2 tempo do jogo",lesando-cliente_lBgeR3LrO76KLga4,"Fiz uma aposta no jogo do Bayern de Munique, logo após o sexto gol do Bayern fui fazer o cash out do valor já gerido, isso ainda faltava uns 20 minutos para o fim do jogo, mas o sistema bloqueou, não me deu a opção de cash out alegando que a opção de cartões estava indisponível, até entendo que isso aconteça por um curto período de tempo, mas ficou assim até o fim do jogo, não me permitindo realizar o cash out do valor já gerido, enfim no final acabei perdendo o dinheiro por conta de um cartão que faltou, sendo que já estava querendo retirar o dinheiro faltando 20 minutos pro jogo acabar "
288,betano,"No começo que até ganhei e fiz saque mas do segundo dia em diante o app começou a da bugs com mensagens que ""Ocorreu um Erro&",editado-pelo-reclame-aqui-com-bugs_bDh7SpmD84_7N6RO,"Na data de hoje fiz uma aposta no valor de 30 reais em uma múltipla de 2 jogos, envolvendo uma dupla chance para o 2 tempo do jogo na vitória ou empate entre atlético de Bilbao× valencia, e Newcastle× Manchester city, onde eu apostei em ambas, casa ou empate e assim ocorreu, mas a betano colocou minha aposta como perdida!!!! Absurdo, contato no chat deles é impossível muita demora, eu ganhei a aposta exijo meu dinheiro, espero que essa situação seja resolvida"
289,betano,"Eu fui joga porém o jogo estava travando é o Spaceman pela plataforma Betano,pediram ID de tudo mandei e até agora não  tive o ree",o-jogo-pegou-da-minha-conta-101-reais-sem-eu-ter-apostado_M2gAFYxBsYI54pLe,"No começo que até ganhei e fiz saque mas do segundo dia em diante o app começou a da bugs com mensagens que ""Ocorreu um Erro"" mas mesmo assim aparentemente pensando que o dinheiro não foi para aposta era só eu ver a conta que o dinheiro não estava mais lá, ou seja, com esse bug o dinheiro vai para a posta mais você não vê e como essa mensagem de erro eles [Editado pelo Reclame Aqui]m você, perdi $60 reais só com esse tipo de erro em durante 2 dias.O chat de atendimento é uma vida para você conseguir falar sempre tem muitas pessoas para ser atendidas, ou seja, muitos problemas.Fica difícil até pedir um ressarcimento na conta Betano causada pelos bugs de erro."
290,betano,"Depositei 500 reais na betano via pix e não caiu, esperei o prazo estipulado para o estorno e até hj não caiu. Já enviei emails co",betano-me-enrolando_8sbtOSToPqakSL3f,"Eu fui joga porém o jogo estava travando é o Spaceman pela plataforma Betano,pediram ID de tudo mandei e até agora não  tive o reembolso desse valor eu jogo apenas a 1 real 2 ou 3 no máximo  e pela terceira vez descontam 100 reais por erro do jogo os bugs só que dessa vez foi um absurdo  eu não apertei  o start para aposta como pode descontar mesmo assim???das outras 2 vezes eu apertei pq não vi que o jogo mudou o valor sozinho reclamei e nada ,eu deixei pra pois eu não prestei atenção agora foi totalmente diferente eu não  fiz a aposta só tiraram o valor e eu tinha saído do jogo sem apostar quando voltei avia descontado 101 reais absurdo!"
291,betano,Est eli o nato,betano-enganacao_F_iXh1iAvovlc9vi,"Depositei 500 reais na betano via pix e não caiu, esperei o prazo estipulado para o estorno e até hj não caiu. Já enviei emails como eles pedem e até hj não obtive resposta "
292,betano,Ganhei uma aposta e eles não me pagam com alegação de que precisam verificar meu documentos porém antes de ganhar uma aposta perdi,aposta-nao-paga_j67T9jVHHhG_50or,Est eli o nato
293,betano,"No dia 20 de agosto de 2022, apostei R$100,00 a favor da vitória do Goiás contra o Atlético/MG no Campeonato Brasileiro, quando a ",mudanca-de-odds-apos-aposta-realizada_QUmluOVtvGgQznnN,Ganhei uma aposta e eles não me pagam com alegação de que precisam verificar meu documentos porém antes de ganhar uma aposta perdi várias ou seja enquanto eles tão ganhando não se preocupam em checar seus documentos porém se você ganhar eles iram colocar obstáculos absurdos para não pagar isso caracteriza [Editado pelo Reclame Aqui].
294,betano,"Bom dia!Ontem, fiz uma aposta  de R$10,00 no jogo do Atlético x Goiás, com odd 45 na vitória do Goiás, (id 2442531642), poré",a-odd-nao-paga-de-forma-correta_LKXMTQ5qxX3Rkj-q,"No dia 20 de agosto de 2022, apostei R$100,00 a favor da vitória do Goiás contra o Atlético/MG no Campeonato Brasileiro, quando a Odds estava 45. Após o fim do jogo e a confirmação da derrota do Atlético, ganhei o equivalente a uma Odds de 20, ou seja R$ 2.000,00. Iniciei uma conversa no chat, onde o atendente William me informou que estas mudanças de Odds no decorrer da partida estavam previstas no regulamento da empresa. Logo solicitei um comprovante do processo financeiro referente a Odds apostada de 45. O atendente me informou que não podia me passar este comprovante. Após esta resposta, iniciei uma série de argumentações, onde o atendente deliberadamente encerrou o atendimento sem que eu solicitasse o mesmo. Entrei em um segundo Chat com a atendente Carla. Solicitei o mesmo comprovante e a resposta foi a mesma. Entrei em um terceiro chat, mas desta vez solicitando o histórico da conversa com o atendente William. A atendente Sara me informou que não era possível me passar este histórico. Perguntei se eles não tinham internamente este histórico no sistema, e pra minha surpresa ela me falou que eles tinham sim. Como é uma empresa que, conceitualmente tem seus processos lícitos, não entendo o porque não posso ter acesso ao meu comprovante de compra e ao meu histórico de conversa. É no mínimo duvidoso a intenção desta empresa em não fornecer estes documentos que testificam o meu processo com eles.O que eu quero com esta reclamação, é apenas receber o que me é de direito, ou seja, um valor equivalente a Odds de 45, que são, R$ 4.500,00. Entendo que este caso tem o mesmo conceito que ocorre em lojas do varejo, onde caso o consumidor leve um produto até o caixa e o preço não for o mesmo da gôndola, o que vale é o preço anunciado pois foi o motivador da ação da compra e o cliente não tem culpa por um erro interno da empresa. Da mesma forma entendo que, caso a Odds de 45 tenha sido um erro da empresa, não é culpa minha pois a minha ação de efetuar a aposta foi motivada pela Odds no momento. Venho por este veículo com a intenção de resolver da melhor forma possível, sou cliente da empresa e este é o meu primeiro contratempo. Já fiz outras apostas que ganhando ou perdendo não tive problema algum. Caso não consiga resolver esta situação por aqui, vou recorrer a um processo jurídico, pois entendo que estou no meu direito, não só por outros exemplos de mercado que me dão uma cobertura de jurisprudência como também pela recusa da empresa em me dar os comprovantes solicitados. O que só atesta o quão errado eles estão nesta situação. Porém, caso eu tenha que recorrer a um processo jurídico, não vou pedir somente o valore mencionado acima, incluirei também uma solicitação de ressarcimento por perdas e danos."
295,betano,"Apostei hoje e site não atualizava e perdi dinheiro, por culpa dessa empresa ",perdi-dinheiro_TOGrBpfuRc2y6725,"Bom dia!Ontem, fiz uma aposta  de R$10,00 no jogo do Atlético x Goiás, com odd 45 na vitória do Goiás, (id 2442531642), porém na hora de pagar, mudaram para odd de 20. Preciso que solucionem, o print da aposta será anexada."
296,betano,"Coloquei 50 reais que é o valor mínimo e dizia ter 500 de bônus, não tive 500 em bônus e ainda perdi todo dinheiro num bingo sem s",nao-dao-o-bonus_IxGk59Wk2qSevsH6,"Apostei hoje e site não atualizava e perdi dinheiro, por culpa dessa empresa "
297,betano,Então fiz duas apostas aí deu como que eu ganhei aí depois de umas 2 horas tiraram o dinheiro que eu ganhei e voltaram a aposta qu,pegaram-meu-dinheiro_ogmvIGViULnds7-K,"Coloquei 50 reais que é o valor mínimo e dizia ter 500 de bônus, não tive 500 em bônus e ainda perdi todo dinheiro num bingo sem sentido. Quero meu dinheiro de volta ou liberem meus 500 em bônus. Qualquer lugar você tem 7 dias úteis pra pedir devolução, quero meus 50 reais. "
298,betano,Fiz uma aposta ao vivo na Betano com odd 45 para o Goiás vencer o jogo contra o Atlético-mg.Apostei 20 reais e deveria ter o,mudanca-de-e-odds_56fhS9_mXZyjtE6K,Então fiz duas apostas aí deu como que eu ganhei aí depois de umas 2 horas tiraram o dinheiro que eu ganhei e voltaram a aposta que eu já tinha ganhado 
299,betano,"Boa noite, meu nome é Natália e jogo na betano, mas tem alguns dias que eles vem apresentando problemas nos saques, demora até das",saque-pix-demorado_1u1tgCm1oKjCtskr,"Fiz uma aposta ao vivo na Betano com odd 45 para o Goiás vencer o jogo contra o Atlético-mg.Apostei 20 reais e deveria ter o retorno de 900 reais com a vitória do Goiás.Ao final do jogo, após vitória do Goiás simplesmente diminuíram as odds de 45 para 20 e só recebi 400 reais.A Betano me [Editado pelo Reclame Aqui] 500 reais, isso é absurdo.A aposta foi feita ao vivo e de forma correta. Espero que façam uma retratação e paguem o valor correto. Id da aposta 2442528685"
300,betano,Fiz um jogo unico do Atlético mineiro x Goiás ao vivo e estava pagando 45x 3R$= 135R$ esse foi o valor que eu vi e fiz a aposta e,nao-paga-certo_cQvplt0FCg7ixRGY,"Boa noite, meu nome é Natália e jogo na betano, mas tem alguns dias que eles vem apresentando problemas nos saques, demora até das para cair. Gostaria que eles me falasse o que acontece NATALIA1907"
301,betano,Depositei 20 o jogo que ia jogar náo tá prestando quero reembolso náo meche no dinheiro  no outros eu náo vou eu depositei pra jog,teposite-20-o-jogo-nao-presta_O769FzW-0I_DDh7I, Fiz um jogo unico do Atlético mineiro x Goiás ao vivo e estava pagando 45x 3R$= 135R$ esse foi o valor que eu vi e fiz a aposta e  deveria pagar! após o Goiás fazer o gol diminuíram o valor  Id2442534249 Eu tenho print! Só me pagou 60 reais!  Por favor veja essa aposta! Entrei  contato e não quiseram me pagar a diferença!   É bem simples (45x )
