,company_name,description,href,full_complain
731,betano,"Resolvi participar da promoção ""Sábado com 30 fichas douradas nas roletas da Playtech"". Cliquei em participar e gastei m",realizei-a-promocao-conforme-condicoes-e-nao-recebi-meu-bonus_kEYZAGA--TPqQhW1,"No dia 23/07/2022 fiz um depósito de 12.000 através de um terceiro e o valor não foi creditado na minha conta e nem voltou para conta da pessoa, durante uma semana estou enviando vários e-mails tentando o estorno do valor e eles respondem a mesma coisa pedindo, comprovante, valor, data e hora e não fazem nada quando envio todas as informações necessárias "
732,betano,"Usuário: RangelgabbiFiz um depósito durante a semana e o valor não entrou, nem voltou pra minha conta bancária, pediram pra ",deposito-nao-concluido_XeorYpZWs2PMB_aE,"Resolvi participar da promoção ""Sábado com 30 fichas douradas nas roletas da Playtech"". Cliquei em participar e gastei mais de 150 reais (valor mínimo da promoção), porém não tive as 30 fichas creditadas na minha conta até agora.Entrei em contato com a Betano e me foi passado que minhas apostas não foram válidas porque realizei tudo em uma roleta da Pragmatic, não da Playtech então não foi válido para promoção, mas PASMEM, no próprio banner promocional da betano essa roleta da Pragmatic estava como um dos jogos elegíveis... (link: https://br.betano.com/offers/casino/Sabado-com-30-fichas-douradas-nas-roletas-da-Playtech/58436/)Então assim, estou sendo prejudicada sendo que segui totalmente todas as condições impostas pela Betano para realização dessa missão.Entrei em contato via email e não obtive resposta e via chat (Protocolo #23416366) de suporte a coisa foi mais deplorável ainda, foi me prometido que iriam verificar mas sem NENHUM PRAZO PARA RETORNO. Ou seja, tive um prejuízo já para gastar os 150 reais necessários para missão e só Deus sabe quando e SE irei recuperar um dia.. Descaso total ! "
733,betano,"Coloquei 500 em uma aposta, faltava 1 escanteio e bloquearam de fazer o cancelamento faltando mais de 8 minutos para encerrar o jo",nao-deixam-cancelar-o-jogo_RtziM5ArYnZNm6oG,"Usuário: RangelgabbiFiz um depósito durante a semana e o valor não entrou, nem voltou pra minha conta bancária, pediram pra enviar o comprovante por email e eu enviei. Até hoje entro em contato e diz que uma solicitação foi aberta, mas nunca resolvem meu problema e eu fico no prejuízo."
734,betano,"Depositei um dinheiro na Betano e simplesmente o dinheiro sumiu, não tá na minha conta do banco nem na conta do App. Como faço pra",depositei-e-o-dinheiro-sumiu_kpIu5ze_pIZAggQh,"Coloquei 500 em uma aposta, faltava 1 escanteio e bloquearam de fazer o cancelamento faltando mais de 8 minutos para encerrar o jogo, quero meu dinheiro de volta não tenho culpa se foi erro da plataforma"
735,betano,Pegaram 400reais meu depositaram sem eu saber nesse site e quero meu dinheiro devolta,pegaram-meu-celular-e-depositaram-nesse-site_G4dXaRkudO48kiy3,"Depositei um dinheiro na Betano e simplesmente o dinheiro sumiu, não tá na minha conta do banco nem na conta do App. Como faço pra ter meu dinheiro de volta? "
736,betano,"Fiz a aquisição do 17/07/2022 Foguete Milionário, com um investimento de 147,90, mais um pix de 50,00 // valor total de 197,90 ",devolucao-do-valor-investido-foguete-milionario_HLuxeeqe4scPNNTh,Pegaram 400reais meu depositaram sem eu saber nesse site e quero meu dinheiro devolta
737,betano,"Recebi está mensagem Olá, ROBSONGG1,  aproveite o jogão Internacional vs Atletico-MG com bônus exclusivo na Betano!Faça seu ",propaganda-falsa_QANxOzN7X4eQmaDp,"Fiz a aquisição do 17/07/2022 Foguete Milionário, com um investimento de 147,90, mais um pix de 50,00 // valor total de 197,90 Com uma oferta de que dentro de 7 dias, caso solicitação o cancelamento teria o valor devolvido.Pois bem, esse programa de jogo Foguete Milionário, não é para mim. Solicitei o cancelamento no dia 22/07/2022 através do Email de atendimento, porém até o momento não obtive o retorno. Continuo no aguardo, da devolução do valor investido. #Bot aviador #rocket#butano"
738,betano,"A Betano promete dar um bônus de boa vinda para a pessoa indicada e quem indicou no valor de 30 reais, até então não diz o valor m",nao-indicarei-mais-e-nem-usarei-mais-a-betano_enbdjVRioZ_ImXTt,"Recebi está mensagem Olá, ROBSONGG1,  aproveite o jogão Internacional vs Atletico-MG com bônus exclusivo na Betano!Faça seu depósito via PIX até meia noite e ganhe R$100 em apostas grátis + 100 rodadas grátis! Por telefone e email , fiz o depósito via pix conforme pede e não recebi nada ,nem os 100 giros nem os 100 em apostas !"
739,betano,"Bom dia, me chamo Marcos e venho por intermédio deste fazer minha reclamação sobre o sistema de apostas da Betano.Estava jog",apostas-no-aviator_QQkncHSxbDArqVRD,"A Betano promete dar um bônus de boa vinda para a pessoa indicada e quem indicou no valor de 30 reais, até então não diz o valor mínimo de depósito na hora que tá se cadastrando somente diz que vc receberá o bônus assim q efetuar o primeiro depósito, até então o depósito mínimo na própria Betano é de 20 reais porém a pessoa se cadastra efetua o depósito e o bônus não cai, aí que vem a pegadinha nas entrelinhas o depósito mínimo para validar o bônus é de 30 reais, no meu entender isso favorece somente a Betano e dando a entender propaganda eng.ano/ sa "
740,betano,Bom dia Ocorreu um erro da parte de vocês Na qual levou 150 reais meu Eu estava apostando no aviator Apost,erro-no-resultado-da-aposta_wfFcw1wbu_phZnwr,"Bom dia, me chamo Marcos e venho por intermédio deste fazer minha reclamação sobre o sistema de apostas da Betano.Estava jogando com apostas no modo AVIATOR e coloquei no MODO AUTOMÁTICO ""CASH OUT em 1.01X"" e o avião decolou exatamente com 1.01x uma vez que ele decola encerrando essa jogada de apostas com o mesmo número que deixei em MODO AUTOMÁTICO ""CASH OUT"", vocês ""BETANO"" não tem o porque darem como jogada perdida ao jogador, pois encerrou-se no mesmo instante em que o avião decolou, se não desejam dar lucro ao consumidor devem ao menos considerar como ""EMPATE"", NÃO LESANDO o consumidor desta maneira.Na presente data (30/07/2022) pela manhã por volta das 08:40/08:41 AM realizei duas apostas: uma no valor de R$1,00 e outra no valor de R$ 87,00 colocando em ambas MODO AUTOMÁTICO ""CASH OUT em 1.01X"", o avião decolou exatamente com 1.01X e a plataforma Betano lesou-me tomando-me os R$ 88,00.  apostados, uma vez que no modo automático minha aposta encerra exatamente com o mesmo tempo que o avião decola no mínimo a plataforma deve dar como empate, devolvendo o valor apostado integralmente.Na data de ontem 29/07/2022, estava apostando também em modo automático de parada ""cash out"" e fui [Editado pelo Reclame Aqui], solicitei atendimento via ""CHAT AO VIVO"" no qual DEMOROU MUITO fazendo-me desistir e optar por realizar minha reclamação na presente data, que veio a calhar justamente com outra reclamação.Na data de 29/07/2022 os valores [Editado pelo Reclame Aqui] foram poucos, não chegaram a R$ 10,00,  entretanto, o valor da presente data 30/07/2022 foi de R$ 88,00.Solicito explicação do setor responsável, assim como a restituição do valor ao qual fui [Editado pelo Reclame Aqui], uma vez que deu empate e não aposta perdida por mim.Vale também ressaltar que não recebi o pagamento de centavos apostados, quando vi reclamações na internet e no chat ao vivo passei a realizar pequenas apostas para verificar se coincidia com as reclamações e veio a coincidir, tive algumas apostas de R$ 1,00 com CASH OUT em 1.02X/1.05X na qual o valor ganhado na aposta de R$ 0,02/ R$0,05 não foram adicionados a conta, assim como parei de jogar com valor X no Aviator sai do jogo ""NÃO FAZENDO MAIS APOSTAS"" e quando retornei dei falta no valor de CENTAVOS.Todas estas reclamações podem ser  analisadas pelo setor responsável, pois [Editado pelo Reclame Aqui] o consumidor desta maneira é [Editado pelo Reclame Aqui]!Já coloquei R$ 150,00 na plataforma e estava pensando em colocar mais, porém diante dos fatos ocorridos optei por primeiramente reclamar e solicitar restituição para ver qual será a atitude da plataforma.Por enquanto estou solicitando somente a restituição dos R$ 88,00 apostados ao qual fui [Editado pelo Reclame Aqui] e informando o erro no sistema da Betano para que corrijam.Acionei o chat ao vivo onde fui atendido pela atendente Rafaela B. após redigir a mesma o referido texto acima, a atendente me deixou sozinho no chat e de maneira inusitada a aba de atendimento mudou, meu texto sumiu e ficou tudo branco sendo impossível o envio de mensagens e/ou qualquer outra coisa.Terei de sair e tentar novamente com outro atendente.Este é o atendimento que a Betano da a seus clientes após lesá-los?Pelo visto SIM."
741,betano,"Coloquei 50 reais para sair com 2x, bateu os 2x e eles não me pagaram. O voo foi exatamente nos 2x.",cash-automatico-nao-funcionou_T2uuS0854UCHV_be,"Bom dia Ocorreu um erro da parte de vocês Na qual levou 150 reais meu Eu estava apostando no aviator Apostei 150 reais , estava com a saída automática em 1.50 O avião saiu em 1.50 E ao invés de eu ganhar , apareceu que eu perdi , e foi os meus 200 que eu ganharia150 que apostei mais 50 do lucro que eu ganhei .Sendo assim,  não tem como eu ter perco , tirei print de tudo aqui .Foi um erro de vocês. Até pq eu tenho uma amigo que.esta jogando comigo do meu lado igual eu com a saída automática em 1.5 E ele deu ganho .Peço que tu olhe e peça o meu ressarcimento do valor Verifique no seu registro por favor. Id da aposta 42167864085Preciso de uma resposta pois o suporte nada resolve "
742,betano,Fiz um saque de 100 reais domingo passado e até agora não recebi ..A Betano depositou numa conta errada conta que não existe,pagamento-errado_falIG1gkKErZhrAN,"Coloquei 50 reais para sair com 2x, bateu os 2x e eles não me pagaram. O voo foi exatamente nos 2x."
743,betano,"Investi dinheiro no aplicativo Betano para fazer apostas, com tempo ganhei 150 reais. Tentei realizar a transferência do dinheiro ",perdi-dinheiro-no-betano_Q7mwJnjE7DoDiqgb,"Fiz um saque de 100 reais domingo passado e até agora não recebi ..A Betano depositou numa conta errada conta que não existe,conta que não é minha conta que eu não forneci.. conta Itaú card(cartão de crédito)Já liguei no banco e não tem nenhum valor disponível nem como saldo nem como crédito..Só quero receber meu valor e cadastrar uma conta para receber outros saques .. ainda me bloquearam para fazer apostas..Contato 11964207401 ou renatosilvadeoliveira2017@gmail.com"
744,betano,"Fiz um depósito na Betano no valor de R$100. Ganhei o bônus com a dobra (mais R$100) e após ter ganhos algumas Apostas, para minha",bloqueio-de-saque_8-KFIfEu-JSZLIPO,"Investi dinheiro no aplicativo Betano para fazer apostas, com tempo ganhei 150 reais. Tentei realizar a transferência do dinheiro que estava na plataforma para a minha conta porém não foi creditado o valor mencionado e também o valor não foi retornado para a plataforma. Já fiz várias reclamações e entrei em contato com a empresa e não obtive resposta, venho aqui mostrar minha insatisfação com a plataforma Betano, estou sem palavras!!! "
745,betano,A betano meu induziu a fazer a seguir depois da roleta da sorte q da prêmios uma seta no casino e me levaram simplesmente me levar,me-editado-pelo-reclame-aquiam_ajo0h7Q9zRFm9gWz,"Fiz um depósito na Betano no valor de R$100. Ganhei o bônus com a dobra (mais R$100) e após ter ganhos algumas Apostas, para minha surpresa eu só podia fazer o saque a partir de ganhos acima de R$1.000,00 !!! Como se minhas Apostas ganhas fosse originadas somente de bônus!! UM AVISO: NÃO JOGUEM NA BETANO!! A CASA [Editado pelo Reclame Aqui] O SEU DINHEIRO INVESTIDO!!! "
746,betano,Apostei mais de 100.000 e não recebi o valor correto em Cashback do Cassino ao vivo da Betano ,cashback-betano-20_-7qiM6yMtnr3XmAN,A betano meu induziu a fazer a seguir depois da roleta da sorte q da prêmios uma seta no casino e me levaram simplesmente me levaram 50 reais
747,betano,"Há algum tempo atrás eu fiz um depósito de 200 reais na Betano, desde então tenho investido este recurso, inclusive já girei o sal",bloqueio-de-saque_NRWVT1TiTgjwHqSt,Apostei mais de 100.000 e não recebi o valor correto em Cashback do Cassino ao vivo da Betano 
748,betano,Essa casa é uma decepção. Fiz uma solicitação de saque e ficou com o status de processando e não finalizaram. Recebi um e-mail diz,solicitei-o-saque-e-nao-pagam_iVliSqGRHIwqDj2G,"Há algum tempo atrás eu fiz um depósito de 200 reais na Betano, desde então tenho investido este recurso, inclusive já girei o saldo total em apostas, mas agora quero realizar o saque e não consigo.Realizei a solicitação, o saldo sai da minha conta da Betano, mas não entra na instituição financeira solicitada.Por gentileza, desbloquear o saque.."
749,betano,"É uma boa plataforma, tem seus prós, mas o contra é que além de te [Editado pelo Reclame Aqui]em você que deve provar que eles não enviaram o saque, ja",editado-pelo-reclame-aqui_RrJu0sVBQ-g6rFs_,Essa casa é uma decepção. Fiz uma solicitação de saque e ficou com o status de processando e não finalizaram. Recebi um e-mail dizendo que eu deveria cancelar o saque e que deveria cumprir requisitos de aposta pra poder solicitar um novo saque. Mesmo depois de cumprir em um novo saque usaram o mesmo argumento. Casa vergonhosa. Fácil pra aceitar depósito e um sacrifício pra pagar. Resolvam isso!
750,betano,Bom tem mais de um mes que estou com esse priblema sem soluçao. Sinceramente demorei muito pra ppder fazer essa reclamaçao. Pois j,nao-recebi-meu-premio_ed7SXlcFdctHwT1q,"É uma boa plataforma, tem seus prós, mas o contra é que além de te [Editado pelo Reclame Aqui]em você que deve provar que eles não enviaram o saque, ja foram mais de 4 saques que sumiu, ou falam que foi enviado e nunca aparece ou se quer respondem o e-mail enviado com todos os detalhes, para eles pode ser pouco, mas 500 reais somados em todos os saques que não me mandaram faz falta."
751,betano,"Fiz um depósito para fazer apostas , e girei a rodadas da sorte , ganhei 5 rodada grátis , fui no jogo e cliquei em rodada grátis ",debito-da-minha-conta_rC99VH98YPtC72OW,Bom tem mais de um mes que estou com esse priblema sem soluçao. Sinceramente demorei muito pra ppder fazer essa reclamaçao. Pois ja fiz de tudo. Pra que a empresa resolvesse meu problema porem. Entro em contato pelo chat. E eles mandam eu mamdar os print da tela pra o email com o id da aposta mais o email é inutil. 3 vezes eu entrei em contato por emaiil. Ganhei uma aposta no black jack no balot de 40 reais no caso deveria receber 80 reais. Eles me devolveram somente 40 reais. O deelear havia estourado. Estou a disposiçao pra resolvermos esse problema. Pois pra mim é muito dinheiro pra vcs nao. Acredito que resolveram. Mais se seguir como estao. A reputaçao nap sera a mesma. Tenho tudo se quiserem entra em contato passarem asinformações. Exemplo print com o valor da aposta e ID da aposta. Espero. Repito tem mais de 1 mes isso e vcs nao resolveram ainda. 
752,betano,"Investi dinheiro no aplicativoBetano para fazer apostas, comtempo ganhei 150 reais. Tenteirealizar a transferênc",perdi-dinheiro-com-betano_cklX1JN3EyFqtQBh,"Fiz um depósito para fazer apostas , e girei a rodadas da sorte , ganhei 5 rodada grátis , fui no jogo e cliquei em rodada grátis e simplesmente a Betano pegou do depósito que fiz no jogo e eu perdi , em duas rodadas, achando que estava na rodada grátis , me [Editado pelo Reclame Aqui] . Entrei em contato e como sempre disse que não teve erro . "
753,betano,Efetuei um pagamento. No valor de R$ 50.00Valor que nao aparece como crédito.,devolucao-do-valor_vbCSHpi9S84Pbg7z,"Investi dinheiro no aplicativoBetano para fazer apostas, comtempo ganhei 150 reais. Tenteirealizar a transferência do dinheiroque estava na plataforma para aminha conta porém não foicreditado o valor mencionado e também o valor não foi retornadopara a plataforma. Já fiz váriasreclamações e entrei em contatocom a empresa e não obtiveresposta, venho aqui mostrar minha insatisfação com aplataforma Betano, estou sempalavras!!!"
754,betano,"Fiz um a saque de valor alto a mais de 5 horas até agora o dinheiro não caiu, eu depositei meu dinheiro nesta conta e consegui meu",falso_F3sZ7munL8pWLKR0,Efetuei um pagamento. No valor de R$ 50.00Valor que nao aparece como crédito.
755,betano,Fiz um saque via pix já faz 4 horas e até agora nada de cair na minha conta. Quero meu dinheiro na minha conta ,saque_7Q5PvLggPpnJ3sBo,"Fiz um a saque de valor alto a mais de 5 horas até agora o dinheiro não caiu, eu depositei meu dinheiro nesta conta e consegui meu lucro agora quando vou sacar o dinheiro não cai. Quero agora o meu dinheiro de volta. NÃO RECOMENDO A NINGUÉM ESTE APP!!!!"
756,betano,"Ha 2 dias atrás quando fui entrar na minha conta, botei meu e-mail e senha. Aí estava dizendo (generic error). Aí eu conseguir ent",generic-error_x-B8-3qOKioIeBuU,Fiz um saque via pix já faz 4 horas e até agora nada de cair na minha conta. Quero meu dinheiro na minha conta 
757,betano,No pode jogar futebol virtual ela [Editado pelo Reclame Aqui] descaradamente manipula resultado na cara dura fiz 20 jogos em placar exato pulei 1 jogo p,manipular-resultado_RwYqa6PNvClbFGVA,"Ha 2 dias atrás quando fui entrar na minha conta, botei meu e-mail e senha. Aí estava dizendo (generic error). Aí eu conseguir entrar botando o usuário e senha. Agora quando fui entrar hoje dnv, deu a mesma coisa. Só que não consiga entrar nem pelo usuário e nem pelo e-mail. Esperam que vocês possam consertar esse erro, porque eu tenho apostas ativas. Espero o retorno mais rápido possível."
758,betano,"Coloquei saldo na blazer, fiz vários jogos entre ganhos e percas e acabei com um lucro de 110% mas a empresa não deixou eu sacar, ",privado-de-sacar-saldo_ygGOzGOQ0ROKWu_a,No pode jogar futebol virtual ela [Editado pelo Reclame Aqui] descaradamente manipula resultado na cara dura fiz 20 jogos em placar exato pulei 1 jogo para ver e tive certeza nós 20 jogos exatamente o que eu pulei deu o placar isso e manipulação descarada não joguem no futebol virtual da Betânia enquanto vida eu tiver não jogo [Editado pelo Reclame Aqui]eilha pura
759,betano,"Meu dinheiro simplesmente evaporou em uma transação para a betano envolvendo a paymee brasil,  que é parceira deles. Fiz um depósi",fiz-um-deposito-via-pix-para-a-paymee-para-colocar-dinheiro-na-betano-mas-ainda-nao-caiu-para-eles-no-sistema-a-empresa-ainda-nao-pagou-meu-deposito_4OdiDcCKnqmoQC2u,"Coloquei saldo na blazer, fiz vários jogos entre ganhos e percas e acabei com um lucro de 110% mas a empresa não deixou eu sacar, entrei em contato com o suporte e eles sempre falavam que falta apostar valor X do depósito pra poder sacar, fui lá apostei 4x mais que me pediram e mesmo assim não deixaram sacar retendo meu dinheiro e me induzindo a apostar mais e mais até que eu perdesse tudo."
760,betano,Meu saque não caiu na conta e no sitema nao me respondem. Dizem que estão resolvendo.,efetuei-um-saque-de-200-ja-tem-mais-de-15-dias-e-ainda-nao-caiu-na-conta_H6YdqiSJvZVfK84c,"Meu dinheiro simplesmente evaporou em uma transação para a betano envolvendo a paymee brasil,  que é parceira deles. Fiz um depósito dia 16/08 00:00 para a betano via pix, copiei e colei o código no meu app do banco inter, apareceu tudo certinho, nome de quem recebeu (paymee brasil) valor de 500,00 mas até agora o valor não caiu na minha conta da betano, e nem foi estornado para minha conta, o que aconteceu, meu dinheiro evaporou."
761,betano,"Fiz uma aposta pela primeira vez no valor de R$ 2,00 ( dois reais) para testar o jogo e automaticamente foram cobrado $ 200,00 ( d",aposta-no-avitor-betano_n90BIgsE3vRhiHOz,Meu saque não caiu na conta e no sitema nao me respondem. Dizem que estão resolvendo.
762,betano,"Dia 20 fiz uma aposta no valor de 200 reais e obtive um retorno de 416,85Solicitei o saque pix de 316,00 e deixei 100 reais ",meu-dinheiro-nao-caiu-em-minha-conta_pYIkOtr17r_VyNS3,"Fiz uma aposta pela primeira vez no valor de R$ 2,00 ( dois reais) para testar o jogo e automaticamente foram cobrado $ 200,00 ( duzentos reais) O aviator dobra as apostas conforme o avião decola oscila muito.por diversas vezes apertei o botão para encerrar a aposta e o sistema nao reconhecia ,com certeza o sistema é manipulado para os apostadores perde gostaria de um esclarecimento sobre Isso.O número do pedido da reclamação no email foi este (23312352) "
763,betano,"A betano é uma verdadeira furada, validei todos meus documentos mais de uma vez e estão prendendo meu dinheiro,Estou a quase",15-dias-tentando-sacar-e-nao-pagam_P8zI7cmlIPTT2czr,"Dia 20 fiz uma aposta no valor de 200 reais e obtive um retorno de 416,85Solicitei o saque pix de 316,00 e deixei 100 reais na minha banca , mais o dinheiro não caiu até hoje dia 28/07 , já havia ganhado outras vezes e pix caíram normalmente só esse que não caiu , chegou mensagem com o comprovante que o pix tinha sido creditado em minha conta , já falei com o suporte online me orientam a mandar mensagem para o suporte via email , enviei a mensagem para o suporte por e-mail , falando da situação , eles me pediram extrato da conta bancária do dia do ocorrido até hoje , enviei diversas vezes , o extrato bancário do dia 20 até o dia 25 depois mandei do dia 20 até  26, 27Me pediram o longuin enviei simasmczMe pediram nome completo , data de nascimento , CPF enviei , depois me pediram o código do Id da aposta enviei o código do Id , junto com o id do saque , e até hoje não me responderam e não depositaram o dinheiro em minha conta , vou juntar todas as conversas e solicitar um advogado , para processar a empresa caso não depositarem meus 316 reais Email cadastrado anderson.hondaconvem@hotmail.comLoguin simasmczId 2358922652Código de id transação pix390924850815"
764,betano,"Antes eu secava por intermédio de transferência bancária e agora ele só disponibiliza pix,so que a conta cadastrada em meu nome nã",nao-consigo-efetuar-saque_nrJ3cyOMhGDDhIcl,"A betano é uma verdadeira furada, validei todos meus documentos mais de uma vez e estão prendendo meu dinheiro,Estou a quase 15 dias tentando um saque de 2180 reais, porem não foi liberado, estou com problemas financeiros, realizei minha autoexclusão do site para conseguir meu reembolso e nem assim a betano me paga, já enviei todos os documentos que me pediram, mais de uma vez e nunca liberam o saque.Cuidado, ela pega o dinheiro de vocês e não devolve!"
765,betano,"Bom dia fiz uma aposta ontem a noite Apostei nos dois times menos de 1,5 Sendo que no São Paulo eu ganhei ",fiz-um-jogo-nos-esportes_nP8JpHCTn-Tco705,"Antes eu secava por intermédio de transferência bancária e agora ele só disponibiliza pix,so que a conta cadastrada em meu nome não tem pix cadastrado no CPF e se o dinheiro e meu porquê eles fazem essa porcaria toda para aborrecer as pessoas,se não resolver aqui vou falar diretamente com tio da polícia federal e fazer uma queixa [Editado pelo Reclame Aqui] por lá, muda as coisa nas nossas contas sem um aviso prévio essa última a atualização mudou tudo "
766,betano,"Sou um jogador da área esportiva, ganhei 5 giros grátis no jogo wild link da betano, quando entrei apareceu que eu tinha os 5 giro",fui-enganado_bNoalNhop-vG8YVv,"Bom dia fiz uma aposta ontem a noite Apostei nos dois times menos de 1,5 Sendo que no São Paulo eu ganhei E no fluminense não "
767,betano,"Minha conta foi bloqueada com dinheiro nela e estão pedindo várias coisas q eu não tenho pra desbloquear, eu entro em contato pelo",bloquearam-minha-conta-com-dinheiro-nela_2-bEgLLn8vKwjNb_,"Sou um jogador da área esportiva, ganhei 5 giros grátis no jogo wild link da betano, quando entrei apareceu que eu tinha os 5 giros grátis eu cliquei em jogar agora,rodei 5 vezes e sumiu 125 reais da minha conta ,ou seja fui enganado os giros não foram grátisEntrei em contato com o suporte ,agiram com indiferença  e falaram que não tinha como reembolsar ,alegando q eu joguei  errado sendo q a propaganda deles dizia 5 giros gratis"
768,betano,"Fiz um saque de 1800,00 via Pix ja tem mais de 24 hrs e até agora não entrou na minha conta entra no chat fala q vai alguém me ate",saque-nao-entrou-na-minha-conta_RYzt4x6wGKsD6MsK,"Minha conta foi bloqueada com dinheiro nela e estão pedindo várias coisas q eu não tenho pra desbloquear, eu entro em contato pelo suporte mas ninguém resolve meu problema."
769,betano,"Estou insatisfeito , indiquei meu amigo André Cardoso e era pra mim e ele ganhar uma aposta grátis de 30 reais cada um ,só sendo e",sem-resposta-e-desanimado_cD7aDmIsrhBGLUsv,"Fiz um saque de 1800,00 via Pix ja tem mais de 24 hrs e até agora não entrou na minha conta entra no chat fala q vai alguém me atender ninguém atende pelo chat aí mando e-mail explico tudo e toda hora responde a mesma coisa eu quero meu dinheiro que ganhei na hora que agente faz depósito entra rapidinho agora na hora de pagar fica nessa demora"
770,betano,"Bom coloquei R$180, alguns reais em perdi em aposta mesmo. Mas outros o dinheiro sumiu a banca me [Editado pelo Reclame Aqui], a menos que devolva eu r",a-banca-me-editado-pelo-reclame-aqui_OqEq1LxD3ZuiijOx,"Estou insatisfeito , indiquei meu amigo André Cardoso e era pra mim e ele ganhar uma aposta grátis de 30 reais cada um ,só sendo enrolado aparece como pendente e muita sacanagem entro em contato e nada ."
