,company_name,description,href,full_complain
0,betano,"Solicitei dois saque que está pendente , entrei em contato ontem e deram o prazo de 24 para aprovação e 1 para depositar na minha ",nao-pagaram-minha-solicitacao-de-saque_F4x9K8xhiMLpfDuR,"Solicitei dois saque que está pendente , entrei em contato ontem e deram o prazo de 24 para aprovação e 1 para depositar na minha conta , o atendente confirmou que assim que chegar o prazo já cairia na conta ,  o prazo já passou e até agora nada  tento entrar em contato é só mensagem automática. Não tenho retorno sobre , não tem atendente que responde , meu dinheiro tá lá preso . Na hora de depósito via pix cai na hora agora pro saque essa enrolação . Gostaria de retorno sobre minha situação , e principalmente que meu problema fosse resolvido quanto antes . "
1,betano,"Fiz uma aposta no jogo do América mg x Coritiba. Coloquei que iria ter mais de 4,5 cartões e no jogo teve 5, porém a plataforma de",ganhei-mais-nao-fui-pago_ZjA3MMKXw2-AlRfd,"Fiz uma aposta no jogo do América mg x Coritiba. Coloquei que iria ter mais de 4,5 cartões e no jogo teve 5, porém a plataforma deu como perdido a minha aposta. "
2,betano,"Bom dia , estou tentando realizar um saque na Betano e não estou conseguindo, tentei sacar 1.000 reais via Pix da minha conta Beta",saque--betano_6z3PW9VTAPwGbsy1,"Bom dia , estou tentando realizar um saque na Betano e não estou conseguindo, tentei sacar 1.000 reais via Pix da minha conta Betano que os mesmos dizem está processando e até o momento nada.O pior que este valor nem aparece mais para mim em meu saldo da plataforma.Lendo os regulamentos de saque via Pix da plataforma eles teriam no máximo 1Hora para fazer o depósito via pix para o cliente , e já se passaram quase 24Horas e nada .Já mandei e-mail, tentei falar no chat , e tmb nada.Isto é uma falta de respeito imensa com os clientes, desse jeito não dá.Por favor tem como vcs do reclame aqui, me ajudarem com está situação.At.. Alciole"
3,betano,"Bom dia, ontem a noite fiz uma aposta de 3,00 reais para parar no 1.34  O avião subiu bem mais que isso, eu ganhei, mas o sa",fiz-uma-aposta-ganhei-mas-o-saldo-nao-foi-atualizado_IGGapbjwWTjtrvA8,"Bom dia, ontem a noite fiz uma aposta de 3,00 reais para parar no 1.34  O avião subiu bem mais que isso, eu ganhei, mas o saldo não atualizou! Peço atualização do meu saldo. Grata."
4,betano,"Tentei realizar o saque do meu dinheiro que está na conta da Betano desde a última sexta-feira dia 02 de setembro, e então o pedid",transacao-em-saque_y-Koew3Ibb0YUo_m,"Tentei realizar o saque do meu dinheiro que está na conta da Betano desde a última sexta-feira dia 02 de setembro, e então o pedido continua em uma eterna análise.Entrei em contato pelo chat, e a resposta que tive foi que até uma hora o caso era resolvido, mas caso não fosse, teria que entrar em contato novamente, entre e foi a mesma conversa.Isso é algo que infelizmente desmotiva nós usuários da plataforma, pois no momento que vamos fazer algum depósito tudo ocorre de maneira tão fácil."
5,betano,Ganhei a aposta depois ele colocou um Red cancelei o saque para fazer outra aposta mais eles pegou meu dinheiro 4.346 reais ,ganhei-a-aposta-depois-eles-deu-como-perca_DRfLC5RD1NhwpRMN,Ganhei a aposta depois ele colocou um Red cancelei o saque para fazer outra aposta mais eles pegou meu dinheiro 4.346 reais 
6,betano,"A quase uma semana estou tentando fazer um saque, aí pediram meus documentos para autenticação no qual mandei tudo certo e eles fi",problemas-de-autenticado-de-conta_pELbDR8BD_GaCcQD,"A quase uma semana estou tentando fazer um saque, aí pediram meus documentos para autenticação no qual mandei tudo certo e eles ficam rejeitando, agora bloquearam minha conta, não consigo mais fazer nenhuma aposta e meu dinheiro está travado lá, Betano já foi melhor um dia "
7,betano,"Bem, estou morando em casa de aluguel e o nome do comprovante de energia está no antigo dono. Para fazer a validado de identificaç",nao-estou-conseguindo-fazer-o-processo-de-verificacao-de-id_f9-A_PINpydUr2Ja,"Bem, estou morando em casa de aluguel e o nome do comprovante de energia está no antigo dono. Para fazer a validado de identificação precisa do comprovante com o meu nome, porém estou precisando fazer essa validação e o processo de troca de titularidade irá demorar bastante. Espero que a equipe de profissionais da Betano possa entrar em contato comigo para resolver isso o quanto antes."
8,betano,"OiO motivo do meu contato é sobre o bônus de boas vindas que recebi, ocorreu tudo certo..Depositei 50 reais, recebi 50",conclui-mas-nao-recebi-bonus-de-boas-vindas_m4yCakCH-aiUrExg,"OiO motivo do meu contato é sobre o bônus de boas vindas que recebi, ocorreu tudo certo..Depositei 50 reais, recebi 50 de bônus e mais uma meta pra completar com apostas no valor total de 500 reais..Então eu completei tal missão de boas vindas em menos de 30 dias e respeitei todos requisitos..aparece no meu perfil da Betano em ""promoções expiradas"", a tal missão completada mas valor já faz 3 dias que completei e não entrou em minha conta.Já mandei email pra Betano várias vezes mas nem um retorno com posição fixa então ..Eu quero saber oq acontece agora, se é enganação ?Se realmente irei receber tal valor ?Quanto tempo ?Somente isso. Resto tudo mais site Betano é uma excelente plataforma.Agradeço pela atenção.Aguardo resposta."
9,betano,"Já tem algum tempo que jogo na Betano, mas confesso que estou para parar, depois que comecei ter alguns lucros eles estão demorand",saque-pix-enrolado_7e-JxmJS8bRGl1a-,"Já tem algum tempo que jogo na Betano, mas confesso que estou para parar, depois que comecei ter alguns lucros eles estão demorando bastante pra depositar o saque via pix na minha conta, coisa que antes não demorava 30 minutos, vou voltar pra bet365 e a 1xbet que tb são boas e pagam no prazo estipulado "
10,betano,"Então, tentei realizar um saque de uma aposta ganha na betano e pra minha surpresa pediram que eu enviasse documentos pessoais e c",saque-nao-realizado_vUrzd1n-qXrCNaor,"Então, tentei realizar um saque de uma aposta ganha na betano e pra minha surpresa pediram que eu enviasse documentos pessoais e comprovantes de residência em meu nome.Enviei por inúmeras vezes e todos sendo rejeitados, não sei mais o que fazer.Espero um retorno pois pra depositar eles aceitam na hora, porém pra sacar ele fazem isso. "
11,betano,"Apostei mais de 4.5 cartões no jogo América x Curitiba e deu 6 cartões,  eu ganhei a múltipla e deu como não ganho. Final do jogo ",apostei-mais-de-45-cartoes-no-jogo-america-x-curitiba-e-deu-6-cartoes-ganhei_D-YsbYCjPkKkqDg6,"Apostei mais de 4.5 cartões no jogo América x Curitiba e deu 6 cartões,  eu ganhei a múltipla e deu como não ganho. Final do jogo como podem ver foram 6 cartões e apostei que iria dar mais de 4.5 e acertei. Seguem os prints!!!! Quero meu dinheiro seus espertos. "
12,betano,A dias estou tentando desbloquear a conta minha porem sem sucesso algum...ja enviei varios emails ninguem resolveu nada..e a conta,conta-bloqueada_Q2LIUyxFV6-uVxeL,A dias estou tentando desbloquear a conta minha porem sem sucesso algum...ja enviei varios emails ninguem resolveu nada..e a conta continua bloqueada constando meu cadastro e dados de documentos 
13,betano,"Fiz um depósito de 50, ganhei o bônus, zerei a conta. Fiz mais um depósito, cancelei o bônus e pedi saque. Eles não cancelam meu s",fiz-um-saque-em-pix-e-mais-de-24-hrs-que-nao-caiu_yzT8qm9L-zf8ijQO,"Fiz um depósito de 50, ganhei o bônus, zerei a conta. Fiz mais um depósito, cancelei o bônus e pedi saque. Eles não cancelam meu saque e nem me pagam. Eu quero resposta, chat ao vivo uma merda "
14,betano,"Fiz a conta e depósito, consegui fazer algumas apostas, depois não consegui mais entrar,fica dando erro de conexão. Quero meu dinh",erro-de-conexao_QP8F5OYqMHUYot7r,"Fiz a conta e depósito, consegui fazer algumas apostas, depois não consegui mais entrar,fica dando erro de conexão. Quero meu dinheiro q tá na conta."
15,betano,"Realizei várias apostas, ganhei algumas e perdi outras, é um jogo eu entendo, mas o que não entendo é eles prometeram fazer o pix ",empresa-nao-faz-a-devolucao-de-meu-dinheiro_plscV26ICYBCIoTW,"Realizei várias apostas, ganhei algumas e perdi outras, é um jogo eu entendo, mas o que não entendo é eles prometeram fazer o pix em até 24 horas e já são 3 dias e não devolvem meu dinheiro. Tento falar pelo chat on-line e não consigo relatar minha necessidade, pois lidamos com robô, eu envio e-mail, o que me solicitam eu faço mas não tenho retorno, sempre pedem algo diferente, eu faço, mas até o momento sem meu dinheiro."
16,betano,"Fiz uma aposta hoje no psg, em cartões, saiu 6 cartões no jogo coloquei que sairia menos de 6.5, e deram como perdida está aposta!",aposta_dg0BAsyw5e1-58NI,"Fiz uma aposta hoje no psg, em cartões, saiu 6 cartões no jogo coloquei que sairia menos de 6.5, e deram como perdida está aposta! "
17,betano,Pedi o saque ontem dia 02/09 e até agora nada.Agora pra deposito entra na hora.Chega de betano. ,24-horas-sem-saque_WFCdv0vslpSXPFE2,Pedi o saque ontem dia 02/09 e até agora nada.Agora pra deposito entra na hora.Chega de betano. 
18,betano,Saque não é real do eles prometem,saque_05yNgQ4lTJ2Y1_mk,Saque não é real do eles prometem
19,betano,Fiz uma múltipla de 6 jogos.E em um desses jogos coloquei Neymar fazendo Gol a qualquer momento.Quando eu vii que o Ne,betano-nao-deixou-eu-cancelar_muLb7-rtSVdJyRrp,Fiz uma múltipla de 6 jogos.E em um desses jogos coloquei Neymar fazendo Gol a qualquer momento.Quando eu vii que o Neymar não estava jogando tentei cancelar o jogo porque os outros 5 jogos já havia batido.E o aplicativo não deixou eu estar cancelando o jogo.Neymar entrou nos 65 minutos de jogo.
20,betano,Fiz uma múltipla de 6 jogos.E em um desses jogos coloquei Neymar fazendo Gol a qualquer momento.Quando eu vii que o Ne,betano-nao-deixou-eu-cancelar_muLb7-rtSVdJyRrp,Fiz uma múltipla de 6 jogos.E em um desses jogos coloquei Neymar fazendo Gol a qualquer momento.Quando eu vii que o Neymar não estava jogando tentei cancelar o jogo porque os outros 5 jogos já havia batido.E o aplicativo não deixou eu estar cancelando o jogo.Neymar entrou nos 65 minutos de jogo.
21,betano,"Quando fiz depósito cai na mesma hora pelo pix e quando vou sacar além de não ser tão rápido via pix,eles informam o prazo de 1 ho",nao-efetuam-o-meu-saque_xMM1HW-ds1JytP_Q,"Quando fiz depósito cai na mesma hora pelo pix e quando vou sacar além de não ser tão rápido via pix,eles informam o prazo de 1 hora,já faz mais de 3 horas q solicitei o saque e até agora nada.Aguardo uma solução imediata,porque isso é um absurdo.Não hora de depositar na conta deles entra rápido e não hora de sacar pra minha conta não cumprem com o regulamento da empresa que dá prazo máximo de 1 hora."
22,betano,"Minha Internet funcionando, Wi-Fi tbm. Mas chega uma mensagem de erro de conexão,  e não consigo meu acesso, nem com a biometria",erro-ao-fazer-login_FPZUPUduEfOkPeIB,"Minha Internet funcionando, Wi-Fi tbm. Mas chega uma mensagem de erro de conexão,  e não consigo meu acesso, nem com a biometria"
23,betano,"Realizei um depósito via pix na conta Betano, porem o valor não foi creditado. Entrei em contato com o suporte, o mesmo solicitou ",deposito_3QgyrGOnf2whZG_2,"Realizei um depósito via pix na conta Betano, porem o valor não foi creditado. Entrei em contato com o suporte, o mesmo solicitou o envio do comprovante do depósito.  Mesmo assim o problema não foi resolvido."
24,betano,"Indiquei um amigo e ele fez a conta e recarregou, mais n recebi a aposta grátis ",indique-o-amigo_YkfGFjg--ia1Fhbs,"Indiquei um amigo e ele fez a conta e recarregou, mais n recebi a aposta grátis "
25,betano,"Boa tarde!Fiz uma múltipla com alguns times 1 coloquei dupla chance vcs não me pagaram, não consigo resolver no chat .",nao-pagou-minha-aposta_tNVvJyP65QYFX02O,"Boa tarde!Fiz uma múltipla com alguns times 1 coloquei dupla chance vcs não me pagaram, não consigo resolver no chat .Foi no jogo do Liverpool "
26,betano,"Hj no jogo do campeonato inglês na aposta de canto dos 10:00 as 19:59 deu como perdida , eu vendo o jogo ao vivo , como já acontec",aposta-de-canto-deu-como-perdida_SDc2IfnbgtdHTVW-,"Hj no jogo do campeonato inglês na aposta de canto dos 10:00 as 19:59 deu como perdida , eu vendo o jogo ao vivo , como já aconteceu gravei o lance no minuto 19 até 20 para ver se saia escanteio e aconteceu. porém novamente a Betano deu como perdido .enviei o vídeo da partida para o suporte e me informaram que nos dados oficiais o canto ocorreu aos 20 minutos !"
27,betano,Um amigo fez um pix atravez da conta bancaria dele e eu nao sabia que so poderia ser feito de conta do mesmo CPF. a questão é que ,pix-nao-foi-creditado-na-conta-betano-e-nem-estornado-para-a-conta-bancaria_11msIIRpUsZ-SceS,"Um amigo fez um pix atravez da conta bancaria dele e eu nao sabia que so poderia ser feito de conta do mesmo CPF. a questão é que até o presente momento  o valor nem foi estornado e nem creditado na minha conta Betano.O que ocorreu é que nao foi feito da conta com o mesmo CPF, porem ainda nao foi estornado.todas as vezes que entro em contato com o suporte, a mensagem de resposta é a mesma e limitada, ou seja sem continuidade e sem solução. "
28,betano,Estou fazendo uma reclamação aqui pois não estou conseguindo fazer login de maneira alguma em minha conta da Betânia a mais de 1 m,nao-consigo-fazer-login_ISVYcgWTfzkDI6Ds,Estou fazendo uma reclamação aqui pois não estou conseguindo fazer login de maneira alguma em minha conta da Betânia a mais de 1 mês ninguém me responde por email ninguém resolve ninguém responde no chat então vim aqui pq talvez através dessa ferramenta talvez eles resolvam logo
29,betano,"Não consigo logar. Já reiniciei, minha internet é top. E fala que dá problema de conexão. ",entrar-na-conta_Nfg1IVhlYkZ8I7sb,"Não consigo logar. Já reiniciei, minha internet é top. E fala que dá problema de conexão. "
30,betano,"Sempre dá problema a betano, e sempre ficamos no prejuízo porque perdemos o controle sobre nossas apostas, nem se quer dão satisfa",app-e-site-um-lixo_yTzGr7RHLF4pBfwP,"Sempre dá problema a betano, e sempre ficamos no prejuízo porque perdemos o controle sobre nossas apostas, nem se quer dão satisfação do que acontece, app e site um lixo, muito lento, bugs todo dia, de ontem pra hoje  toda hora sai da conta daí tem que desinstalar e instalar denovo pra funcionar, passa 30 minutos acontece tudo denovo, como pode existir uma plataforma two ruim assim ?"
31,betano,"Fiz uma solicitação de saque na empresa betano, já passou o prazo e nada de ser feito, já entrei em contato por todos meios mas se",solicitacao-de-saque_7mvjL640hDAoAV43,"Fiz uma solicitação de saque na empresa betano, já passou o prazo e nada de ser feito, já entrei em contato por todos meios mas sem solução, fala q saque este em andamento, pede prazo, passa do prazo e nada, fala que e por fluxo de solicitação por isso a demora, mas fiz já tem mais de 48 horas, fora atendimento não resolve nada, vc fica no mínimo 40 minutos, qnd e atendido não faz questão nenhuma, e-mail também lixo."
32,betano,Então ganhei uma aposta de 113 reais Quando fui fazer o saque saiu da minha conta da betano. E não caiu na minha conta pesso,fiz-um-saque_-EVqrmEsXpoTfP2z,Então ganhei uma aposta de 113 reais Quando fui fazer o saque saiu da minha conta da betano. E não caiu na minha conta pessoal tô entrando em contato só que não tenho resposta 
33,betano,Gostaria de relatar que a empresa Betano nao me pagou o valor de 300 reais até hoje. Sempre com textos e respostas prontas nunca r,apropriacao-indebita_gtrePExZn9zodgwn,"Gostaria de relatar que a empresa Betano nao me pagou o valor de 300 reais até hoje. Sempre com textos e respostas prontas nunca resolvem seu problema. Na hora que você perde eles pegam seu dinheiro na hora, agora para pagar não pagam direito. Não recomendo a empresa até que devolvam meu dinheiro , todos os dias reclamarei da empresa até que algo seja feito."
34,betano,Já estou há uma semana tentando sacar o dinheiro e eles não liberam alegando que tenho que apostar todo o valor depositado. Já fiz,saque-cancelado_BGlm0egx3q_F4V3K,Já estou há uma semana tentando sacar o dinheiro e eles não liberam alegando que tenho que apostar todo o valor depositado. Já fiz apostas acima do valor e continuam sem liberar o meu dinheiro. Uma vergonha!
35,betano,"Bom dia fiz o pedido de um saque , não efetuaram o saque pediram documentos para fazer o processo de verificação  só que tá uma de",processo-de-verificacao_nV7W6vV_FZS8UEPO,"Bom dia fiz o pedido de um saque , não efetuaram o saque pediram documentos para fazer o processo de verificação  só que tá uma demora para fazer o processo é eu Precisando fazer o saque,  isso depois de eu ter feito vários saques .  Porque não resolve isso logo "
36,betano,"O site estava dando erro o dia todo mais o saldo sempre voltava , derrepente sumiu 10 reais e não voltou mais , tentei entrar em c",site-tirando-meu-saldo-sem-jogar_wogtRKGzpjY7aVDM,"O site estava dando erro o dia todo mais o saldo sempre voltava , derrepente sumiu 10 reais e não voltou mais , tentei entrar em contato via e-mail via chat ao vivo e ninguém responde, somente mensagens automáticas . Ou seja se fosse mil reais estaria me fodendo pra reaver meu dinheiro , e não , eu não joguei todas minhas últimas 15 apostas foram green , o dinheiro somente sumiu do nada , quero reembolso pois isso é um absurdo agente já perde muito quando ganha eles tiram o dinheiro da gente . E-mail para contato : lucaslbwork@gmail.comUsuário: lucaslbwork"
37,betano,"Já foi enviado todos os documentos necessários, extrato bancário, conta de telefone, documento com foto e comprovante de residênci",bloqueio-de-saque_QaM7O3S8Nh4pOEUW,"Já foi enviado todos os documentos necessários, extrato bancário, conta de telefone, documento com foto e comprovante de residência e ainda não foi aprovado,  estou me sentindo oprimido já com essa situação. Preciso da aprovação. Sou. Cliente a mais de um ano."
38,betano,"Minha conta já estava verificada e do nada a betano solicitou um print da minha conta p4f, já enviei 8 prints e eles rejeiram sem ",empresa-nao-paga_-uylCYYfIjz4Zg5J,"Minha conta já estava verificada e do nada a betano solicitou um print da minha conta p4f, já enviei 8 prints e eles rejeiram sem falar o motivo apenas por não querer pagarFujam desse site pois existe vários sites que são sérios esses mesmo se resolver fazer o basico que é me pegar não vale a dor de cabeça que dar"
39,betano,"Bom resumidamente,resolvi tirar meu pouco dinheiro da Betano, um valor de 180 reais,dia 31/08 fiz o pix,hoje já são 03/09 e até ag",fiz-o-pix-para-minha-conta-e-a-betano-nao-me-pagou_hxV9dAbInWoihbmK,"Bom resumidamente,resolvi tirar meu pouco dinheiro da Betano, um valor de 180 reais,dia 31/08 fiz o pix,hoje já são 03/09 e até agora não caiu,já mandei vários e-mails no suporte deles e sempre respondem com uma mensagem automática pedindo mãos detalhes do problema,detalhe enquanto eu tava perdendo dinheiro tava tranquilo,foi só eu começar a ganhar um pouco que eles travaram minha conta me pedindo verificação,beleza mandei os documentos no aplicativo e fui verificado ficando apto a apostar,porém sempre dava errado,eu mandei pro suporte e sempre a mesma resposta automática,aí resolvi tirar meu dinheiro,e tipo eles não pagaram e já tem 72 horas isso sendo que eles mesmos falam que demora de 30 a 1hora para cair o pix."
40,betano,"Tive um problema (no qual foi relatado no suporte do site e nada foi feito) no qual abri uma aba do cassino, quando estava só obse",usuario-da-plataforma-sendo-prejudicado_HDSsIt8OjYqMvgTC,"Tive um problema (no qual foi relatado no suporte do site e nada foi feito) no qual abri uma aba do cassino, quando estava só observando, fui fechar a aba do safari e sem querer foi apostado toda minha banca, sendo que foi em algo que nunca fiz, e nessa mesma opção de aposta tem a opção de cancelar/corriger( eu tinha 15 segundos para corrigir )foi creditado todo o meu valor da minha banca em uma aposta q eu nao queria e não me deram a opção de corrigir , sendo que eu tinha 15 segundos no cassino, entrei em contato no suporte e nada lá foi feito. Sempre acreditei na credibilidade da casa de aposta(Betano), mas nesse caso deixou muito a desejar. Nunca reclamei fora da minha razão, mas nesse caso, estou muito insatisfeito com as decisões que o suporte/Betano tomou."
41,betano,"O App e o site param propositalmente pra que percamos dinheiro em meio às partidas, o dinheiro que vc ganha em bônus e quase impos",propaganda-enganosa_jcVuk3QtpKzQzFWD,"O App e o site param propositalmente pra que percamos dinheiro em meio às partidas, o dinheiro que vc ganha em bônus e quase impossível de tirar. Mas o dinheiro que vc deposita é descontado em jogos que deveriam usar primeiro os bônus. O Jogo aviador que é altamente divulgado pelas redes social como meio de multiplicar dinheiro,  trava pra que vc não consiga parar a tempo e perder . Assim como a própria plataforma Trava e fica te enviando redefinição  de senha pra perder tempo. Muito abuso e falta de respeito com gente humilde que se ilude achando que vai conseguir uma renda extra. Não respondem e-mail ainda por cima. Quero meu dinheiro de volta !!!"
42,betano,Faz dois dias que estou tentando realizar meu saque e o mesmo não entra em processamento. Ninguém me responde no chat ,saque-nao-entra-em-processamento_0esLdgI8wdje6bQH,"Faz dois dias que estou tentando realizar meu saque e o mesmo não entra em processamento. Ninguém me responde no chat e quando tentei enviar um e-mail, me responderam com um assunto sobre reativação de conta "
43,betano,Comprei um celular e perdi a senha do meu e-mail e não tou conseguindo entrar no aplicativo mais  e não tenho mais o número de cel,nao-consigo-entrar-no-aplicativo_KqqHK_XVFOtQ0Efz,Comprei um celular e perdi a senha do meu e-mail e não tou conseguindo entrar no aplicativo mais  e não tenho mais o número de celular
44,betano,"Hoje 2 de setembro ganhei em 2 apostas que fiz neste site.quando acabou,pra meu espanto eles colocaram que foi nulo.tudo isso depo",nao-confie-neste-site-de-apostas_lc0J06kak_ut-BAJ,"Hoje 2 de setembro ganhei em 2 apostas que fiz neste site.quando acabou,pra meu espanto eles colocaram que foi nulo.tudo isso depois do resultado concretizado.entrei no chat pra reclamar,3 hs e 45 minutos pra ser atendido.no meio do atendimento, sumiram e não deu mais explicações.o que faço?meus amigos já tinham falado pra não cadastrar neste site que eu teria problema.nao ouvi-los, tá aí o problema."
45,betano,Estou jogando Aviator e ganhando dinheiro. A cada lance ganho a BETANO não atualiza meu saldo na casa. Aí quando eu saio da plataf,betano-nao-ta-creditando-apostas-ganhas_oGJyKT9rv88KXE5R,"Estou jogando Aviator e ganhando dinheiro. A cada lance ganho a BETANO não atualiza meu saldo na casa. Aí quando eu saio da plataforma a aposta que fiz sai do Histórico de apostas. Simplesmente somem com as minhas apostas ganhas. Eu como já sabia que isso tava acontecendo bastante nessa noite 02/09/22, resolvi gravar e tirar vídeos da tela antes de sair, estou com as provas aqui que foi apostado e que vocês ainda não creditaram meus 1.000 reais a mais. Quero esse dinheiro, tratem de serem certos e honestos. Tenho vídeos e fotos."
46,betano,Eu ganhei um valor no jogo da betano e eles manda para uma conta no seu CPF que eu estou cadastrado. Mas não sei pra qual conta el,saque-do-meu-dinheiro_xFJ18No5nJON-Xvt,"Eu ganhei um valor no jogo da betano e eles manda para uma conta no seu CPF que eu estou cadastrado. Mas não sei pra qual conta ele mandou porque eu tenho muita conta, e isso e errado, tem que ter a opção de cadastrar uma conta para essas opções que vc ganha e já vai direto na conta conta. e até agora não recebi nada."
47,betano,"Fiz dois saques o primeiro sumiu e nem voltou pra conta da betano, chat não respondem que sacanagem quero meu dinheiro. ",saque_LomMbn42bRdX7vLY,"Fiz dois saques o primeiro sumiu e nem voltou pra conta da betano, chat não respondem que sacanagem quero meu dinheiro. "
48,betano,Boa noite Betano. Tive problemas no jogo de ontem entre atlético go x São Paulo. Na partida em questão apostei que iria ter ,problemas-com-o-suporte-betano_hfvaARga1cGX2Kxm,"Boa noite Betano. Tive problemas no jogo de ontem entre atlético go x São Paulo. Na partida em questão apostei que iria ter menos de 8.5 cartões no total. Após verificar em todos os sites oficiais inclusive o da próprio comenbol verifiquei que teve 6 cartões amarelo e 1 vermelho na partida. Ou seja 8 cartões no total. Porém a aposta foi dada como perdida. Preciso que verifique por favor, tentei resolver pelos canais de atendimento porém sem êxito. Id 2477312101id 2477299548"
49,betano,No dia 5/8 eu efetuei um depósito no site da BETANO para poder fazer apostas. Porém por uma emergência familiar eu preciso sacar o,betano-nao-deixa-voce-sacar_wga52N38IQ7XnxE-,No dia 5/8 eu efetuei um depósito no site da BETANO para poder fazer apostas. Porém por uma emergência familiar eu preciso sacar o dinheiro e eles falam que eu preciso apostar todo o dinheiro depositado para poder sacar. Eu preciso do meu dinheiro com urgência pois tenho prazo para efetuar um pagamento. Então eu apostei tudo em uma única aposta quase perdi e mesmo assim eles não liberam meu saque pois tenho que fazer mais apostas com o valor total depositado
