,company_name,description,href,full_complain
174,kto-sportsbook-betting-casino-online,"Já exclui minha conta nessa péssima plataforma de apostas, onde não valorizam seus clientes, são ambiciosos demais, se valem de re",importunacao_OD_ickkpAUm5sXEk,"Já exclui minha conta nessa péssima plataforma de apostas, onde não valorizam seus clientes, são ambiciosos demais, se valem de regras criadas e termos  que ninguém lê para contornar algum tipo de ganho do usuário. Pois bem, diante da decepção que me causaram, e ao meu ver injustiça, exclui minha conta, porém continuam me importunando com e-mails que instigam a jogar, mesmo não tendo mais conta, estão me importunando demais com essas promoções de casino e jogos de futebol, não quero mais negócio algum com vocês, nem no futuro, Espero que excluam meu e-mail da lista de vocês, estão me perturbando."
175,kto-sportsbook-betting-casino-online,"Sou um apostador viciado, compulsivo, em recuperação. Já perdi muito nessa vida através das apostas esportivas. Fiquei cerca de 6 ",falta-de-respeito-e-sensibilidade-com-pessoas-doentes-viciadas_kkmQjMn4WqBQCXrm,"Sou um apostador viciado, compulsivo, em recuperação. Já perdi muito nessa vida através das apostas esportivas. Fiquei cerca de 6 meses limpo no segundo trimestre de 2021, quando com o novo surto de covid trouxe a insegurança e varias incertezas no âmbito profissional e tive uma recaída severa. Um dos poucos sites que eu ainda não havia pedido a auto exclusão era a kto, e derreti o pouco que havia economizado nos meses sem jogar. Primeiramente eu acho que todas essas casas tem acesso aos dados dos jogadores e deveriam impedir a ação de pessoas com o histórico de compulsividade. Mas o que mais me espantou, foi que apos o meu pedido de socorro e encerramento da conta, continuaram me enviando e-mails estimulando que eu jogasse, aproveitasse meu bonus, saldo, e não foi uma vez. Tenho todo o histórico de e-mail, histórico de depósito e prints de apostas. Desejo um acordo pela devolução do valor queimado compulsivamente em 4 ou 5 dias, ou entrarei com um processo pelos emails enviados estimulando o uso da conta mesmo após o encerramento da mesma."
176,kto-sportsbook-betting-casino-online,"Fiz uma aposta no valor de 225,00 reais no jogo Bacara cassino online no dia 30/01/2022 , deu vitória porém não foi pago o prêmio ",aposta-nao-paga_QRCJ0LRgRkaC_m0l,"Fiz uma aposta no valor de 225,00 reais no jogo Bacara cassino online no dia 30/01/2022 , deu vitória porém não foi pago o prêmio de 463,00 , ao invés disso retiraram o valor da minha carteira deixando minha conta zerada , mandei email ao suporte e não me responderam e nem estornaram o meu valor ganho ."
177,kto-sportsbook-betting-casino-online,Primeira parabéns america mg pela vitória na copinha apostei minha fixa na vitória  de vocês !!!nos espaço em que há mídia deu há ,editado-pelo-reclame-aqui-do-br-kto_3al-PD3Xhcw9d9zS,Primeira parabéns america mg pela vitória na copinha apostei minha fixa na vitória  de vocês !!!nos espaço em que há mídia deu há vocês pra divulgar nos comentários o [Editado pelo Reclame Aqui] que essa casa aposta me deu!!! anulo uma aposta limpa feita na confiança! É difícil em 3três resultado vc aceitar o resultado exato! ninguém tá na casa de aposta pra perder quando ganha!! isso tudo se resume em [Editado pelo Reclame Aqui] nada + nada - que um [Editado pelo Reclame Aqui] licido falando nisso câmera dos deputados federal ta na hora de recular esses site de aposta no Brasil pra eles sofrem as consequências da lei!! Pra não fica terra de ninguém ele agem ao Bel prazer !!! parem de manda imposto pra fora do Brasil esse site de aposta são os verdadeiros [Editado pelo Reclame Aqui] do Br @KTO !!!
178,kto-sportsbook-betting-casino-online,Fiz uma aposta e acertei os resultados mas não recebi e na aposta aparece que errei o resultado do jogo da Inter de Milão,joguei-na-inter-de-milao-e-nao-ganhei-a-aposta_iR1NVVYAGMyZ97sn,Fiz uma aposta e acertei os resultados mas não recebi e na aposta aparece que errei o resultado do jogo da Inter de Milão
179,kto-sportsbook-betting-casino-online,"Já jogo no KTO a mais de um ano!Sei muito bem que quando a gente está ganhando uma aposta, pita a chance de um cashout. ",editado-pelo-reclame-aqui-na-kto_9qbSfLCiVQcjVHwZ,"Já jogo no KTO a mais de um ano!Sei muito bem que quando a gente está ganhando uma aposta, pita a chance de um cashout. Aconteceu uma coisa muito estranha hoje. Fiz uma aposta combinada de três. Um deles aconteceu a tarde e ja tinha acertado. Nos jogos da noite um dos jogos atualizava na pagina da KTO, mas na minha aposta não..não apareceu ao vivo, nem os gols que iam acontecendo. Depois de uns 30 min dos dois jogos que fechavam a minha combinada, um dos jogos já estava 2 x 0 e o outro 3 x 0. Esse último porem, sem atualizar. Fiz contato com a KTO, pois percebi que não atualiza, parecendo que o jogo nem tinha iniciado, e tbm com isso não estava dando a chance de retirar um valor - que no momento, pela experiência que tenho, já seria umas 2 ou 3 vezes o valor de minha aposta. Como esse jogo em questão não atualizou na minha aposta, tbm não apareceu em nenhum momento o cashout. Passado o tempo o jogo que estava 2 x 0 ficou 2 x 1. E a chance do cashuot? Eu ja estava em contato novamente com a KTO pedindo porque aquele jogo não atualizava quando aos 47 minutos o jogo empatou 2 x 2. E o cashot? Não apareceu porque até agora, 30 min deois do jogo encerrado, na minha aposta aquele jogo em questão não iniciou..nada aconteceu.."
180,kto-sportsbook-betting-casino-online,Olá boa noite ganhei um valor e não consigo resgatar enviei todos os documentos e não aceitaram meu comprovante de residência que ,kto-burocracia_vLiKJ3udXqNM0mcY,"Olá boa noite ganhei um valor e não consigo resgatar enviei todos os documentos e não aceitaram meu comprovante de residência que de banco e me responderam que não aceitam em nome do meu pai gente eu moro com meu pai água luz Internet em nome dele , aí falaram que não pode ser em nome de terceiros ! Terceiros ? É meu pai ,se arrependimento matasse  ...tinha colocado no meus 50,00 no concorrente !Pediram pra reconhecer em cartório .. perder tempo e pagar quase 40,00 pra reconhecer um comprovante que vai servir só pra isso estão de brincadeira só pode .Quero que aceitei meu comprovante de residência em nome do meu pai. Vão me enviar um presente que querem o endereço? Bem desnecessário ."
181,kto-sportsbook-betting-casino-online,Apostei em vitoriado boca juniors contra o colo colo resultado (2x0 para o boca) e vitória do Nacional do uruguai contra o nublenc,o-time-que-eu-apostei-venceu-o-jogo-e-eu-n-recebi-o-pagamento_ccQgkuUUAI1BBUrv,"Apostei em vitoriado boca juniors contra o colo colo resultado (2x0 para o boca) e vitória do Nacional do uruguai contra o nublence, resultado (6x4 para o navional) não recebi o premio e consta no site como derrota do nacional. 17/01/2021"
182,kto-sportsbook-betting-casino-online,"Fiz um depósito pra terceiro via pix, o prêmio deste no caso meu tio foi confiscado por violação dos termos, o valor inicial da ap",burocracia_c0RPl-7lxg5WrJ6W,"Fiz um depósito pra terceiro via pix, o prêmio deste no caso meu tio foi confiscado por violação dos termos, o valor inicial da aposta foi estornado para a conta do titular do pix, no caso eu que já havia excluido a conta, pois aposto em outras plataformas, pois bem, após 5 emails enviando dados bancários, a KTO me pede os mesmos dados já enviados, parece que fazem para irritar a gente, acabei me estressando e desisti desse dinheiro, nem quero mais, só quero compartilhar com as pessoas que existem casas de apostas que valorizam mais seus clientes. E outra, deveria ser nominal o pagamento dos boletos para depósitos, apenas para o titular da conta pagar mediante apresentação de documento com foto, pois se via pix é proibido, por boleto também deveria ser, pois pode falicitar a lavagem de dinheiro."
183,kto-sportsbook-betting-casino-online,"bom dia, veio por meio deste informa na qual a kto site de apostas aonde eu e meus colegas de trabalho colocamos dinheiro para faz",nao-querem-me-pagar_S0mHkS7SV5uS7_Km,"bom dia, veio por meio deste informa na qual a kto site de apostas aonde eu e meus colegas de trabalho colocamos dinheiro para fazer apostas, como eu não possuia pix, um de meus colegas, fez a transferencia. hoje tenho um valor x la e o mesmo não querem me liberar o saque. alegando que foi feito tranferencia por terceiros.. ja mandei todos os dados solicitados e ainda não querem liberar.. e ainda mais bloquearam minha conta.. "
184,kto-sportsbook-betting-casino-online,"Fiz uma aposta no jogo de Real Madri e Barcelona, onde o jogo terminou 3x2 para o Real. A Banca não pagou a aposta alegando que de",sendo-editado-pelo-reclame-aqui-pela-empresa_5FHgLeQT1m0jbeN0,"Fiz uma aposta no jogo de Real Madri e Barcelona, onde o jogo terminou 3x2 para o Real. A Banca não pagou a aposta alegando que deu empate no tempo normal descumprindo o critério da FIFA e da própria competição."
185,kto-sportsbook-betting-casino-online,"Fiz uma aposta de R$ 50,00 sendo que estava com saldo de R$ 100. Sendo assim, deveria ter ficado com um saldo de R$50 após a apost",aposta-duplicada_nDmkKMKsCdq90CC9,"Fiz uma aposta de R$ 50,00 sendo que estava com saldo de R$ 100. Sendo assim, deveria ter ficado com um saldo de R$50 após a aposta. Porém, para minha surpresa quando peguei o celular novamente para ver o resultado, a mesma aposta havia sido realizada duas vezes (duplicando a mesma aposta, exatamente a mesma). Entrei em contato com a KTO para estornar a segunda e identica aposta, pois foi duplicada de alguma forma pelo APP deles, porém a única forma de contato é por um chat que não resolver o problema.Solicito o estorno desta segunda aposta, pois eu não concordo em ter que arcar com esse prejuízo por falha da plataforma deles KTO."
186,kto-sportsbook-betting-casino-online,"Recebi um pix de um terceiro na conta da kto porém dinheiro nao entrou, solução urgente!E-mail cadastrado: lucaswillian1594@",recebi-um-pix-de-terceiros-porem-dinheiro-nao-entrou-na-conta_H_ZcYVnmFbE4z_tV,"Recebi um pix de um terceiro na conta da kto porém dinheiro nao entrou, solução urgente!E-mail cadastrado: lucaswillian1594@gmail.com "
187,kto-sportsbook-betting-casino-online,Bom dia ! Não é a primeira vez que venho notado que o site do KTO trava o placar para não aparecer quem está ganhando.,placar-nao-confere_BGzl9THrBdF3Ksp3,"Bom dia ! Não é a primeira vez que venho notado que o site do KTO trava o placar para não aparecer quem está ganhando.No jogo de hoje 12/01 as 8:35 Qingdao Eagles vs. Xinjiang Flying Tigerso jogo estava no meio do terceiro quarto, e no jogo de aposta estáva marcando intervalo ainda! Ou seja, não podendo fazer alteração! Vocês simplesmente seguraram o placar para parecer que o outro time tinha deslanchado. Entrei em outro site de aposta, e verifiquei que o outro site o cronômetro estava andando 5 minutos na frente, e o da KTO estava travado! Fui ver o jogo on-line, e vi também que estava igual o outro ! Ou seja, a KTO pausou porque o time tinha abrido, e espero ver o que iria acontecer !Eu perdi o meu dinheiro por um erro prejudicial de vocês! Eu poderia ter parado de o cronômetro de vocês estivessem certos! Por favor, quero meu dinheiro de volta! Pois o sistema de vocês me prejudicou! E prometo não indicar a ngm se isso acontecer novamente!No anexo mandei e comprova que está errado ! Só ver o tempo "
188,kto-sportsbook-betting-casino-online,"para receber o valor que apostei a kto requerer documentos para fazer a transição, eu mandei meu comprovante de endereço que pegue",comprovante-de-endereco-rejeitado_hfwy64b-kkUxkYUf,"para receber o valor que apostei a kto requerer documentos para fazer a transição, eu mandei meu comprovante de endereço que peguei com meu banco, tirei foto e só falta isso para eles me liberarem recuperar o dinheiro da aposta, e eles mandam um e-mail eletrônico dizendo que não aceitam meu comprovante de residência e colocam as regras a baixo para seguir, nao consigo saber o que nao foi aceito e nem o que preciso refazer para conseguir recuperar o dinheiro"
189,kto-sportsbook-betting-casino-online,"Me cadastrei na KTO a poucas semanas e realizei um depósito de 100 Reais. Não informei dados bancários , uma vez que não havia gan",minha-experiencia-com-a-kto_xrsJuMNFwZTLb5s_,"Me cadastrei na KTO a poucas semanas e realizei um depósito de 100 Reais. Não informei dados bancários , uma vez que não havia ganho nada nas apostas que realizei durante as poucas semanas que havia me cadastrado. Só havia apostado na Malandrinha, ou seja em futebol. Domingo 09/01/2022 tinha 26 Reais de crédito e realizei 3 apostas de 2 Reais no Score4 , também de futebol. Sobrou 20 Reais na minha conta. No mesmo Domingo , por volta das 20hs tentei entrar na minha conta , mas a senha de acesso não entrava e dava erro. Fiquei confuso achando que havia esquecido algum dígito e pedi para redefinir minha senha. Redefini . criei outra senha e consegui entrar. Para minha surpresa meu saldo de 20 Reais estava em  0 (Zero) Real. Meus 20 Reais haviam sumido! Comuniquei o ocorrido via CHAT e recebi a resposta que ""eu"" havia gasto os créditos em esportes e cassino. Informei que só havia realizado até então apostas em futebol e jamais em cassino e informei que haviam pedido a redefinição da minha senha sem o meu consentimento , configurando assim uma invasão na minha conta por terceiros (Traders/Hacker) que ficam operando nos cassinos. Recebi como resposta que eles "" lamentavam"" o ocorrido, mas não podiam fazer nada , uma vez que a responsabilidade era minha em proteger meus dados de terceiros. Informei que navego na INTERNET há mais de 20 anos e sou cadastrado em contas de diversas instituições diferentes e jamais havia acontecido algo semelhante, e que estava na KTO a poucas semanas e já haviam surrupiado meu saldo da minha conta. Recebi novamente uma manifestação ""lamentando"" o fato , mas que eles não podiam fazer nada a respeito e que a responsabilidade era minha. Ou seja; eles lavam as mãos e o ônus do prejuízo é do usuário. Moral da história : Fui [Editado pelo Reclame Aqui] em 20 Reais, se fosse levado adiante um investigação contra [Editado pelo Reclame Aqui]s cibernéticos , provavelmente , com o e-mail que tenho da data e hora da redefinição da minha senha, encontrariam o ID de quem fez o [Editado pelo Reclame Aqui] e o nome da pessoa que provavelmente continua apostando na KTO. seria no mínimo descredenciada da KTO e sofreria sanções da Justiça. Não sou cadastrado em outro SITE de apostas e não sei como eles funcionam. Sei com a KTO funciona ! Perdi 20 Reais e valeu cada centavo perdido, pois ganhei o conhecimento que não mais utilizarei este SITE de apostas! Os 20 Reais que perdi me livraram de poder ter perdido muito mais, caso tivesse em minha conta um montante maior. Resumo : Abram os olhos com esse SITE e tomem muito cuidado com o dinheiro que empregarem no portal !! Hoje perdi 20 reais , mas com certeza não perderei mais nenhum centavo na KTO , pois jamais utilizarei novamente esse portal de apostas! "
190,kto-sportsbook-betting-casino-online,"Fiz cadastro na KTO, fiz algumas apostas e decidi não jogar mais, para minha surpresa quando fui sacar descobri que não podia saca",esquema-de-ganho-kto_cFfglxuiiA6uCjQo,"Fiz cadastro na KTO, fiz algumas apostas e decidi não jogar mais, para minha surpresa quando fui sacar descobri que não podia sacar um valor inferior a R$100,00, como tinha R$80,00 no site fiz uma nova transferência de R$30,00 para atingir o valor do saque, e uma nova surpresa não poderia sacar o dinheiro pois eu tenho que apostar qualquer valor colocado antes de poder retirá-lo, e pra completar o esquema não pode ser qualquer aposta tem q ser uma aposta que pague ao menos 1,7 ou seja uma aposta mais arriscada que tenha mais possibilidade de você perder seu dinheiro esses termos com certeza estão misturados no meio do enorme contrato que aceitamosObrigado KTO por ludibriar seus clientes. "
191,kto-sportsbook-betting-casino-online,"Coloquei 30 reais no site KTO. E não abre mais o site de jeito nenhum, quero meu dinheiro de volta ",kto-apostas_s-kkD4MtDsEYbh6R,"Coloquei 30 reais no site KTO. E não abre mais o site de jeito nenhum, quero meu dinheiro de volta "
192,kto-sportsbook-betting-casino-online,"Fazem 3 meses que tento sacar meus ganhos na kto e não consigo!!!Quando me cadastrei, por descuido meu saiu o nome de minha ",kto-nao-pagou-meus-ganhos_fSAxs_mxTySd0NCu,"Fazem 3 meses que tento sacar meus ganhos na kto e não consigo!!!Quando me cadastrei, por descuido meu saiu o nome de minha esposa então quando tentei sacar eles me pediram a confirmação dos dados mandei meus dados não aceitaram, tentei sacar novamente e eles me informam que a conta tem que estar no nome do titular, em seguida mandei os da minha esposa e não aceitaram também. então eles me trancaram o login depois de outras 2 tentativas me liberaram novamente meu login e no dia 2 de janeiro tentei novamente realizar um saque de 800,00 e aí eu achando que estava tudo certo, para minha surpresa não! Tentei contatos por chat,email e Instagram, mas todos sem sucesso, Sendo os mesmos atendentes para todos canais..As desculpas mudam e se contradizem todas as vezes na primeira vez era que não poderia sacar sem ser o nome do titula, a segunda era os documentos e agora pra minha surpresa eles dizem que o depositante teria que ser o titular que por isso eles não podem pagar e ainda retiraram meus ganhos!!!Ainda tem mais, conferindo meu e-mail eles mandaram um email que para dar continuidade no saque eu deveria informar o documento de quem fez o depósito, encaminhei o documento e eles não aceitaram!!! Alegam que tem outra conta com esse nome ( mas não tem nenhum documento) estranho né? Ainda por cima ela passaram os 60,00 que fiz de depósito para essa conta e não aceitam que eu troque o nome desta conta que eu tinha de crédito 800,00. Tenho imagens e prints do FAQs deles que diz que pode ser trocado o nome do jogador caso tenha sido preenchido errado, mas desde o início eles não aceitaram os meus. A grande questão é que eles nao gostam de pagar !!!!!"
193,kto-sportsbook-betting-casino-online,Fiz o meu pix que sempre cai em alguns minutos e dessa vez nada simplesmente me descontaram no Pix e não me deram o crédito no jog,pix-nao-caiu_NsLd3TYodtOi8XxA,Fiz o meu pix que sempre cai em alguns minutos e dessa vez nada simplesmente me descontaram no Pix e não me deram o crédito no jogo 
194,kto-sportsbook-betting-casino-online,"Fiz uma nova conta na KTO e depositei 100 da minha própria conta. Fiz em 1 dia 312,00 e optei por sacar 180,00.Recebi a info",dinheiro-confiscado_021XA7oaG28C894X,"Fiz uma nova conta na KTO e depositei 100 da minha própria conta. Fiz em 1 dia 312,00 e optei por sacar 180,00.Recebi a informação que o saque não foi realizado por que tinha 2 contas ativas e que infringe o regulamento.Isso é um absurdo autoritarismo total. Ganhei o meu dinheiro normal sem [Editado pelo Reclame Aqui]s não vejo motivo algum para o usuário ter apenas uma conta ativa.KTO informa que caracterizou [Editado pelo Reclame Aqui], [Editado pelo Reclame Aqui] de que sentido? Pedi para depositarem em minha própria conta no meu CPF não tem terceiros envolvidos, apenas criei uma nova conta com os meus mesmos dados.KTO peço por gentileza que revise o caso."
195,kto-sportsbook-betting-casino-online,Ganhei meus jogos e meu dinheiro não entra não tenho retorno um descaso com o cidadão ,dinheiro-nao-entra_5QS-Li1_QN6JDkUp,Ganhei meus jogos e meu dinheiro não entra não tenho retorno um descaso com o cidadão 
196,kto-sportsbook-betting-casino-online,A página não carrega e acabei de depositar dinheiro lá pra fazer as aposta,kto-paro-de-funcionar_hHKcfkosCzATjXhH,A página não carrega e acabei de depositar dinheiro lá pra fazer as aposta
197,kto-sportsbook-betting-casino-online,"Bom dia, já fiz muitos pix para amigos ou parentes que não tinham dinheiro em conta na hora para jogar, ou simplesmente não queria",pix-realizados-por-terceiros-nao-vale_CIcq8Kzcr1Ek2Nrd,"Bom dia, já fiz muitos pix para amigos ou parentes que não tinham dinheiro em conta na hora para jogar, ou simplesmente não queriam que tal lançamento aparecesse em seu extrato bancário, pois já dava treta com a esposa em casa. Eu mesmo já pedi para fazerem pra mim por não ter saldo bancário, mas tinha dinheiro vivo. O que acontece é que nunca tive problemas ou soube de alguém que teve um confisco de prêmio por tal forma de depósito, sempre foi aceito de boa, agora depositei para meu tio, metade de cada um para fazermos uma fezinha, na conta dele, para jogar o jogo monopoly live, ganhamos 2500,00 reais , mas o prêmio foi confiscado por violar os termos, onde o depósito precisa ser feito pelo titular da conta, se está nos termos não tem o que discutir, a questão é , e as apostas perdidas? Ele não usa chave pix, tem receio de sofrer algum [Editado pelo Reclame Aqui], nem caixa eletrônico usa, sempre saca dinheiro na lotérica. Agora por que todas as vezes que foi depositado pix na sua conta foi aceito? Todas as apostas perdidas foram aceitas? Não queremos mais esses 2500, só pedimos que a empresa tenha algum sistema onde não aceite mais depósitos de natureza de terceiros para outra conta, e mais , sabemos que existe muita gente que cria conta para caçar bônus em várias casas, mas esse não é o caso, essa conta já tinha quase um ano de atividades. Para finalizar o assunto, quando se fala em vantagens para o cliente , Indico a todos a BET 365 e a Betano, pagamento de saque em até 1 hora para o cliente, não em 4 dias, daí não dá tempo de você cancelar o saque e reapostar tudo denovo. Sem falar em várias outras vantagens , como ganhar uma aposta se o time abrir 2 gols de vantagem, missões que te devolvem 50% da aposta, perdendo ou ganhando, rodadas grátis nos casinos, por aí vai. Não tenho nada contra a KTO, perdi muito lá já, acho que mais de 20 mil de janeiro de 2021 pra cá, enfim, agradeço por esse confisco, não aposto mais, larguei tudo de mão, e meu tio também."
198,kto-sportsbook-betting-casino-online,"Bom dia, meu tio e eu por vezes apostamos juntos, ou apenas ele, ou ele e mais algum familiar ou conhecido, apostando alto por vez",confisco-de-premio_0y6Z5GKDZajmz7tF,"Bom dia, meu tio e eu por vezes apostamos juntos, ou apenas ele, ou ele e mais algum familiar ou conhecido, apostando alto por vezes, sempre fiz os depósitos ( pix) para podermos jogar, ou por outras vezes ele fazia por intermedio de algum conecido ou outro familiar, isso porque nem chave pix ele tem pra fazer. Pois bem, 95% das apostas foram perdidas, não sabemos o valor exato de perdas totais, mas foram muitas .  Pois bem, dessa vez demos sorte, ganhamos 2500 reais, após 4 dias fomos ver o status do prêmio, se já havia sido pago, e para a surpresa, estava como rejeitado, ao contatar um atendente online, o mesmo disse que foi confiscado devido ao depósito feito para jogar, ter sido feito por outra pessoa, que não o titular da conta, achei um absurdo, pois nao muda em nada o fato de o dinheiro estar lá depositado, sendo que se fosse por boleto bancário, daria no mesmo outra pessoa pagar na lotérica. E as apostas que perdemos, porque não nos devolveram todas? Quando é pro lado do cliente não vale, muito decepcionado com isso tudo. O pix entra rápido na conta, por isso fazíamos, tenho muitos amigos que fazem pix uns para os outros não só na KTO, mas em outras casas de apostas, todas aceitam, e o saque sempre foi para a conta do titular. Talvez devam analisar os depósitos antes de as apostas acabarem, para evitar  isso de alguém ganhar e não receber, o criterio foi usado para beneficio da empresa em questão, enfim , apostas tantas perdas, uma hora ganhamos, daí eles viram que não podia usar pix de outra pessoa para depositar."
199,kto-sportsbook-betting-casino-online,"A KTO da 10 reais de Presente,  mas tem q depositar 30, reais pra ganhar os 10, reais, claro mais 30, Isso não é Presente,  ",presente-da-kto-q-temos-q-depositar_HCJwX0X_WNacT9FN,"A KTO da 10 reais de Presente,  mas tem q depositar 30, reais pra ganhar os 10, reais, claro mais 30, Isso não é Presente,  isso é obrigar o apostar a depositar. Consideram isso inviável."
200,kto-sportsbook-betting-casino-online,"Fiz uma solicitação de saque dia 15 . 12 . 21 , não recebi ainda , já fazem 7 dias. ",saque_e1K4toLlqP-xL1WF,"Fiz uma solicitação de saque dia 15 . 12 . 21 , não recebi ainda , já fazem 7 dias. "
201,kto-sportsbook-betting-casino-online,"Pediram para mandar documentos (comprovante de residência e RG ou CNH),mandei e não foram aceitos,quando soube então pedi para o e",quero-o-meu-dinheiro_HS-1ZClpzuCmzklj,"Pediram para mandar documentos (comprovante de residência e RG ou CNH),mandei e não foram aceitos,quando soube então pedi para o encerramento da conta quer dizer minha conta já estava bloqueada,com apostas que não conseguia acompanhar.. Entrei em contatos diversas vezes e não consigo sempre pedindo dados eu não quero fazer cadastro ,quero meu dinheiro!!! Já faz uma semana e nada ainda sendo que quando tu faz o pix?Eles pedem RG? Comprovante de residência?Carteira de vacinação???Mais uma vez peço para depositar o meu dinheiro e isso!!!Desde já Agradecido gilbertoissler1@gmail.com!!!"
