,company_name,description,href,full_complain
0,kto-sportsbook-betting-casino-online,"Fiz uma aposta aos 87 minutos de Brusque X Vasco, A janela do jogo mostrava o placar de 1 a 1, gol do Brusque aos 26 minutos do pr",fui-enganado_t2I6KcFDm_DtjTNA,"Fiz uma aposta aos 87 minutos de Brusque X Vasco, A janela do jogo mostrava o placar de 1 a 1, gol do Brusque aos 26 minutos do primeiro tempo marcado por G. Taliari e o gol do Vasco aos 55 minutos por A. Teixeira. Estava pagando 7 X 1 para o empate. Diante do cenário. Apostei R$ 5,70, caso o empate se confirmasse ganharia R$ 39,90. Porém o jogo acabou e fui surpreendido com a perca da aposta, pois o jogo acabou 1 X 0  para o brusque. Oras, como 1 a 0 se o jogo estava 1 X 1. No chat o atendente Me disse que foi um erro, porém a KTO não se responsabiliza por esses erros. Como não se responsabiliza, sou induzido a erro, perco dinheiro e casa ganha com o erro deles. "
1,kto-sportsbook-betting-casino-online,"Esse empresa pratica jogo de azar, no jogo aviator, quando vc faz a aposta o avião sai antes do jogo começar, fazendo um apostador",aviator-jogo-de-azar_xHHdkPLq6TTz-elq,"Esse empresa pratica jogo de azar, no jogo aviator, quando vc faz a aposta o avião sai antes do jogo começar, fazendo um apostador perder tudo. Vou fazer a denuncia para as autoridades competentes. "
2,kto-sportsbook-betting-casino-online,"Já estou a 4 dias tentando sacar meu dinheiro nessa casa de apostas e esperei 24 horas e meu saque foi recusado, saquei normal sem",saque--me-ajudem-por-favor_3qjRQCGNMsztO7PB,"Já estou a 4 dias tentando sacar meu dinheiro nessa casa de apostas e esperei 24 horas e meu saque foi recusado, saquei normal sem ser pix o dinheiro também não cai na conta,só quero receber meu dinheiro e não jogar nunca mais com vocês .na hora de depositar cai na hora .pra sacar , não conseguimos receber"
3,kto-sportsbook-betting-casino-online,Sou mais um que está encontrando dificuldades para sacar o que ganhei forma justa nessa casa de aposta. Quando viram que eu estava,saque-retido-e-demora-para-verificacao-da-conta_5EHpjDUtU0Jk-La-,"Sou mais um que está encontrando dificuldades para sacar o que ganhei forma justa nessa casa de aposta. Quando viram que eu estava ganhando, eles simplesmente aplicaram o tal do contratinho e suas cláusulas para evitar que me pagassem, então pediram documentos que foram enviados, pois que até o momento não fizeram a verificação da mesma. Nem bancos do nosso dia a dia demora tanto assim. Com self e tudo mais, estão praticando abusos contra o consumidor. Está na hora do Ministério Público entrar com força para verificar tais casas que praticam isso. O detalhe que para depósitos não há nenhuma restrição ou pedem documentação, que nesse caso seria o mais certo, pedir os DOCS"" na hora de depositar. Sei que muitos já estão ajuizando contra essa casa de aposta. Quero meu problema resolvido KTO."
4,kto-sportsbook-betting-casino-online,"Boa tarde, apostei em mais de 0,5 cartões para equipe visitante. Equipe tomou um cartão amarelo e eu recebi a aposta, após um perí",editado-pelo-reclame-aqui_IJrFojbT7u8RmDQx,"Boa tarde, apostei em mais de 0,5 cartões para equipe visitante. Equipe tomou um cartão amarelo e eu recebi a aposta, após um período fui ver e minha conta ficou negativa e aposta foi ANULADA. Isso é um [Editado pelo Reclame Aqui], o odds não estavam errados. Não havia erro nenhum. Se eu tivesse perdido teria que pagar.Eu exijo ressarcimento da aposta, eu venci ela. Caso contrário vou postar em todas minhas redes sociais, no reclame aqui e não nunca mais jogo na cas. É um direito meu e exijo ser ressarcido Aposta: ID: 1241358539"
5,kto-sportsbook-betting-casino-online,Boa tarde estou a 5 dias enviando mais de 10 comprovante de rezidencia para confirmar o que a kto me pedio sendo que eu ha jogo a ,nao-querem-me-pagar_RtVriexIkax0Qmnt,Boa tarde estou a 5 dias enviando mais de 10 comprovante de rezidencia para confirmar o que a kto me pedio sendo que eu ha jogo a quase 1 ano sempre recebi e agora pediram tudo de novo fiz todos os procedimentos e so sabe dizer que este nao serve este nao serve sendo que ali esta bem claro que de internet original tambem vale nandei o  comprovante da tim original da minha internet e tambem negaram preciso sacar meu dinhiro porque qyando eu perco nao rechamo agora quero o que e meu mais tenho 10 prints e tidos negado por favor alguem faça alguma coisa meu contato e 48 999551447 aguardo o retorno se nao vou ter que ir pro procom
6,kto-sportsbook-betting-casino-online,"eu fiz uma boa grana na KTO, eu ja havia feito varios saques, e ja havia feito a verificação da conta, um dia bloquearam minha con",bloquearam-minha-conta-para-eu-nao-sacar_cZ3eJhL5SA-PCfUC,"eu fiz uma boa grana na KTO, eu ja havia feito varios saques, e ja havia feito a verificação da conta, um dia bloquearam minha conta, e eu nao conseguia faze saques, ficavam pedindo inumeros documentos, e nunca aceitavam as fotos =que eu mandava, eu segui todos os procedimentos conforme haviam me passado,, entao eu decidi perder tudo, no momento em que minha conta zerou, liberaram, é uma empresa sacana, nao apostaem nesse lixo, sao pessoas de mau carater, site sacana"
7,kto-sportsbook-betting-casino-online,"Jogos a muitos anos, e já tinha validado meu endereço com um boleto da vivo na qual tenho o mesmo número a mais de 10 anos. Fui fa",comprovante-de-residencia_PZlbCHxWVfr2Dt1n,"Jogos a muitos anos, e já tinha validado meu endereço com um boleto da vivo na qual tenho o mesmo número a mais de 10 anos. Fui fazer um saque de uma quantia pequena e pediram pra confirmar endereço. Enviei boleto de banda larga no meu nome, fatura da faculdade que estudo, boleto da vivo e NADA é  aceito.Moro com meu pai na qual as contas de água e luz estão no nome. ENGRAÇADO QUE PRA CREDITAR PODE!!Aguardo retorno!!"
8,kto-sportsbook-betting-casino-online,"Fiz duas apostas exatamente iguais cujo entrei com as duas com resultados já definidos, misteriosamente numa delas perdi. Quero me",editado-pelo-reclame-aquiam-aposta_Jx7Xparf44oZR106,"Fiz duas apostas exatamente iguais cujo entrei com as duas com resultados já definidos, misteriosamente numa delas perdi. Quero meu dinheiro novamente "
9,kto-sportsbook-betting-casino-online,"Estava jogando roleta e após uma sequencia grande saindo a cor preta em que eu estava jogando no vermelho, fiz uma aposta no verme",manipulacao-e-editado-pelo-reclame-aqui-na-roleta_gFcu7fef9Yv2KSI4,"Estava jogando roleta e após uma sequencia grande saindo a cor preta em que eu estava jogando no vermelho, fiz uma aposta no vermelho no valor de R$ 22,00, deu vermelho, só que o provedor não anunciou a vitória do vermelho, eles simplesmente rodaram de novo e saiu a cor preta, resultado comeram o valor da minha aposta.Fiz reclamação no chat da KTO e eles disseram que estava tudo certo, eu teria que ter um vídeo ou um print da tela aparecendo que deu vermelho. Como vou ter isso?Agora tenho que gravar todas as rodadas para provar o resultado.Houve reclamações no chat da roleta na hora que ocorreu, eles podem ver que não foi somente eu que reclamei.Estão manipulando e [Editado pelo Reclame Aqui] na cara dura."
10,kto-sportsbook-betting-casino-online,Fiz duas recargas de 50$ e nenhuma caiu na conta quero meu dinheiro de volta ou depositem meu dinheiro no jogo,credito_AVtplinokm5e-2YE,Fiz duas recargas de 50$ e nenhuma caiu na conta quero meu dinheiro de volta ou depositem meu dinheiro no jogo
11,kto-sportsbook-betting-casino-online,"A Kto vem fazendo uma promoção de 100 rodadas grátis toda semana em jogos diferentes sempre participei e não tive problemas, essa ",nao-deram-a-100-rodadas-gratis-e-nao-deram-nenhuma-explicacao_1hzBC0daDwsmh_6p,"A Kto vem fazendo uma promoção de 100 rodadas grátis toda semana em jogos diferentes sempre participei e não tive problemas, essa semana no jogo Raging Rex 2 sumiu as informações da promoção e não deram a rodadas grátis prometidas me sinto enganada pq não teve nenhuma justificativa apenas tiraram tudo como se nunca tivesse existido a promoção, não jogo mais na kto "
12,kto-sportsbook-betting-casino-online,"Abri minha conta nessa plataforma,por conta da promoção do cassino na semana em que vc ganhava 100 giros gratis apostando 100 reai",pior-casa-de-apostas-que-existe_w2hjZ9hJaIbYcBJ5,"Abri minha conta nessa plataforma,por conta da promoção do cassino na semana em que vc ganhava 100 giros gratis apostando 100 reais,quando fiz o depósito eles retiraram a promoção sem mais nem menos,aí quando fui sacar o dinheiro me mandaram uma mensagem dizendo que eu teria que fazer apostas no valor depositado para conseguir sacar,pois bem eu fiz as apostas é agora tá pedindo pra verificar a conta,eu mandei os documentos identidade,comprovante de residência e 3 séries segurando a identidade é eles alegam que a identidade é muito antiga e por isso não podem aceitar,tipo querem fixar com meu dinheiro de qualquer jeito palhaçada essa casa de apostas"
13,kto-sportsbook-betting-casino-online,"Fiz o meu depósito, já havia feito operações antes. Agora não me permite fazer aposta é tbm não me permite resgatar o valor. Seja ",falta-de-acesso_-ESvsCMznVn3cQZG,"Fiz o meu depósito, já havia feito operações antes. Agora não me permite fazer aposta é tbm não me permite resgatar o valor. Seja que terei que ajuizar?"
14,kto-sportsbook-betting-casino-online,"Posse indevida do meu dinheiro. Estão forçando que aposte todo o valor depositado.""Os jogadores devem apostar pel",ola-infelizmente-nao-podemos-processar-sua-retirada-neste-momento-percebemos-que-voce-depositou-e-fez-um-saque-sem-apostarjogar-o-valor-colocado-conforme-nossos-termos--condicoes_zXRrwFezUlYJwsCd,"Posse indevida do meu dinheiro. Estão forçando que aposte todo o valor depositado.""Os jogadores devem apostar pelo menos uma vez o valor do depósito em apostas com odd de 1.7 ou mais antes de solicitar um saque. Gentilmente informamos que você ainda precisa apostar o valor de 81,54 BRL.""E se eu não quiser apostar? Não vou poder sacar o MEU dinheiro?  "
15,kto-sportsbook-betting-casino-online,Fiz uma aposta e o jogo me sacaneou fiz apertei para ganha e ganhei mas ele seguiu o jogo aparecendo que eu já tinha ganho e depoi,vcs-da-kto-nao-aceitam-estar-errados_5EgtZ-Kpt4EZBlo9,Fiz uma aposta e o jogo me sacaneou fiz apertei para ganha e ganhei mas ele seguiu o jogo aparecendo que eu já tinha ganho e depois aparece a imagem acabou e travou mas não me deu o dinheiro
16,kto-sportsbook-betting-casino-online,"Fiz um depósito de 300 reais, porém logo depois me surgiu uma emergência e então fui tentar sacar, mas o saque foi negado.",querem-prender-o-dinheiro-dos-outros_Zv7TcXz6Zpb4HAb0,"Fiz um depósito de 300 reais, porém logo depois me surgiu uma emergência e então fui tentar sacar, mas o saque foi negado.Alegam que tenho que apostar todos os 300 reais com odds a partir de 1.7 para depois poder sacar.Fato este que não é informado na hora do depósito, curioso não? Para depositar é fácil, não te pedem nada. Mas e para sacar? Te colocam vários pretextos para não sacar.Curioso que antes de fazer o depósito entrei em contato com eles, perguntando se depois do depósito eu poderia sacar via pix sem problemas, me informaram que sim.E agora, cadê meu dinheiro? "
17,kto-sportsbook-betting-casino-online,"Criei uma conta e fiz o deposito do valor de R$ 50,02 ontem dia 23/08 às 13:19 via transferência do Bradesco, porém o valor não fo",valor-depositado-nao-creditado-na-conta_ziDFOX99K9U0oByF,"Criei uma conta e fiz o deposito do valor de R$ 50,02 ontem dia 23/08 às 13:19 via transferência do Bradesco, porém o valor não foi creditado. Entrei em contato via chat algumas vezes e os atendentes sempre informaram para esperar. Agora a noite, um dos atendentes finalmente informou um e-mail para que eu pudesse reclamar o ocorrido.Até agora nenhum resposta."
18,kto-sportsbook-betting-casino-online,"Apostei no jogo de Volei entre Polônia e Argentina, dia 23/08/2022, o qual terminou com o resultado de 3 sets a 0 para a Polônia. ",acertei-uma-aposta-e-consideraram-ela-como-erradaa_Wq6XriGurQTWRznB,"Apostei no jogo de Volei entre Polônia e Argentina, dia 23/08/2022, o qual terminou com o resultado de 3 sets a 0 para a Polônia. Apostei que o jogo teria 3 sets, o qual ocorreu, pois terminou 3 sets a 0. Tenho provas disso. E consideraram errada porque houve jma interrupção no segundo set, mas essa interrupção não tem nada haver com novo set. O resultado.foi de 3 a 0, portanto o número de sets do jogo foram 3. Simples assim. E não me pagaram, estão erradissimos e tentando ludibriar."
19,kto-sportsbook-betting-casino-online,Estive sem acessar o site da KTO por cerca de dois meses e a KTO bloqueou meu acesso. Gostaria de retirar meu dinheiro  que está r,a-kto-bloqueou-meu-acesso-unilateralmente_EROXKEwy2ztslg9_,"Estive sem acessar o site da KTO por cerca de dois meses e a KTO bloqueou meu acesso. Gostaria de retirar meu dinheiro  que está retido ilegalmente pela KTO. Aliás a KTO investe tanto em publicidade e bloqueia a retirada de cerca de R$ 75,00, que entraram de modo legal."
20,kto-sportsbook-betting-casino-online,Estou com 940 reais pra sacar eles pediram pra validar a conta depois de tanto tempo usando sem problemas .Oi pior e que no ,tenho-940-reais-e-les-nao-deixam-sacar_s9SSdSg151iA0lCa,Estou com 940 reais pra sacar eles pediram pra validar a conta depois de tanto tempo usando sem problemas .Oi pior e que no endereço que cadastrei eles não aceitaram nenhum dos comprovantes de endereços que mandei e não tenho outros pq mudei pré esse endereço recente e a casa e da minha companheira.A sujestão de um atendente era eu fazer cartão de crédito no endereço e esperar chegar pra enviar pra eles .Estou a procura de um advogado pra resolver isso.Já que não pediram nada de comprovante no ato do cadastro.
21,kto-sportsbook-betting-casino-online,"Bom dia !!! Eu não estou conseguindo mais entrar nos jogos de esportes, para fazer minhas apostas e apenas nos casinos  coloco em ",nao-consigo-entrar-no-esportes_xHDIq56jilAIxE3p,"Bom dia !!! Eu não estou conseguindo mais entrar nos jogos de esportes, para fazer minhas apostas e apenas nos casinos  coloco em esportes e fica só processando mais não entra "
22,kto-sportsbook-betting-casino-online,Estou tentando a horas acessar a kto mas não estou conseguindo . Poderia ter feito cashout ou ter feito outros jogos mas não consi,nao-estou-conseguindo-acessar-para-verificacao-das-minhas-apostas_Z1Gm5M9RFZbuWM8n,Estou tentando a horas acessar a kto mas não estou conseguindo . Poderia ter feito cashout ou ter feito outros jogos mas não consigo acessar poderiam me ressarcir com pelo menos apostas grátis por esse erro. Pois tenho aposta de 2.000 lá 
23,kto-sportsbook-betting-casino-online,"Site bloqueou meu acesso, simplesmente por contestar uma aposta e discordar do retorno recebido!",site-bloqueou-meu-usuario_sDgiiJZEVRXCs2kf,"Site bloqueou meu acesso, simplesmente por contestar uma aposta e discordar do retorno recebido!"
24,kto-sportsbook-betting-casino-online,"Estou com 700 reais que não consigo sacar,pois me pediram a verificação da conta, mandei meu documento e uns 5 comprovantes de res",dinheiro-retido-nao-consigo-sacar_XArOJFN-AGUFm5_N,"Estou com 700 reais que não consigo sacar,pois me pediram a verificação da conta, mandei meu documento e uns 5 comprovantes de residência com todos meus dados e endereço! Mas sempre retornam o e-mail dizendo que não foi aceito, mas para depositar para jogar ai eles aceitam rapidinho e não tem problema nenhum! É uma falta de bom senso com o cliente! Já tive que mudar forma de pagamento da minha Internet para conseguir uma fatura,pois era débito em conta e só vem uma nota fiscal toda detalhada com todos dados,mas eles n aceitam nada! Muito complicado essa situação!"
25,kto-sportsbook-betting-casino-online,Tenho crédito na KTO e nao consigo acessar o site,nao-consigo-acessar-o-app-da-kto_-KRD1NnKWv0Ac3yc,Tenho crédito na KTO e nao consigo acessar o site
26,kto-sportsbook-betting-casino-online,"Durante o dia efetuei algumas apostas  kto, das quais todas foram descontadas no momento da aposta e no momento de receber o valor",aposta-nao-paga-kto_QCqDqeEDR8jrVG2I,"Durante o dia efetuei algumas apostas  kto, das quais todas foram descontadas no momento da aposta e no momento de receber o valor não atualizou e também não aparecem mais no histórico de apostas processadas, gostaria de uma posição sobre o fato  "
27,kto-sportsbook-betting-casino-online,Fiz 2 apostas de r$ 10 no aviator e simplesmente ele ficou com meu dinheiro e não entregou nem meus ganhos.,problemas-no-aviator-kto_aa4WxWltPhcQSQpU,Fiz 2 apostas de r$ 10 no aviator e simplesmente ele ficou com meu dinheiro e não entregou nem meus ganhos.
28,kto-sportsbook-betting-casino-online,"Fiz uma aposta no total de gols de um jogo, que teria mais de 0.75, uma das equipes fez 1 a 0 (ou seja, acertei a aposta) e em 30 ",ganhei-uma-aposta-nao-fui-pago-e-o-contato-nao-soube-me-explicar-por-que_tBhCV-7qICPs6uhv,"Fiz uma aposta no total de gols de um jogo, que teria mais de 0.75, uma das equipes fez 1 a 0 (ou seja, acertei a aposta) e em 30 min não fui pago, a pessoa onde se faz contato pelo site primeiro disse que era por que era aposta em diferença de gols então que o jogo deveria terminar, o que não é verdade pois apostei que haveria mais de 0.75, depois disse que eu teria que esperar o fim do jogo ou alguma equipe abrir 2 gols de vantagem..Mas eu já acertei a aposta, por que esperar o encerramento da partida?"
29,kto-sportsbook-betting-casino-online,"não vale a pena apostar neste site, tu acha que está um determinado placar, atualiza o site várias vezes, mas é só tu efetuar a ap",atraso_uLySQeNS7R6tfVlP,"não vale a pena apostar neste site, tu acha que está um determinado placar, atualiza o site várias vezes, mas é só tu efetuar a aposta que muda completamente. Exemplo: um determinado jogo estava 1:1 depois que fiz uma aposta, o jogo apareceu do nada 3:1 obviamente contra mim.Não percam dinheiro e tempo."
30,kto-sportsbook-betting-casino-online,"Meu dinheiro está retido na KTO! Me enviaram e-mail solicitando a verificação da conta, dizendo que aceitavam entre outros, docume",dinheiro-retido_BCfmgq0w-KeF3WQo,"Meu dinheiro está retido na KTO! Me enviaram e-mail solicitando a verificação da conta, dizendo que aceitavam entre outros, documentos do governo e contrato de aluguel que comprovem o endereço de moradia.Pois bem, estou morando em novo endereço, e possuo apenas o contrato de aluguel e outro documento autenticado em cartório, que relacione meu nome ao endereço de moradiaEnviei ambos os documentos e não foram aceitos por motivos que não foram pré-informados e por motivos sem qualquer embasamento. Em relação ao documento autenticado, se trata de uma cessão de direitos que consta meu endereço de moradia, com data de agosto/2022 . A empresa simplesmente não aceita, por motivo que somente ela tem conhecimento.Em relação ao contato de aluguel, pede que esse seja reconhecido em cartório. Ora, se a própria Lei não determina essa obrigatoriedade, ou seja, contrato de aluguel tem validade mesmo não sendo autenticado, porque a empresa tem essa exigência???? Aliás, essa exigência, só foi informado após o envio do documento. Um descaso total, dizem que primam pela segurança, mas os depósitos que fiz na casa não foram questionados em nenhum momento.Não recomendo!!!!!!!!!!!!!!!!"
31,kto-sportsbook-betting-casino-online,Fiz 19mil em lucro solicitei dois saque um de 10 mil e outro de 9 mil aí simplesmente desativaram minha conta e não pagaram ,desativaram-minha-conta-pra-nao-pagarem_vd33U-ZGQiXtOUAc,Fiz 19mil em lucro solicitei dois saque um de 10 mil e outro de 9 mil aí simplesmente desativaram minha conta e não pagaram 
32,kto-sportsbook-betting-casino-online,Faço depositos com frequencia nunca da problema agora na hora que voce ganha eles nao pagam pix de valor baixo cai na hora agora s,pior-site-de-apostas-editado-pelo-reclame-aqui_UsCarA4pIHKO7B71,Faço depositos com frequencia nunca da problema agora na hora que voce ganha eles nao pagam pix de valor baixo cai na hora agora se voce ganha bastante eles te enrolam e nao pagam eles querem que vc aguarde e nao consegue fazer pix pra sacar pior site de apostas gente nao se cadastrem e furada bando de [Editado pelo Reclame Aqui]
33,kto-sportsbook-betting-casino-online,"Eu apostei 10 fichas na roleta no número 9, sendo que duas vezes eu acertei esse número com o multiplicador e não me pagou. Reveja",apostei-na-roleta-e-nao-me-pagou-o-multiplicador-por-duas-vezes-no-numero-9_ihL_YUhV0IcKoY1o,"Eu apostei 10 fichas na roleta no número 9, sendo que duas vezes eu acertei esse número com o multiplicador e não me pagou. Revejam e me paguem."
34,kto-sportsbook-betting-casino-online,"Site de apostas não confiável por tais razões: prometem bônus ao se cadastrar, mas quando tu deposita, não tem bônus algum, refere",editado-pelo-reclame-aqui-evitem_P0f4Y7w8Jh_hjJFk,"Site de apostas não confiável por tais razões: prometem bônus ao se cadastrar, mas quando tu deposita, não tem bônus algum, referem q dão atendimento pelo direct do Instagram, outra farça, apenas desculpas e informações desconexas. Por fim, acaso ganhar algo, tal site demora 72h ou mais para te depositar o dinheiro. Em tempo de pix, é um absurdo. Enfim, totalmente [Editado pelo Reclame Aqui] e perigoso tal site. Evitem"
35,kto-sportsbook-betting-casino-online,Já não é a primeira vez que faço apostas que terão resultados a longo prazo e estas apostas simplesmente somem do hall de apostas.,apostas-que-somem-misteriosamente_dccTNr2POiF1s9RF,"Já não é a primeira vez que faço apostas que terão resultados a longo prazo e estas apostas simplesmente somem do hall de apostas. No ultimo ano em média 5 apostas que fiz em jogos, lutas, eventos de formula 1, simplesmente sumiram. A ultima agora foi a de qual time Cristiano Ronaldo jogaria na temporada 2022, fui entrar hoje e simplesmente sumiu, sem falar que na minha conta não consta nenhuma aposta realizada antes do mês de junho, sendo que uso a plataforma a mais um ano. Cancelarem o evento tudo bem, desde que devolvam o dinheiro que foi apostado ao cliente, caso contrário é [Editado pelo Reclame Aqui]. Isso sem falar as inúmeras vezes em que os jogos em tempo real tipo AVIATOR, simplesmente travam impossibilitando o jogador de clicar para encerrar a aposta, e logo em seguida finaliza novamente [Editado pelo Reclame Aqui] o valor apostado. Ministério Público Federal devia ficar de olho nisso."
36,kto-sportsbook-betting-casino-online,"Na ultima sexta feira estava com um saldo de R$65,00 na casa, como sei que o mínimo para saque é R$100,00, depositei mais R$50,00 ",nao-aceita-conta-de-celular-como-comprovante-de-residencia_oAWc9VqnsmV4vEmO,"Na ultima sexta feira estava com um saldo de R$65,00 na casa, como sei que o mínimo para saque é R$100,00, depositei mais R$50,00 para passar dos 100 e assim conseguir realizar o saque. O mesmo não foi realizado. Foi alegado que eu criei mais de uma conta com o meu cpf e que isso seria uma punição (coisa que aconteceu realmente em 2021 e foi justa a punição, concordei e na época perdi uma aposta de em torno de 1800,00 que havia ganho, até aí ok), mesmo com a punição, deixaram meu saldo inicial em minha conta oficial para que continuasse jogando, e nisso parei de utilizar a casa. Em março desse ano, voltei a utilizar e no ínicio perguntei para o suporte se teria alguma outra conta em meu nome, o mesmo diz que não tinha e que não teria problemas futuramente e aqui estou eu, com a conta suspensa e sem receber o valor da conta. Ao finalizar a conta, me solicitaram uma série de documentos para que fosse feita a verificação e com isso, eles me obrigam a ter uma casa, um aluguel, uma luz em meu nome, coisa que não tenho. Enviei o pdf da minha conta de celular (o que é aceito em qualquer lugar como comprovante de residencia) e o mesmo não foi aceito. Amanhã faz uma semana e até agora não resolveram meu problema.Espero que por aqui consigam me apresentar uma solução viável."
