,company_name,description,href,full_complain
242,sportsbet-io,"Tive minha conta bloqueada na terça-feira e não consigo sacar e nem apostar.Abri reclamação no suporte, fui redirecion",conta-e-saque-bloqueados_E6uuAUcc-AmGHHy-,"Tive minha conta bloqueada na terça-feira e não consigo sacar e nem apostar.Abri reclamação no suporte, fui redirecionado para a equipe de segurança e até agora não tive resposta do motivo de não consigo sacar o valor da minha conta.Não recebi nenhuma mensagem pelo site informado o motivo.Estou muito insatisfeito com o serviço, meu dinheiro está preso e eu não sei nem o motivo."
243,sportsbet-io,"Venho utilizando a casa de apostas há um tempinho, sempre apostando, ganhando, perdendo, sacando, tudo nos conformes. No dia 31/01",conta-desativada-e-impossibilidade-de-saque_9jACbHQ95_a_P25b,"Venho utilizando a casa de apostas há um tempinho, sempre apostando, ganhando, perdendo, sacando, tudo nos conformes. No dia 31/01, tentei posicionar uma aposta e apareceu que o saldo era insuficiente, tentei sacar e apareceu que estava indisponível, imediatamente fui no chat e me redirecionaram ao e-mail, cujo demoram MUITO para responder.Me foi pedido para fazer o processo de verificação, não uma, mas DUAS vezes e, após isso, recebi o e-mail informando:""Por favor, note que a sua conta foi desativada devido a ser sinalizada por contabilização múltipla pelo nosso sistema de segurança"".Eu nunca tive uma outra conta nesta casa, essa é minha primeira, e não faz nem sentido eu ter duas contas! Agora estou com uma grana absurdamente alta presa, indisponível para saque e à mercê da boa vontade desse casebre. Nos grupos de apostadores que faço parte, muitos relatam o mesmo problema, conta bloqueada no dia 31. Escolheram o dia pra bater as botas do Brasil e sumir com o dinheiro do povo?!"
244,sportsbet-io,"No dia 31/01 percebi que havia algum problema na minha conta na Sportsbet.io ao tentar realizar uma aposta e mesmo tendo saldo, re",conta-bloqueada_wYKtIu9w8_02JbM9,"No dia 31/01 percebi que havia algum problema na minha conta na Sportsbet.io ao tentar realizar uma aposta e mesmo tendo saldo, retornar uma mensagem dizendo que nao havia fundos insuficientes. Fiz o teste de tentar sacar uma quantia e também voltou mensagem de erro dizendo para entrar em contato por e-mail. No mesmo dia fiz um depósito para realizar as apostas e coincidência ou não, o depósito foi processado normalmente. Logo me preocupei em entrar em contato via e-mail e em primeiro instante fui informado que deveria realizar uma verificação de documentos pela equipe de segurança. Realizei a verificação solicitada e respondi o e-mail. Para a minha surpresa recebi uma resposta dizendo que ""Por favor, note que a sua conta foi desativada devido a ser sinalizada por contabilização múltipla pelo nosso sistema de segurança"". Por favor, nos informe se você abriu anteriormente ou ativamente usou quaisquer outras contas Sportsbet.io. Se sim, por favor nomeie essas ou quaisquer contas de usuário. Totalmente sem sentido, pois somente eu tenho acesso na minha conta e não possuo mais nenhuma conta em no meu nome ou em nome de terceiros. Minhas apostas sempre foram feitas em total responsabilidade e inclusive minha conta tem mais prejuizo do que lucro. Não estou entendendo essa postura da Sportsbet simplesmente bloqueando minha conta e prendendo meu dinheiro. Por fim, respondi o e-mail ontem dia 02/02 informando isso e até agora nao tive retorno.Solicito desbloqueio da minha conta com urgência, caso contrário terei que buscar outros meios de resolver. Login marcosvlimasp"
245,sportsbet-io,"Boa Tarde, tive minha conta bloqueada e não consigo realizar saques. Enviei email pedindo um retorno deles e me acusaram de ter ma",conta-bloqueada-e-saque-indisponivel_EMf9C6PR4Va8jW8h,"Boa Tarde, tive minha conta bloqueada e não consigo realizar saques. Enviei email pedindo um retorno deles e me acusaram de ter mais que uma conta, tenho apenas uma conta no site, acho um descaso com o consumidor isso. Não consigo apostar, não consigo sacar.Peço que liberem minha conta e se preciso podem fazer qualquer investigação necessária, segui certo todo regulamento do site, fico no aguardo da liberação.Não entrem nesse site, eles não respondem os emails e bloqueam sua conta sem  motivo."
246,sportsbet-io,"A sportinbet.IO simplismente ""congelou"" meu saldo e não me permitem sacar o MEU dinheiro, alegaram que tem outra conta e",estao-aplicando-editado-pelo-reclame-aquis-nos-usuarios_1af89KNuzj4ibjOB,"A sportinbet.IO simplismente ""congelou"" meu saldo e não me permitem sacar o MEU dinheiro, alegaram que tem outra conta em meu nome, sendo que no processo de verificação que eles me pediram 3 vezes, até selfie tive que mandar, como que alguém ia criar outra conta no meu nome? eu só criei uma. Mas estão alegando isso para várias pessoas conforme vi em um fórum de apostadores ou seja, estão aplicando [Editado pelo Reclame Aqui]s e [Editado pelo Reclame Aqui] o dinheiro dos usuários. Se você que está vendo essa reclamação tem fundos lá, saque rapidamente antes que aconteça o mesmo. Unicas casas confiáveis são a Bet365, Betano e Betfair."
247,sportsbet-io,"Fiz uma aposta ontem em quem sairia do BBB , a moça que eu apostei saiu e apareceu que eu perdi a aposta não entendi o que acontec",aposta_BKp7fuXg-2Q5p7D8,"Fiz uma aposta ontem em quem sairia do BBB , a moça que eu apostei saiu e apareceu que eu perdi a aposta não entendi o que aconteceu estou decepcionada."
248,sportsbet-io,Fiz um depósito no valor de 50 Reis nas contas da SportsBetio e quando fui sacar o valor informaram que eu deveria apostar pelo me,saque-declinou_IpFHoivARnz56YL-,"Fiz um depósito no valor de 50 Reis nas contas da SportsBetio e quando fui sacar o valor informaram que eu deveria apostar pelo menos essa quantia pra poder resgata-lo. Acontece, que essa condição imposta para sacar a quantia é abusiva, tendo em vista que condiciona o usuário a fazer algo que não necessariamente ele precisa, podendo ser considerada uma venda casada. Eu depositei, e me arrependi. Gostaria de resgatar os meus fundos sem ter que ser OBRIGADO a mexer nesse valor. Aguarda retorno. "
249,sportsbet-io,"Bom dia, venho tentando solicitar um saque da minha conta na Sportsbet.io e esse saque vinha sendo negado. Aparecia a mensagem que",problema-no-saque_YBPAytyGwP3RFzEO,"Bom dia, venho tentando solicitar um saque da minha conta na Sportsbet.io e esse saque vinha sendo negado. Aparecia a mensagem que eu deveria apostar ao menos o valor do depósito (R$ 1.800,00), eu o fiz. Logo após, fui tentar fazer o saque do restante do dinheiro e de repente, aparece a mensagem que o sistema de saques está fora do ar e pede para tentar novamente mais tarde. Eu já tentei VÁRIAS vezes e nada. Sempre a mesma mensagem. Eu exijo o saque do valor que estou tentando sacar (R$ 1.420,00) pois é com esse valor que irei pagar contas como IPVA do meu veículo, por exemplo. Se eu for prejudicado por conta da demora nesse saque, eu irei imediatamente entrar com uma ação judicial contra a empresa. Espero uma resposta rápida e objetiva para o meu problema. Desde já agradeço. (Segue em anexo print da tela, com a mensagem informando a impossibilidade do saque).Matheus de Menezes Costa Nascimento Moura Torres"
250,sportsbet-io,Minha conta esta impossibilitade de realizar apostas e o meu saldo esta bloqueado para saque. A casa de aposta oferece apena,saldo-da-conta-bloqueado_-gM62tDHtkvv-m7r,Minha conta esta impossibilitade de realizar apostas e o meu saldo esta bloqueado para saque. A casa de aposta oferece apenas um e-mail para contato. Preciso do meu saldo devolvido. 
251,sportsbet-io,"Sou apostador a 2 anos, e nunca passei por uma coisa dessas, a Sportingbet.IO simplismente restringiram minha conta, sem avisar, s",restringiram-minha-minha-conta-para-apostar-e-editado-pelo-reclame-aquiam-meu-dinheiro_Z_vd53hU9Jomi4e-,"Sou apostador a 2 anos, e nunca passei por uma coisa dessas, a Sportingbet.IO simplismente restringiram minha conta, sem avisar, sem um imail, nada. Fui fazer uma aposta a noite e aparecia a mensagem ""saldo insuficiente"" sendo que tenho 690 reais de saldo. Pois bem já que, de forma amadora restringiram minha conta, fui tentar sacar o valor que sobrou na conta (OBS: nunca obtive lucro nesse casebre, tive prejuizo de mais de 2k e ainda me restringiram), e simplismente não deixam eu sacar, aparece uma mensagem de erro e para mim entrar em contato com o suporte, que é feito apenas por imail no Brasil e o pior, entrei em contato ontem e me passaram um outro imail de suporte para ajudar no meu caso, e o mesmo simplismente não responde. Além do prejuizo que tive ainda me restringiram e [Editado pelo Reclame Aqui]AM o meu saldo restante, já que não me permitem saca-lo e não respondem pelo suporte. DICA: Utilizem apenas a bet365 e a Betfair que são sites de apostas confiavéis, não coloquem dinheiro nessas casas amadoras que aplicam [Editado pelo Reclame Aqui]s nos clientes!"
252,sportsbet-io,A casa de apostas SPORTSBET IO não me deixa retirar meu dinheiro da casa de apostas e nem mesmo efetuar novas apostas. Já utilizo ,nao-consigo-sacar-meu-dinheiro_KwolwKIX7OJOczuf,"A casa de apostas SPORTSBET IO não me deixa retirar meu dinheiro da casa de apostas e nem mesmo efetuar novas apostas. Já utilizo a mesma a algum tempo. E hoje, 31/01/2022, quando precisei retirar parte do dinheiro eles não deixam.Quero deixar clara minha indignação. Estou precisando do dinheiro por motivo de saúde e a casa não deixa.Já tentei resolver através do chat de suporte ao cliente mas simplesmente mandam enviar um e-mail( tal foi enviado e não obtive resposta).Espero que resolvam urgentemente meu problema."
253,sportsbet-io,"Fiz uma aposta das especiais do dia, era um especial da NBA do dia 26/01/2022, onde apostei que Bulls, Hawks e Heat ganhariam seus",apostei-em-um-especial-da-sportsbet-e-ganhei-so-que-computaram-como-perdida_xFEz9An-YjxKjo7h,"Fiz uma aposta das especiais do dia, era um especial da NBA do dia 26/01/2022, onde apostei que Bulls, Hawks e Heat ganhariam seus jogos, as três equipes ganharam e aí abro o site e a aposta está computada como perdida. Estou muito indignado, pois estou utilizando o site de apostas esportivas a 2 meses e já tive uns três ou quatro problemas, alguns solucionados e outros não, mas dessa vez eu exijo uma solução rápida do site! "
254,sportsbet-io,Ganhei e n recebi,61ef535bd1d9a72710e25bc9__Xrd4Vuv0jn5PbTO,Ganhei e n recebi
255,sportsbet-io,"O dinheiro se encontra preso na banca da Sportsbet.io, até o momento os agentes não realizaram o saque, no qual fiz o pedido. ",dinheiro-preso_DmgJFUK4JBAfJnjZ,"O dinheiro se encontra preso na banca da Sportsbet.io, até o momento os agentes não realizaram o saque, no qual fiz o pedido. "
256,sportsbet-io,"Pedi para excluirem minha conta por que eu nao queria mais jogar, e desativaram minha conta com meu dinheiro la dentro, nao me ext",conta-bloqueada-com-saldo-la-dentro_Xz_K6dpcrbKF1Al1,"Pedi para excluirem minha conta por que eu nao queria mais jogar, e desativaram minha conta com meu dinheiro la dentro, nao me extornaram o valor que tava na conta e tambem nem me deixavam sacar antes de pedir o bloqueio da mesma !!!!! Quero o extorno do meu dinheiro!!!! Imediatamente!!!!! "
257,sportsbet-io,"Dia 21/01 fiz uma transferência em que o prazo para cair já encerrou, entro em contato com a empresa pelo e-mail: suporte@sportsbe",fiz-uma-transferencia-e-o-valor-nao-caiu_aCxjlunvdtWGnBJL,"Dia 21/01 fiz uma transferência em que o prazo para cair já encerrou, entro em contato com a empresa pelo e-mail: suporte@sportsbet.io e não tenho nenhum retorno. Os dados da conta foram passados pelo app, vou deixar o comprovante da transação em anexo."
258,sportsbet-io,Não consigo sacar meu saldo Aparece que saque não está disponívelJá fiz apostas no valor do meu depósitoMa,saque-nao-disponivel_b-xHtH5lqVOSpKtC,Não consigo sacar meu saldo Aparece que saque não está disponívelJá fiz apostas no valor do meu depósitoMais de uma vez conforme indicado e ainda sim continua indisponível
259,sportsbet-io,"Fiz uma aposta num determinado jogo ganhei aos 20 minutos do primeiro tempo, e queria apostar mais, só que não creditaram meu prêm",mal-funcionamento_zAhRL9eHQ35JJi2m,"Fiz uma aposta num determinado jogo ganhei aos 20 minutos do primeiro tempo, e queria apostar mais, só que não creditaram meu prêmio a tempo muito chateado pois me tiraram a oportunidade de fazer mais combinações que poderia ganhar ou perder, mais minha indignação é que por não creditar o valor que ganhei fiquei impossibilitado"
260,sportsbet-io,"Fiz uma reclamação hoje cedo, referente a dois saques não recebidos.Na resposta, a empresa disse que me enviou os comp",reclamacao-nao-atendida_jOtlrsg4f5lI-nr6,"Fiz uma reclamação hoje cedo, referente a dois saques não recebidos.Na resposta, a empresa disse que me enviou os comprovantes por e-mail. Inclusive, analisando as reclamações aqui no site, parece que essa resposta é de praxe.Ocorre que não recebi nenhum e-mail da parte deles!Abaixo, a resposta enviada aqui no RA:""Oii, João. Tudo bem?Obrigado por entrar em contato com a nossa equipe.Enviei em seu email dois comprovantes dos saques que você fez nos últimos dias.Se ainda tiver dúvidas, só nos responder nesse mesmo email.Pedimos desculpas pela demora em responder sua solicitação.Abraços,Time Sportsbet.io!""Pessoal, vamos resolver essa questão e ser mais transparentes com os consumidores! É o mínimo que peço.Fico no aguardo de um retorno."
261,sportsbet-io,"Realizei dois saques de valores obtidos em apostas, na semana passada.A forma de pagamento seria pix, com indicação da chave",nao-recebimento--saque_cK-yP5fddx9h8box,"Realizei dois saques de valores obtidos em apostas, na semana passada.A forma de pagamento seria pix, com indicação da chave (CPF).Porém, até o momento, não recebi.Além disso, o e-mail de suporte deles não responde nunca.Fico no aguardo de uma solução e espero receber os valores."
262,sportsbet-io,"Boooa noite, há mais de um ano, eu fazia apostas diariamente na casa de aposta em questão, era um cliente com alto valor de banca,",bloquearam-minha-conta-com-mais-de-3mil-reais-faz-mais-de-um-ano_IZnyCI4Hpk8_4vcU,"Boooa noite, há mais de um ano, eu fazia apostas diariamente na casa de aposta em questão, era um cliente com alto valor de banca, chegando a ter banca de 10/20 mil reais, mais de uma hora para hora, bloquearam minha conta com aproximadamente 3mil reais, sem dar nenhuma explicação. Desde o ocorrido mando msg para o e-mail de suporte e nunca me fazem nada, nenhuma luz para solucionar o meu problema, gostaria de reaver meu dinheiro. São 3 mil reais. Incompetência pegar uma quantidade de dinheiro assim. Estou totalmente aberto para a resolução do problema da melhor maneira possível. Seque em anexo quando eu tento entrar na minha conta"
263,sportsbet-io,Fui prejudicado pelo site sportsbet.io pois realizei uma aposta e o nome da equipe em questão havia sido trocada. Entrei em contat,prejudicado-por-erro-do-site_Os5LLFRQjB4AEkKq,"Fui prejudicado pelo site sportsbet.io pois realizei uma aposta e o nome da equipe em questão havia sido trocada. Entrei em contato com o suporte da empresa e me disseram que não haveria o cancelamento da aposta devido a avaliação da empresa. No caso o motivo em questão é claro para cancelamento da aposta em questão mais a empresa molda os recursos de acordo com seus próprios critérios e como não devem satisfação aos órgãos de defesa do consumidor brasileiros , moldam as regras do jogo de acordo com interesses próprios. Deixo esse recado sem ter a expectativa de ressarcimento mais apenas de que deixemos de deixar que empresas como essa,circulem em nosso país ao seu bel prazer sem consequência alguma."
264,sportsbet-io,"Estou tentando a quase 10 dias realizar o saque do meu dinheiro e não consigo.Retorna a seguinte mensagemDesculpe, saq",nao-consigo-sacar-o-meu-dinheiro_FLO2P0I51KIW8z_t,"Estou tentando a quase 10 dias realizar o saque do meu dinheiro e não consigo.Retorna a seguinte mensagemDesculpe, saques não estão disponíveis no momento. Tente novamente mais tarde ou entre em contato com o suporte ao cliente para mais informações.Isso ja tem 10 dias que esta aparecendo"
265,sportsbet-io,"Bom diaO aplicativo e pagina na web vive travando, e perdi uns 20,00 nessas:- Primeiro fui encerrar uma aposta ficou p",aplicativo-instavel-induz-a-erros_8KrQZZ49QjNCP5oz,"Bom diaO aplicativo e pagina na web vive travando, e perdi uns 20,00 nessas:- Primeiro fui encerrar uma aposta ficou pensando umas meia hora kkk e quando destravou a resposta tinha mudado o resultado!- Outra vez fui apostar no jogo que estava 1x1, apostei no empate travou de novo, quando voltou tava 2x1 e a aposta foi feita mesmo assim!! sacanagem hein!!sse continuar assim vou parar de apostar!!e me reembolsem meus R$ 20,00 para eu continuar apostando???"
266,sportsbet-io,"Botei R$ 100 reais e não consigo resgatar de jeito nenhum. Falaram que eu tinha que apostar todo meu dinheiro antes, já fiz isso e",nao-consigo-resgatar-meu-dinheiro_tKjmbqZetKdyY5dE,"Botei R$ 100 reais e não consigo resgatar de jeito nenhum. Falaram que eu tinha que apostar todo meu dinheiro antes, já fiz isso e mesmo assim continua dando erro. Sempre fala que o tipo de resgate que eu escolho não está disponível no momento, seja pix ou ted. Quero meu dinheiro!"
267,sportsbet-io,"Fiz uma aposta múltipla no site da casa de apostas sportsbet.io e eu deveria receber 18,98 por ter apostado 1 real. O resultado de",nao-pagaram-aposta-ganha-corretamente_84DIsVg5f28t9Vnu,"Fiz uma aposta múltipla no site da casa de apostas sportsbet.io e eu deveria receber 18,98 por ter apostado 1 real. O resultado de um jogo foi classificado como meio perdido com ods de mais 1/1.5 (saiu um gol no jogo) correto. Mas saiu outro resultado como meio perdido com ods de MAIS 2/2.5, resultado do jogo foi 1 a 1 e no site diz que se saírem 2 gols o resultado é MEIO GANHO. Resumindo, a sportsbet só me pagou pouco mais de 5 reais e deu como meio perdida a aposta q deveria ser meio ganha."
268,sportsbet-io,Ao criar minha conta no sportsbet.oi coloquei o e-mail errado victorsouzacps@hotmail.con sendo o correto victorsouzacps@hotmail.co,email-invalido_lFa3hRgdvB_aFGQy,"Ao criar minha conta no sportsbet.oi coloquei o e-mail errado victorsouzacps@hotmail.con sendo o correto victorsouzacps@hotmail.com . Devido a isso não consigo verificar o e-mail nem sacar o dinheiro depositado no aplicativo sportsbet.io , já mandei vários e-mail para eles e não tenho retorno "
269,sportsbet-io,"Prezados,estou tentando sacar o valor que consta em minha carteira, mas falam que tenho que ter no mínimo 100,00. Não locali",nao-consigo-sacar-meu-dinheiro_1ugXz0wVBqTw-fLB,"Prezados,estou tentando sacar o valor que consta em minha carteira, mas falam que tenho que ter no mínimo 100,00. Não localizei contato no site para falar com a empresa.Precisarei entrar com ação judicial para poder ter meu dinheiro de volta? Afinal, não irei depositar mais só pra poder ter a devolução, fora que aqui tem várias reclamações sobre pessoas que depositaram o valor que faltava e não tiveram sucesso em sacar. Aguardo posicionamento da empresa, caso não haja, entrarei com ação judicial para fazer valer meu direito de recuperar o valor que consta como saldo."
270,sportsbet-io,"Fiz um saque via Pix no valor de 129 rais no dia 08/01/22 as 23;01 horas e ainda não caiu na minha conta, já mandei emails pra ele",saque-luz-nao-caiu_hFz9I_9P3u8cCPhP,"Fiz um saque via Pix no valor de 129 rais no dia 08/01/22 as 23;01 horas e ainda não caiu na minha conta, já mandei emails pra eles e ainda não responderam, por isso estou abrindo a reclamação aqui."
271,sportsbet-io,"Por favor me ajudem, simplesmente sumiu uma certa quantia que estava em minha conta.,.",sumiu-dinheiro-da-minha-conta_cJ5z2TL91imAJt4O,"Por favor me ajudem, simplesmente sumiu uma certa quantia que estava em minha conta.,."
272,sportsbet-io,"Oi sou Bruno vim reclamar pq ontem eu terminei o dia com 112 reais quando abri o site hj, eu estáva zerado coloquei mais 90 reais ",aposta_Zkcyp_U4qxMDtoha,"Oi sou Bruno vim reclamar pq ontem eu terminei o dia com 112 reais quando abri o site hj, eu estáva zerado coloquei mais 90 reais terminei o dia de hoje com 118 porem quando eu fui fazer o pix pra transferir o dinheiro pra minha conta não consegui colocar a chave pix nao entrou ai pediu meu cpf coloquei porem o dinheiro não caiu na minha conta "
273,sportsbet-io,"Fui informada que para realizar o saque seria necessário fazer uma aposta no mesmo valor do depósito, fiz a aposta e ganhei, contu",saque_8at05T2gLKAowG_L,"Fui informada que para realizar o saque seria necessário fazer uma aposta no mesmo valor do depósito, fiz a aposta e ganhei, contudo, ainda não estou conseguindo sacar."
274,sportsbet-io,"Fiz uma aposta na promoção do black friday (final da libertadores) no valor de $10,00, contudo, o valor mínimo para depósito",problema-para-sacar-o-dinheiro_D8C7MTL7G6fpE_Vd,"Fiz uma aposta na promoção do black friday (final da libertadores) no valor de $10,00, contudo, o valor mínimo para depósito era de $50,00.Após realizar a aposta supracitada e perder, tentei sacar o dinheiro restante ($40,00) e não consegui, considerando que o valor mínimo para saque é de $100,00.Sendo assim, depositei mais $60,00 APENAS para realizar o saque, contudo, fui novamente surpreendida e não consegui realizar o saque, pois de acordo com o site meu depósito foi rejeitado por atividade insuficiente.Visando a resolução do problema realizei duas apostas aleatórias no valor de $01,00,  para tentar resolver o problema, porém, novamente não consegui realizar o saque.Após a aposta de $1 (que fiz somente para tentar resolver o problema e sacar o valor restante) fiquei com menos de $100,00 na conta (valor mínimo para saque), e novamente tive que realizar  um novo depósito de $50,00 (valor mínimo para depósito).Após todo este dissabor e pesquisando as possíveis causas achei a possível resposta:Você apostou completamente o valor do seu depósito? Por exemplo: se você depositou 100 BRL, e apostou um total de 60 BRL, você só vai conseguir sacar depois de apostar os 40 BRL restantes.Ocorre que em momento algum fui informada sobre essa condição para realizar o saque, ora, o site impõe valor mínimo de depósito e saque e depois quer condicionar a utilizar todo o valor depositado para sacar sem qualquer informação prévia?? Absurdo!!Falta transferência e informação!!No mais, meu namorado fez a mesma aposta (promoção da final da libertadores) e depois depositou mais $60 para completar os $100 e sacou sem nenhum problema, mesmo tendo apostando apenas $10,00.Ou seja, qual é o critério do site????Por fim, embora no site aparece que o valor está disponível para saque quando tento realizar a operação ocorre um erro e pede para entrar em contato com o suporte, conforme imagens que seguem anexas.Espero uma resolução o mais breve possível, pois caso não ocorra irei tomar as medidas judiciais cabíveis."
275,sportsbet-io,"Acertei aposta e deram como perdida, em outro jogo, duas apostas iguais, só me deram um e meia, em outros jogo, acertei dois handc",nao-respondem-email_0-9JuxPStXscrSMF,"Acertei aposta e deram como perdida, em outro jogo, duas apostas iguais, só me deram um e meia, em outros jogo, acertei dois handcaps e anularam minhas apostasm, tendo o resultado do jogo, sido acima do handcap."
276,sportsbet-io,"Acertei a aposta e até agora nada do meu dinheiro entrar, não encerraram minha aposta, deixaram ativa mas já terminou os jogos e j",acertei-a-aposta_cmNC-67kCkyde-hA,"Acertei a aposta e até agora nada do meu dinheiro entrar, não encerraram minha aposta, deixaram ativa mas já terminou os jogos e já ganhei! "
277,sportsbet-io,"Realizei um pix no dia 05/01 as 14:59, não caiu o saldo em minha conta, tentei por várias vezes contato por e-mail, único meio de ",deposito-via-pix-nao-caiu_IGx6yJTGAN-E6KX1,"Realizei um pix no dia 05/01 as 14:59, não caiu o saldo em minha conta, tentei por várias vezes contato por e-mail, único meio de comunicação, já começou errado nisso, ninguém me responde meus e-mails. Entrei na página no Instagram, também não obtive um retorno. Só queria uma resposta."
278,sportsbet-io,"Boa noite, fui fazer um saque e o Aplicativo travou muito inclusive sumiu a opção de pix, mandei via transferência e o processo de",aplicativo-travando-e-demora-em-creditar-saque_TRBHUFtWlJUbFWMp,"Boa noite, fui fazer um saque e o Aplicativo travou muito inclusive sumiu a opção de pix, mandei via transferência e o processo de saque não aparece em lugar nenhum como saberei o andamento do processo?"
279,sportsbet-io,Boa tarde fiz uma aposta de ID 61d70fc2a87724e2a071dfcf e aparece que perdi sendo que os jogos mencionados nem aconteceram ainda,aposta_HmfCh9N8WwEuIzyl,Boa tarde fiz uma aposta de ID 61d70fc2a87724e2a071dfcf e aparece que perdi sendo que os jogos mencionados nem aconteceram ainda
280,sportsbet-io,"Estou tentando realizar um saque via pix e estou sendo informado q meu saque foi declinado,  o valor está lá disponível mas não co",saque-declinado_4Q3WkuSpJyiisMeX,"Estou tentando realizar um saque via pix e estou sendo informado q meu saque foi declinado,  o valor está lá disponível mas não consigo realizar meu saque.Quero o meu dinheiro "
