,company_name,description,href,full_complain
0,sportsbet-io,"Fiz uma aposta em cantos na partida entre Nashvile x Austin.No momento, estava Nashvile 9x5 Austin, realizei a aposta para m",aposta-perdida--erro-do-site_W6mSXozQubL40Rai,"Fiz uma aposta em cantos na partida entre Nashvile x Austin.No momento, estava Nashvile 9x5 Austin, realizei a aposta para mais de 14.5 cantos.Saiu mais um canto para o time do Austin, batendo a aposta e no total, com 15 cantos no jogo.Porém, de acordo com a partida oficial, saiu 14 cantos, com Nashvile 8x6 Austin, ou seja, o site da sportbet.io, contabilizou errado os dados oficiais do jogo!Minha aposta deu como perdido por erro deles, e em contato com o suporte, fui informado que os dados são fornecidos por terceiros.Ou seja, para apostar, não podemos confiar no site da sportbet.io, temos que acompanhar em outros sites ou streaming!Lamentável !"
1,sportsbet-io,É uma luta pra sacar o dinheiro liberam meu dinheiro aí por favor pq não hora de depositar vcs aceitam agora pra sacar é tanto doc,quero-sacar-meu-dinheiro_HoW-ny8lF50utdIp,É uma luta pra sacar o dinheiro liberam meu dinheiro aí por favor pq não hora de depositar vcs aceitam agora pra sacar é tanto documento q é [Editado pelo Reclame Aqui]...quero dinheiro meu dinheiro ..
2,sportsbet-io,Fiz a conta no sportsbet fiz dois saque e de depois n consegui sempre da erro ou aparece saque não disponível quero saber se vocês,saque_-ud21ZHR5u3pB5m7,Fiz a conta no sportsbet fiz dois saque e de depois n consegui sempre da erro ou aparece saque não disponível quero saber se vocês vão arrumar isso aí 
3,sportsbet-io,FIZ UM DEPÓSITO VIA PIX AGORA A TARDE E ATÉ AGORA NÃO CAIU. NÃO CONSIGO FALAR COM A EMPRESA VIA CHAT. QUERO MEU DINHEIRO.,fiz-um-deposito-via-pix-e-nao-caiu_Oz_NpA_Razx-AZWN,FIZ UM DEPÓSITO VIA PIX AGORA A TARDE E ATÉ AGORA NÃO CAIU. NÃO CONSIGO FALAR COM A EMPRESA VIA CHAT. QUERO MEU DINHEIRO.
4,sportsbet-io,"A SPORTSBET.IO Também é responsável, há final é o PATROCINADOR MASTER  DO SÃO PAULO. No dia 20/08/2022 eu comprei uma camisa taman",camisa-adidas-do-sao-paulo-com-defeitos_wC9wzzIB9v-Iq-NE,"A SPORTSBET.IO Também é responsável, há final é o PATROCINADOR MASTER  DO SÃO PAULO. No dia 20/08/2022 eu comprei uma camisa tamanho M adidas do São Paulo 1 na loja SANTO MANTO BOX 34 A que fica dentro do estádio do MORUMBI, paguei na camisa 300 reais e paguei mais 20 para personaliza com o número atrás da camisa, valor total 320,00 reais pago a vista em dinheiro. Na quarta-feira dia 24/08/2022 eu usei a camisa pela primeira vez e para minha surpresa a camisa da adidas começou a descusturar em vários lugares da camisa, de imediato eu voltei para minha casa tirei a camisa e logo em seguida eu tentei entrar em contato com a loja SANTO MANTO mas eu não obtive sucesso no telefone, tentei entrar em contato com a loja pelo e-mail mas também sem sucesso, então decidi ir até a loja na quinta-feira dia 25/08/2022 ao chegar na loja, fui muito bem recebido pela senhora Gabrielly a mesma de imediato foi solicitada e tentou trocar a camisa mais já não tinha a camisa na loja, então a Gabrielly pegou o meu telefone para me informar quando chegasse uma nova remessa de camisas na loja, então no dia de hoje Sábado dia 27/08/2022 eu entrei em contato com a Gabrielly via WhatsApp e a mesma me deu uma opção porque não havia chegado a camisa 1 do São Paulo então ela perguntou se eu queria a camisa listrada 2 do São Paulo eu aceitei, e fui na loja mais para a minha surpresa ao chegar na loja o supervisor da loja SANTO MANTO me informou que eles não iam trocar a camisa porque eu havia tirado a etiqueta, eu fiz uma pergunta para ele, como que eu iria usar a camisa sem tirar a etiqueta? Pra mim usar eu teria que tirar a etiqueta!! Então ele mandou eu entrar em contato com a Adidas, eu entrei em contato com a Adidas, e foi me passado que eu teria que mandar um e-mail para eles e depois espera para eles mandarem um código deles para mim, e eu teria que ir até os correios e postar para eles a camisa para fazer uma avaliação na camisa olha o absurdo, eu comprei a camisa a vista 320,00 reias no dinheiro agora eu tenho que correr atrás do prejuízo sozinho e a loja SANTO MANTO QUE FICA DENTRO DO MORUMBI NÃO ME DEU NENHUM APOIO OLHA O ABSURDO, OLHA COMO A LOJA SANTO MANTO TRATA OS SEUS CLIENTES.EU ME PERGUNTO COMO QUE UMA CLUBE GIGANTE COMO O SÃO PAULO PERMITE UMA LOJA DENTRO DO SEU ESTADIO VENDER CAMISA DE UMA MARCA QUE NÃO PRESTA? O MATERIAL DE PÉSSIMA QUALIDADE, EU RECOMENDO NÃO COMPREM CAMISA DA ADIDAS DO SÃO PAULO NESSA LOJA SANTO MANTO E EM NENHUM SITE OU OUTRAS LOJAS.LAMENTÁVEL. PENSA NUM ESTRESSE QUE EU TÔ PASSANDO 320,00 REIAS PERDIDO. NÃO COMPREM."
5,sportsbet-io,"Não consigo autenticar a conta.Já mandei RG Conta endereço, mas dizem que é inválido.Estou com dinheiro parado na cont",autenticacao_CXGmRML-7qgZyZ3S,"Não consigo autenticar a conta.Já mandei RG Conta endereço, mas dizem que é inválido.Estou com dinheiro parado na conta.Por email sempre pedem pra autenticar,Quero desbloquear o valor.Login . dirceoliveiraEmail dirceoliveirah@gmail.comGrato"
6,sportsbet-io,sou cliente da corretora e faz 2 meses que estou tentando fazer saque da minha conta ja falei com suporte sac nada foi resolvido p,sou-cliente-da-corretora-e-faz-2-meses-que-estou-tentando-fazer-saque-da-minha-conta-ja-falei-com-suporte-sac-nada-foi-resolvido-p_cVn7DuqyThug9Esg,sou cliente da corretora e faz 2 meses que estou tentando fazer saque da minha conta ja falei com suporte sac nada foi resolvido p
7,sportsbet-io,"Estou com chamado de suporte por e-mail aberto, e pararam de me responder.Tive uns ganhos em um game do cassino e nao compen",ganhei-em-jogo-de-cassino-e-nao-compensaram-o-valor_NUvE7WjE0vseera7,"Estou com chamado de suporte por e-mail aberto, e pararam de me responder.Tive uns ganhos em um game do cassino e nao compensaram meu saldo. Pararam de me responder no suporte.Relação com o consumidor horrivel.Chat de suporte horrivel."
8,sportsbet-io,"Sou cliente da Sportsbet.io, e na noite do dia 16/08/22, as 20:27, fiz um depósito no valor de R$200,00, entretanto, o valor não c",sumico-de-dinheiro-de_q1wvS1gegg9Grbo2,"Sou cliente da Sportsbet.io, e na noite do dia 16/08/22, as 20:27, fiz um depósito no valor de R$200,00, entretanto, o valor não caiu em minha conta Sportsbet, já conferí minha conta e não houve estorno em minha conta bancária, entrei em contato, me solicitaram envio de foto do comprovante, pois já havia enviado o mesmo anexo e falaram que seria resolvido ontem, mas até agora nada foi resolvido e ninguém dá um parecer sobre o caso."
9,sportsbet-io,Olá não estou conseguindo sacar minha conta cadastrada é hotmail agora pediram pra mim trocar a senha é ativar o Google autenticad,nao-consigo-sacar_tlB2aOIcd48U3uMW,Olá não estou conseguindo sacar minha conta cadastrada é hotmail agora pediram pra mim trocar a senha é ativar o Google autenticador só que não dá certo o qrcode porque é hotmail 
10,sportsbet-io,Não estou conseguindo sacar eles pedem pra trocar a senha e autenticar no Google autenticador mas meu site cadastrado e hotmail aí,nao-consigo-sacar_cMrOX1muTvueOhCj,Não estou conseguindo sacar eles pedem pra trocar a senha e autenticar no Google autenticador mas meu site cadastrado e hotmail aí não consigo autenticar 
11,sportsbet-io,"Boa noite, Não é a primeira, segunda, terceira. é quarta vez que tenho que entrar em contato porque deram como perda u",correcao-de-aposta_0mgOv_aHTR_zFkBT,"Boa noite, Não é a primeira, segunda, terceira. é quarta vez que tenho que entrar em contato porque deram como perda uma aposta. Apostei que o jogo entre inter x melgar teria menos de 3,5 cartões. O jogo teve 3, portanto eu ganhei. ID: 62f592ad9ec5e23b53d3d833"
12,sportsbet-io,"Apostei 400 reais, ganhei 560,mas não consigo sacar ",nao-consigo-sacar_Na6nqQHrxiL0L9x_,"Apostei 400 reais, ganhei 560,mas não consigo sacar "
13,sportsbet-io,"Não consigo sacar o meu dinheiro ,pede para tentar novamente mais tarde.E preciso sacar o meu dinheiro o mais rápido possíve",nao-consigo-sacar-meu-dinheiro_-bL1LCeyckruhO26,"Não consigo sacar o meu dinheiro ,pede para tentar novamente mais tarde.E preciso sacar o meu dinheiro o mais rápido possível.  Pois na hora de depositar logo vai. Mais pra sacar não consigo "
14,sportsbet-io,"O Site deixa você depositar R$50,00 porém o saque mínimo é de R$ 100,00, fiz dois depósitos de R$ 50,00 perdi e tentei sacar R$ 50",sacar-o-dinheiro_hdzHjatZj5Sig3jd,"O Site deixa você depositar R$50,00 porém o saque mínimo é de R$ 100,00, fiz dois depósitos de R$ 50,00 perdi e tentei sacar R$ 50,00 mas eles não deixam. "
15,sportsbet-io,"Olá Boa noite, fiz um saque hoje porém deu erro de aprovação, já mandei o E-mail referente a isso porém ainda não obtive resposta,",saque_3l632Gu4ob1UxrDl,"Olá Boa noite, fiz um saque hoje porém deu erro de aprovação, já mandei o E-mail referente a isso porém ainda não obtive resposta, foi um saque no valor de 150 via Pix.. Gostaria de saber qual o procedimento agora se este saldo voltará para minha conta no site ou se automaticamente o saque será realizado novamente?"
16,sportsbet-io,"Caros, boa tardeEu fiz uma aposta onde eu encerrei algumas vezes e ele não estava finalizando, apenas carregava.",problema-com-o-jogo_K4HS14Nrbwe07m6c,"Caros, boa tardeEu fiz uma aposta onde eu encerrei algumas vezes e ele não estava finalizando, apenas carregava.Eu atualizava a página onde encerra a aposta e aparecia o valor para encerrar entre 490,00 a 500,00 reais. Mesmo assim ficava carregando e não encerrava.Mandei um e-mail para o sportbet.io, onde eu tive o retorno do Kleber que é do suporte do site informando que não foi validado, que é um provedor extra e tals.Então trocamos alguns e-mails onde no primeiro e-mail ele disse que  provavelmente não estava disponível para encerrar a aposta e depois que eu questionei que ele dizendo que provavelmente não é uma certeza.Ele disse no e-mail seguinte que não estava disponível.Mandei a evidência onde estava carregando e não encerrava a aposta.Peço apoio sobre isso, pois sempre usei o site do sportsbet por conta do meu time que tem parceria e sempre gostei do siteJá mandei um e-mail antes que eu entendi a situação que foi relatada pela funcionária do site.Mas agora eu confirmo que estava disponível a situação e não foi encerrado.Obs  ele parou de me responder até o momento.Abs"
17,sportsbet-io,"Passei o domingo inteiro esperando pra apostar no jogo do Barcelona e essa casa de aposta deixou bloqueado esse jogo o tempo todo,",jogos-com-bug_cv-fjPcNPYyaocyj,"Passei o domingo inteiro esperando pra apostar no jogo do Barcelona e essa casa de aposta deixou bloqueado esse jogo o tempo todo, pior casa de aposta que existe, vou voltar pra betano"
18,sportsbet-io,"Realizei 2 depósitos no dia 05/07/2022 O primeiro no valor de R$ 1.000,00 e o segundo no valor de R$ 1.500,00 ambos via pix,",deposito_mD2Quo-aAiTgOQ7q,"Realizei 2 depósitos no dia 05/07/2022 O primeiro no valor de R$ 1.000,00 e o segundo no valor de R$ 1.500,00 ambos via pix, o valor não foi creditado na conta da Sportsbet.Io, e foram feitos via pix, onde foi efetuado a transferência.Entrei em contato com o suporte da Sportsbet.Io e encaminhei o caso com comprovante da transferência e estrato da conta bancária na qual realizei a transferência. Tive um Feedback deles que iriam analisar com provedor de pagamentos e iriam entrar em contato novamente comigo através do mesmo e-mail. Fiquei em cima, para saber para onde foi enviado o meu dinheiro. E fui informado que o valor não havia sido creditado. Até o momento nada foi resolvido o valor não foi estornado e nem creditado na conta para tá fazendo apostas. "
19,sportsbet-io,Fiz um depósito na casa de apostas Sportbet.io e simplesmente o dinheiro sumiu quando tentei realizar uma aposta!!! 300 reais sumi,sportbetio-sumiu-com-o-meu-dinheiro_MJX8m20hXXDLLv5U,"Fiz um depósito na casa de apostas Sportbet.io e simplesmente o dinheiro sumiu quando tentei realizar uma aposta!!! 300 reais sumiram, não tem o ticket da aposta e nem nada, aguardo uma solução!"
20,sportsbet-io,"Efetuei o deposito do valor de R$100.00, pois o site orientava o como valor mínimo para saque. Realizei algumas apostas e resolvi ",saque-rejeitado--dificultam-ao-maximo-voce-retirar-seu-dinheiro-cuidado_5eIElXl5tF-2Accz,"Efetuei o deposito do valor de R$100.00, pois o site orientava o como valor mínimo para saque. Realizei algumas apostas e resolvi retirar meu dinheiro os meus R$ 100.00, mas acabo me deparando com o ""Saque declinado por atividade insuficiente. Você deve apostar 1x o valor do seu depósito antes de solicitar o saque.  (ID: bvHBjrks97wzFZELq)"".Entrando em contato com o suporte, acabo me deparando com a resposta de ""Poxa, realmente não tem o que fazer""Realmente indescritível a frustração que o site me gerou. Tinha tudo para ser um ótimo site, mas acaba logrando os utilizadores."
21,sportsbet-io,"Fiz um depósito de R$ 251,00 e jogando como sempre faço, obtive ganhos em algum jogos que chegaram a R$ 1.330,00. Tentei efetuar u",saque-nao-autorizado_E2AXzkpxx6ws7W38,"Fiz um depósito de R$ 251,00 e jogando como sempre faço, obtive ganhos em algum jogos que chegaram a R$ 1.330,00. Tentei efetuar um saque e quando ia para o campo, alegavem que não tinha saldo. Entrei em contato com o suporte e vinheram com uma conversinha de que o valor não poderia ser sacado por ser ganho de bônus e só poderia sacar se fosse em criptomoedas, sendo que meu saldo nessa moeda não existia! Algumas horas depois de haver pedido uma retratação e a correção, eles transferiram sem que eu pedisse o meu saldo que já estava em R$ 900,00 para a carteira de criptomoedas e alegaram que eu não havia feito depósito e sim havia ganho bônus! Quero meu saldo devolta na moeda em que depositei antes de ter meu ganhos! Estou desde das 14 horas de hoje nessa luta!"
22,sportsbet-io,"Quarta feira passada, dia 27/07, minha conta foi arbitrariamente congelada e não me foi dada nenhuma explicação. Ja mandei emails ",conta-bloqueada_lwM2UEuq4F_cuaFy,"Quarta feira passada, dia 27/07, minha conta foi arbitrariamente congelada e não me foi dada nenhuma explicação. Ja mandei emails e nada de respostas. Total falta de respeito com o cliente."
23,sportsbet-io,"Mais uma vez estou aqui pra reclamar dessa empresa, ganhei uma aposta com id 62e6c6a7018a64a319efddccPartida do psg, a parti",ganhei-a-aposta-e-o-dinheiro-nao-caiu_C4QTIHrg28TN2os5,"Mais uma vez estou aqui pra reclamar dessa empresa, ganhei uma aposta com id 62e6c6a7018a64a319efddccPartida do psg, a partida acabou a tempos e o dinheiro não foi creditado, queria o dinheiro pra poder fazer aposta no jogo do São Paulo e a partida do sp tá acabando fui muito prejudicado hoje, ainda mais que faço muita aposta nessa casa onde não me dão valor mais uma vez prejudicado sensação horrivel"
24,sportsbet-io,"JOGO DE HOJE, 30/07/22: TOTTENHAM 0 x 1 ROMA. Fiz 3 apostas de placar, iguais, 0 x 1, e acertei. Depois do jogo demoraram muito na",site-anulou-as-apostas-que-ganhei_wDXgjouTbNV5KBbf,"JOGO DE HOJE, 30/07/22: TOTTENHAM 0 x 1 ROMA. Fiz 3 apostas de placar, iguais, 0 x 1, e acertei. Depois do jogo demoraram muito na análise das apostas. Pra minha surpresa ANULARAM 2 apostas e deram 1 como PERDEU. Dá para acreditar? Estou explicando uma explicação. Vão dizer o quê? Tenho os comprovantes. SAFADEZA!!! Vão enganar na cara dura? Só porque o site perdeu? Perdendo toda a credibilidade.."
25,sportsbet-io,O site estava com uma aposta aberta olhei e pensei que podia baterLogo fiz a aposta e quando o jogo acabou a aposta ba,aposta-nao-paga_Q7DBk74SmGtV2Whq,O site estava com uma aposta aberta olhei e pensei que podia baterLogo fiz a aposta e quando o jogo acabou a aposta bateu o jogo era ajax X Psv a aposta foi que o jogo irá acabar 5x3 para o psv quando acabou a aposta foi anulada devolveram o dinheiro mas não pagaram o valor correto da aposta 
26,sportsbet-io,"Solicitei uma transferência via PIX da minha conta do sportsbet.io para a minha conta bancária, às 00h:10min do dia 29/07/22. A tr",sumiram-com-o-meu-dinheiro_5eHecR_VHrsKEEkc,"Solicitei uma transferência via PIX da minha conta do sportsbet.io para a minha conta bancária, às 00h:10min do dia 29/07/22. A transação travou e não ocorreu, aparecendo a mensagem de ""erro na aprovação"", entretanto, o dinheiro no valor de R$ 100,00 sumiu da minha conta no sportsbet.io. Já se passaram mais de 12h e até agora nenhuma satisfação da empresa. Enviei 2 emails e me responderam de forma genérica que o ""provedor de pagamentos está passando por uma certa instabilidade"".Completamente decepcionado com essa empresa, que se diz séria, com grandes patrocínios de times de futebol. Aparentemente tudo marketing e fachada. Se vcs de fato têm alguma credibilidade, devolvam meu dinheiro! O próximo passo será entrar com ação judicial!"
27,sportsbet-io,"No dia 23 de Julho de 2022 fiz o primeiro depósito no valor de 50 reais por volta das 11hs....no mesmo dia por volta das 14hs, fiz",fiz-dois-pix-com-a-mesma-chave-no-mesmo-dia-mas-somente-1-pix-caiu-na-carteira-do-site-de-apostas_9YiBXC7xcDQwx9sB,"No dia 23 de Julho de 2022 fiz o primeiro depósito no valor de 50 reais por volta das 11hs....no mesmo dia por volta das 14hs, fiz outro depósito de mesmo valor e usando a mesma chave pix salva anteriormente. Só que apenas o primeiro depósito das 11hs caiu em minha carteira no site de apostas o segundo não. Entrei em contato com suporte, mandei todos os extratos com meus dados e número da chave pix, pediram para aguardar a resposta da operadora financeira... Só que até hoje dia 28 de Julho, essa resposta não veio. "
28,sportsbet-io,fui tentar logar e não consigo acessar minha contafalaram pra eu entrar com o suporte mas já enviei uns 3 e-mails narr,conta-desativada-sportsbet_oR7X8oZRmv4xvZKt,"fui tentar logar e não consigo acessar minha contafalaram pra eu entrar com o suporte mas já enviei uns 3 e-mails narrando toda a situação e nada pf me ajudem, minha conta é matneba, preciso do dinheiro que ta la"
29,sportsbet-io,"fiz uma aposta em um jogador de Tênis. o jogador venceu o jogo mas, a Sportsbet.io não me pagou o valor da aposta. eles me devolve",aposta-nao-paga_SCoc0K_MrJ64OTw1,"fiz uma aposta em um jogador de Tênis. o jogador venceu o jogo mas, a Sportsbet.io não me pagou o valor da aposta. eles me devolveram o valor apostado. quando mandei e-mail para reclamar, eles me responderam que houve erro no servidor deles e por isso anularam a aposta. aí fico imaginando a seguinte situação: eu  apostando R$ 10.000,00 no Flamengo, o flamengo ganha o jogo (na cotação de hoje, R$ 15.140,00) e a Sportsbet.io devolve o valor apostado e alega que teve problemas com o servidor e, por esse motivo a aposta foi anulada! então imagino a situação contrária: eu apostando R$ 10.000,00 no flamengo, o Flamengo perde o jogo e eu peço meu dinheiro de volta e alego que tive problemas com minha internet! será que eles me devolveriam?"
30,sportsbet-io,"Quero fazer mais uma reclamação sobre essa empresa, está tendo muitos jogos ao vivo e todos estão indisponíveis sem chance de eu j",jogos-indisponiveis_8E5Lqg9ex7KntsQo,"Quero fazer mais uma reclamação sobre essa empresa, está tendo muitos jogos ao vivo e todos estão indisponíveis sem chance de eu jogar e tentar ganhar algo, sem contar que essa empresa não tem mais atendente no chat ao vivo, ou seja cada dia que passa estão regredindo isso é inadmissível "
31,sportsbet-io,"Fiz uma aposta para uma partida do dia de amanhã, o dinheiro foi descontado da minha conta, mas quando vou nas ""apostas ativa",fiz-uma-aposta-para-amanha-e-nao-esta-aparecendo-no-ticket-de-apostas-ativas_J5Fl7HQAiKFJsp9s,"Fiz uma aposta para uma partida do dia de amanhã, o dinheiro foi descontado da minha conta, mas quando vou nas ""apostas ativas"" aparece que não tenho nenhuma aposta ativa."
32,sportsbet-io,Bom dia!! Entrei em contato com o chat do site e um atendente não resolveu o meu problema. Fiz uma aposta em um ,aposta-ganha-e-nao-recebi-o-valor_XMdQGUnkbXtDVUxs,"Bom dia!! Entrei em contato com o chat do site e um atendente não resolveu o meu problema. Fiz uma aposta em um jogo com o objetivo de a partida ter mais 9,5 escanteios e no final da partida teve 10 escanteios de acordo com as estatísticas do site, e apareceu como perdida a aposta. Verifiquei as estatísticas  do jogo e vi que realmente a partida teve 10 escanteios e com isso teria ganho a aposta, fui em outros sites para verificar as estatísticas  do jogo e vi que eu realmente tinha ganho a aposta, até mesmo o site que o atendente Kleber da sportsbet io me enviou para verificar aparecia 10 escanteios se for ver minuto a minuto da partida mesmo assim eles não assumiram o erro e até agora não recebi o meu valor da aposta. "
33,sportsbet-io,"Fiz um cadastro na casa de apostas sportsbet.io, vi que era uma casa com a interface boa, indiquei para minha namorada e minha mãe",o-site-de-postas-nao-quer-liberar-meus-ganhos_YInkqtWlF164Hmpu,"Fiz um cadastro na casa de apostas sportsbet.io, vi que era uma casa com a interface boa, indiquei para minha namorada e minha mãe, que respectivamente fizeram também seus cadastros, comecei a ganhar e lucrar na casa, e aí começaram a me limitar e não deixavam mais eu jogar, então fui fazer meu saque, e não deixaram, isso mesmo !! não deixaram eu fazer o saque, nem se quer do meu depósito, e tambem bloquearam as contas da minha mãe e da minha namorada, sendo que elas nem moram comigo, vinham so de vez enquando pedir alguns dicas. Se eles não deixam mais jogar, pelo menos deixar sacar meus ganhos . Que falta de respeito com o consumidor!!"
34,sportsbet-io,"Boa noite. Fiz um depósito no dia no dia 14/07, no valor de 60 reais e junto uma aposta de 10 reais. Entretanto ",autoexclusao-da-conta_t_1itGK2D6Hef9rt,"Boa noite. Fiz um depósito no dia no dia 14/07, no valor de 60 reais e junto uma aposta de 10 reais. Entretanto após essa aposta não consegui mais acessar minha conta, simplesmente não entra. Em contato com a casa por e-mail me afirmaram que a conta entrou em processo de autoexclusão. Não consegui entender sob qual circunstância, pois eu utilizo a conta, obviamente pois depositei dinheiro, como também não solicitei tal exclusão. Sem contar que sequer me informaram de tal fato antes do dia 15/07, simplesmente me impediram de acessar minha conta e meu dinheiro e não querem me ajudar. Aqui é minha última tentativa, pois estarei procurando a justiça caso não resolvam. "
35,sportsbet-io,"Recentemente adicionei algum valor no site, realizei algumas apostas e resolvi sacar, porém já a dois dias quando tento sacar (ind",saque-indisponivel_3QRfTifZdosZ3thS,"Recentemente adicionei algum valor no site, realizei algumas apostas e resolvi sacar, porém já a dois dias quando tento sacar (independente do método de saque) aparece saque indisponível, sendo que apostei com o dinheiro que depositei e o valor de saque é acima dos 50 reais que é o mínimo, enviei mensagem ao suporte e não recebi nenhuma resposta."
36,sportsbet-io,"Fiz a conta no aplicativo! Resolvi mudar de senha onde o próprio aplicativo aprovou, na hora de loga não entra! Refiz várias senha",nao-consigo-logar_IsfGWgs6phbacj1o,"Fiz a conta no aplicativo! Resolvi mudar de senha onde o próprio aplicativo aprovou, na hora de loga não entra! Refiz várias senhas e continuo sem conseguir acessar, estou com dinheiro lá e nem posso apostar ou sacar! Não entra!"
37,sportsbet-io,"Houve uma partida de Counter-Strike entre BlueJays x Forze no dia 14/07/2022, a empresa responsavel pelo evento ESEA, cometeu um e",jogo-cancelado-e-mal-feito_6kpwymMWtmQ_geZ3,"Houve uma partida de Counter-Strike entre BlueJays x Forze no dia 14/07/2022, a empresa responsavel pelo evento ESEA, cometeu um erro ao banir o IGL da equipe, cujo mudaria o rumo do jogo, isso sem aviso prévio 5 minutos antes do jogo, nisso tiveram que colocar uma pessoa pra completar que nem jogava CS, a partida foi feita e eles perderam, remarcaram a partida para o dia 15/07/2022 e eles jogaram novamente e ganharam, como eu tinha apostado no mapa 1 (em rounds 5.5+) do dia 14/07 e eles tinham perdido, eu perdi a aposta, mas eles refizeram o jogo qual está listado na HLTV, reclamei em diversos emails para a Sportsbet e eles não me ajudaram em nada e estão considerando um placar de um jogo que foi cancelado ! péssima empresa"
38,sportsbet-io,"Fiz uma aposta no jogo vila nova e csa emMais de 0,5 gols pro vila nova, mais mesmo antes mesmo do jogo acabar colocou que e",estao-me-lesando_oGjlxUP7QQ5Y7llE,"Fiz uma aposta no jogo vila nova e csa emMais de 0,5 gols pro vila nova, mais mesmo antes mesmo do jogo acabar colocou que eu perdi só que o vila nova fez um gol ou seja eu ganhei a aposta essa casa de aposta tá me lesando vou mostrar em todas redes sociais  a sacanagem que estão fazendo comigo isso é muito injusto eu perdi o dia inteiro de aposta na hora que eu ganho me lesam sacanagem comigoA id da aposta 62d21b84603c442990d8fe1e"
