,company_name,description,href,full_complain
473,sportsbet-io,"Fiz meu cadastro queria conhecer o site de apostas, fiz um depósito valor mínimo de R$50,00, depois de perder alguns reais, quis e",nao-consigo-sacar-e-encerrar-minha-conta_K52Z2ZTPksyrSMsd,"Fiz meu cadastro queria conhecer o site de apostas, fiz um depósito valor mínimo de R$50,00, depois de perder alguns reais, quis efetuar o saque e encerrar a conta.. Para minha surpresa o valor mínimo para saque era de 100,0 . Realizei um segundo depósito para poder sacar.. mas não consigo sacar porque eles exigem que vc faça apostas do valor total do seu primeiro depósito pra poder sacar, o que ao meu ver fere ao código do consumidor, tenho o direito de não querer mais apostar e retirar meu dinheiro .. O dinheiro é meu e as regras não são claras quanto as condições de, vc só fica sabendo quando tenta sacar. Devolvam minha grana o direito de fazer o que eu quiser com ele e encerrar minha conta nesta porcaria de site."
474,sportsbet-io,"Apostei 12 reais em 5 jogos e ganhei 215. Porém na hora de sacar via pix,  eles pedem pra entrar em contato com o suporte via emai",nao-consigo-sacar_6zMd32Ti4rxGWGdS,"Apostei 12 reais em 5 jogos e ganhei 215. Porém na hora de sacar via pix,  eles pedem pra entrar em contato com o suporte via email e não respondem, sendo q pra depositar não tive problema nenhum"
475,sportsbet-io,"Faz algum tempo que venho tentando, da maneira mais amigável possível, resolver uma ocorrência com a referida empresa, entrando em",saque-nao-realizado_Y1Ud2ttJg_zPoviN,"Faz algum tempo que venho tentando, da maneira mais amigável possível, resolver uma ocorrência com a referida empresa, entrando em contato por meio do endereço fornecido pelo suporte.Trata-se da tentativa de dois saques, pertinentes a algumas apostas vitoriosas, no mês de março deste ano, no valor de R$ 10.000,00 cada, porém, sem êxito até o momento.A empresa alega, que após eu ter feito duas tentativas de saques nos valores mencionados, supostamente estes retornaram para a minha conta e que foram descontados em apostas diversas.Volto a questionar, se os créditos estivessem disponíveis no meu saldo, qual o sentido de eu ter realizado depósitos no intervalo de menos 24 horas, para realização de outras apostas? Tenho os anexos e prints, que inclusive, encaminhei para o suporte da SpostsBet.io.Ademais, não há uma mínima explicação razoável, para que num intervalo inferior a 24 horas, alguém aposte e perca mais de R$ 20.000,00.Numa outra hipótese remota, se de fato eu tivesse perdido em novas apostas, os valores citados integralmente, é óbvio que não voltaria a fazer jogo algum, diante do prejuízo econômico e abalo psicológico no mínimo.No aguardo de retorno, maiores esclarecimentos e que se faça apenas justiça."
476,sportsbet-io,Bom dia. Meu saldo no sportingbet.io foi reduzido sem eu ter feito nenhum saque. Como isso é possível? Aguardo esclarecimento.,saldo-reduzido_7rb87krad_sGwQ3v,Bom dia. Meu saldo no sportingbet.io foi reduzido sem eu ter feito nenhum saque. Como isso é possível? Aguardo esclarecimento.
477,sportsbet-io,"Fi aposta no aplicativo no jogo do Cusco vs Deportivo colocando mais de 9.5 escanteios e bateu 10 escanteios, no final do jogo fal",aposta-no-aplicativo_OkJHE3BLcell8ru3,"Fi aposta no aplicativo no jogo do Cusco vs Deportivo colocando mais de 9.5 escanteios e bateu 10 escanteios, no final do jogo fala que eu perdi a aposta"
478,sportsbet-io,. . ,prender-valores_AcjDEMFlizlsxhBw,. . 
479,sportsbet-io,Apostei no handicap asiático -0.5 no Palmeiras contra o internacional no dia 17/10. O Palmeiras ganhou o jogo por 1x0 e eu perdi a,sportsbetio-errou-na-finalizacao-da-minha-aposta_4az4883LQYR-X7hZ,Apostei no handicap asiático -0.5 no Palmeiras contra o internacional no dia 17/10. O Palmeiras ganhou o jogo por 1x0 e eu perdi a aposta.Id da aposta: 616c86f1c437280ff36f94b5
480,sportsbet-io,"Já tem dois dias que tento logar no aplicativo e aparece o erro 403. No e-mail dizem que o problema irá ser resolvido, e até agora",erro-no-aplicativo_udNfCppKEIe_11FJ,"Já tem dois dias que tento logar no aplicativo e aparece o erro 403. No e-mail dizem que o problema irá ser resolvido, e até agora nada de solução"
481,sportsbet-io,Acertei a sequência de 3 Jogos mas no site diz q acertei apenas 01,sequencia-do-brasileirao_EYt1ntXPJamsZotv,Acertei a sequência de 3 Jogos mas no site diz q acertei apenas 01
482,sportsbet-io,"Não consigo acessar o app, está dando consigo 403. Porém, pelo navegador eu consigo entrar normalmente! ",erro-ao-entrar-no-app-codigo-403_-LZoK1ji82BcMId0,"Não consigo acessar o app, está dando consigo 403. Porém, pelo navegador eu consigo entrar normalmente! "
483,sportsbet-io,"Não consigo mais acessar minha conta pelo aplicativo no celular. Sempre dar erro código 403. Já tentei logar em outro dispositivo,",erro-403_kkrta0y5noZUkXee,"Não consigo mais acessar minha conta pelo aplicativo no celular. Sempre dar erro código 403. Já tentei logar em outro dispositivo, mais o erro persiste. Já pelo navegador conecta normalmente. Por favor solucionar o problema erro o mais rápido possível, pois usar a plataforma pelo aplicativo é muito mais vantajoso. "
484,sportsbet-io,"Estava acessando minha conta normalmente pelo app usando minha conta Google, bastou o app atualizar que não consigo mais acessar, ",nao-consigo-acessar-minha-conta-pelo-app_Cw-I1uZRBVvA6efe,"Estava acessando minha conta normalmente pelo app usando minha conta Google, bastou o app atualizar que não consigo mais acessar, pela web consigo normalmente, mas pelo app só dá a mensagem ""erro inesperado código: 403""Usuário: PauloAjalaE-mail: pauloeverton2811@gmail.com"
485,sportsbet-io,"Efetuei um deposito de R199,99 e até agora não tive este crédito.  Já reclamei duas vezes e até agora nada. Será que vou tomar est",meu-dinheiro-de-volta_lkMCdwpPNSkoKUca,"Efetuei um deposito de R199,99 e até agora não tive este crédito.  Já reclamei duas vezes e até agora nada. Será que vou tomar este [Editado pelo Reclame Aqui]???????"
486,sportsbet-io,"Conseguia acessar normalmente minha conta pelo app só que agora tá dando um erro 403 que não consigo acessar de jeito nenhum, já r",app-apresentando-erro-403_W-XtwJQZSmtxILzX,"Conseguia acessar normalmente minha conta pelo app só que agora tá dando um erro 403 que não consigo acessar de jeito nenhum, já reinstalei, limpei cache e dados e continua assim."
487,sportsbet-io,"Pra adicionar é fácil, sacar tá sendo uma dor de cabeça. Sempre dá erro, o suporte não responde. Eu já usei os 50 que coloquei ent",saque-indisponivel_W-U8GhukWoifqHFr,"Pra adicionar é fácil, sacar tá sendo uma dor de cabeça. Sempre dá erro, o suporte não responde. Eu já usei os 50 que coloquei então não tem o porque bloquear. Quero meu dinheiro por direito."
488,sportsbet-io,Bom dia. Estou sendo obrigada a apostar TODO O MEU SALDO para poder realizar o saque da plataforma. Eu NÃO ADERI A NEM UMA PROMOÇÃ,impedida-de-sacara-o-saldo-estou-sendo-obrigada-a-apostar_49YxGGSrWCQxYygY,"Bom dia. Estou sendo obrigada a apostar TODO O MEU SALDO para poder realizar o saque da plataforma. Eu NÃO ADERI A NEM UMA PROMOÇÃO eu apenas quero sacar o restante do MEU DINHEIRO. Explico: Eu possuía 39,9 de saldo na sportsbet.io, porém fui informada que para realizar o saque destes 39,9 teria q ter no mínimo 100, ou seja, depositar mais dinheiro para sacar. Realizei então um depósito de 70 reais totalizando na plataforma a quantia de 109,90, porém meu saque foi NEGADO, o motivo ? SOU OBRIGADA A APOSTAR TUDO E SE SOBRAR DINHEIRO AI SIM POSSO SACAR. Exatamente isso que vc leu caro colega, a casa está obrigando os apostadores a consumir seus produtos ferindo gravemente o consumidor.Entrei em contato no chat para resolver a situação, o atendente falou que era isso mesmo que eu não ia poder sacar até arriscar todo meu dinheiro e ME BANIU DO CHAT, NEM PRINT DA CONVERSA PUDE TIRAR eu vou repetir, ME BANIRAM DO CHAT ME IMPEDINDO ATÉ DE TIRAR PRINT DA CONVERSA. O atendente me mostrou os termos de uso da plataforma, que fere gravemente os direitos do consumidor, sendo que eu NUNCA ACEITEI ESSES TERMOS, NUCAAA!!! Eles atualizaram os termos de uso sem informar o apostador, isso msm, eles deram uma volta em geral."
489,sportsbet-io,"Fiz uma aposta, ela bateu todos os jogos e ao invés de me pagar o valor, encerraram a aposta. Inclusive fiz principalmente da tela",aposta-ganha-e-encerrada-sem-razao_1UL-9poNV3S3wydW,"Fiz uma aposta, ela bateu todos os jogos e ao invés de me pagar o valor, encerraram a aposta. Inclusive fiz principalmente da tela. Aguardo retorno breve!"
490,sportsbet-io,"Preciso retirar meu dinheiro de lá, mas o suporte é péssimo e só dá erro é incrível para depositar vai fácil agora para retirar é ",nao-consigo-sacar_TAgAl1XQfOGEYqw7,"Preciso retirar meu dinheiro de lá, mas o suporte é péssimo e só dá erro é incrível para depositar vai fácil agora para retirar é quase impossível, aguardo um retorno pois não contato com a empresa é a coisa mais difícil que existe. "
491,sportsbet-io,"Fiz o saque pelo pix no valor de R$201 e não caiu em minha conta, e nem estornado.",erro-no-saque_loCHQyrkyqqBsSF4,"Fiz o saque pelo pix no valor de R$201 e não caiu em minha conta, e nem estornado."
492,sportsbet-io,"recentemente fiz a solicitação de troca do email da conta, pelo email disponibilizado pela plataforma seguranca@sportsbet.io, mas ",nao-consigo-alterar-o-email-da-conta-para-verificar-e-realizar-o-saque_61EPG-dgkF7QEhkK,"recentemente fiz a solicitação de troca do email da conta, pelo email disponibilizado pela plataforma seguranca@sportsbet.io, mas sem resposta, preciso alterar o email urgente para conseguir realizar o saque. quero alterar para o e-mail : viniciuslqueiroz11@gmail.com, por gentileza, preciso dessa alteração o mais rapido possível. Usuário: ViniLeite11"
493,sportsbet-io,Tento entrar no site e não consigo. Aparece a seguinte mensagem:Error 1015 You are being rate limited.The ,erro-ao-entrar-no-site_Dn3SKJe_TN2G1nuY,Tento entrar no site e não consigo. Aparece a seguinte mensagem:Error 1015 You are being rate limited.The owner of this website (sportsbet.io) has banned you temporarily from accessing this website.Tem 3 dias que aparece essa mesma mensagem.
494,sportsbet-io,"Já fiz um saque pela casa no passado, fiz um depósito e apostei quase metade dele e não estão liberando meu saque.Fui fazer ",nao-consigo-fazer-o-saque-ja-saquei-uma-vez-pela-casa-nessa-segunda-vez-estao-retendo-meu-dinheiro__7A_lsDgxIT7sPT_,"Já fiz um saque pela casa no passado, fiz um depósito e apostei quase metade dele e não estão liberando meu saque.Fui fazer a verificação dos documentos e foi negada, peço o saque e negam. **Estão segurando dinheiro dos clientes.Já fiz um saque e não deu problemaQuero parte do dinheiro que eu depositei e apostei, somente, pois sou acostumado a fazer saque em todas as casas de aposta até estrangeiras (que não tem no Brasil) e nunca tive problema, primeira vez que meu dinheiro fica literalmente retido.* O saque cumpre o requisito de valor mínimo e etc...Usuário: RonaldtkktEmail: ronaldm@id.uff.br"
495,sportsbet-io,"Eu coloquei 50 reais na carteira hoje, e fiz uma aposta de 5 reais. Porém o mínimo pra saque era 100, coloquei mais 55 e fui sacar",tentei-sacar-meu-dinheiro-declinaram-e-nao-devolveram-a-carteira_M6RDZIAh25d4wYYV,"Eu coloquei 50 reais na carteira hoje, e fiz uma aposta de 5 reais. Porém o mínimo pra saque era 100, coloquei mais 55 e fui sacar. Eles declinaram e sumiram com os 100 da minha carteira. Eu quero por favor o meu dinheiro, alguém me ajuda por favor!!"
496,sportsbet-io,"Fiz um pix para apostar no aplicativo ,depois de algumas hora minha conta foi desativada,não errei senha pois utilizo minha digita",conta-desativada_2kUMUR5llToQNyCR,"Fiz um pix para apostar no aplicativo ,depois de algumas hora minha conta foi desativada,não errei senha pois utilizo minha digital, mandei e-mail para o suporte mas não obtive resposta"
497,sportsbet-io,"Pelo amor de Deus,preciso de ajuda,eu estava com 772 de saldo,fiz uma aposta de 272 q me devolveria 400 e pouco,ela foi vencida...",conta-cancelada_bcQjBYCJuJyC5a5B,"Pelo amor de Deus,preciso de ajuda,eu estava com 772 de saldo,fiz uma aposta de 272 q me devolveria 400 e pouco,ela foi vencida....totalizando um saldo de 900 e pouco,eu estava contando com isso pra realizar meu saque via Pix e quitar uma conta de luz e pagar meu aluguel...e assim q entro na conta após essa vitória,não tenho mais acesso...eu preciso muito desse dinheiro,eu tava contando com ele,me ajudem pelo amor de Deus"
498,sportsbet-io,"Tive hj minha conta desativada com quase 400,00 , aguardo uma resposta da empresa pois não solicitei, simplesmente não consigo ent",minha-conta-foi-desativada_ob9FMSuK2IVw1eSw,"Tive hj minha conta desativada com quase 400,00 , aguardo uma resposta da empresa pois não solicitei, simplesmente não consigo entrar mais ! E aparece uma mensagem dizendo que minha conta foi desativada"
499,sportsbet-io,"Olá! Já encaminhei alguns e-mails, junto do comprovante da transação via PIX dia 18/09 referente a um depósito até então, não cred",deposito-nao-creditado_aylN60NLZX6oHBmM,"Olá! Já encaminhei alguns e-mails, junto do comprovante da transação via PIX dia 18/09 referente a um depósito até então, não creditado em conta, mas não tive sucesso.Nunca tive problemas nessa modalidade de depósito, inclusive não demorando mais que 10 minutos na maioria das vezes, mas até o presente momento, se passaram quase 20 dias e não tive nenhum retorno da bet io."
500,sportsbet-io,"fiz movimentações de apostas na Sportsbet.io, quando fui sacar pediu uma verificação de email, porém esse email para verificar não",o-email-de-verificacao-da-conta-nao-chega-para-realizar-o-saque_k9WWt8DE7iKBuM3O,"fiz movimentações de apostas na Sportsbet.io, quando fui sacar pediu uma verificação de email, porém esse email para verificar não chega nunca, estou tentando faz dias, e ja olhei em tudo, spam,lixo, etc, todas as caixas do email, preciso realizar esse saque imediatamente, porque essa verificação somente na hora de sacar e não na hora de apostar o suporte não responde via email e no chat ao vivo, Meu usuario é o ViniLeite11, se a empresa não me responder, estarei entrando na Justiça pedindo pela reparação dos danos."
501,sportsbet-io,Fiz um saque na terça feira e ainda não caio,oi-fiz-um-saque--na-terca-feira-de-450-e-nao-caio-ainda_BnalmZMVErLIkfrU,Fiz um saque na terça feira e ainda não caio
502,sportsbet-io,"Já pedi 3 vezes a alteração do meu e-mail pois digitei o domínio do e-mail incorreto na hora do cadastro e não recebo respostas, t",alteracao-de-email_KdaDi_zNFIFUZHRL,"Já pedi 3 vezes a alteração do meu e-mail pois digitei o domínio do e-mail incorreto na hora do cadastro e não recebo respostas, tenho dinheiro depositado no site e não consigo retira-lo."
503,sportsbet-io,Boua tarde no 10/09/2021 as 15:11 dos um depósito para empresa sobre o nome pinBank Brasil pisa CNPJ.17079937000105 valor 50 reais,nao-caiu-o-dinheiro-que-depositei_dONs2IbUVQcaj6k7,Boua tarde no 10/09/2021 as 15:11 dos um depósito para empresa sobre o nome pinBank Brasil pisa CNPJ.17079937000105 valor 50 reais ao verificar minha conta spotbets.io  o dinheiro foi creditado e depois algumas horas vei a sumir da minha conta tentei contato com suporte relatando o acontecido pedi a verificao ce existia mais uma conta em meu CPF que poderia estar este valor.cuando fiz o cadastro não sabia muito bem realizar o mesmo pode ter acontecido de eu ter abrido duas conta no mesmo imail e foi recusado pelo suporte e por isso pedir uma verificação.seque o comprovante do anexo do depósito q fiz.
504,sportsbet-io,"Tive problemas pra verificar a conta, pois pediam validade da identidade( a mesma não possui validade por lei). Hoje resolveram o ",saque-e-verificacao-de-conta_Js2xNsfx5f0EqXcP,"Tive problemas pra verificar a conta, pois pediam validade da identidade( a mesma não possui validade por lei). Hoje resolveram o problema dando a opção de não marcar a validade. Fiz minha verificação, no site não aparece mais pra verificar, mas mandaram um email dizendo que a verificação não foi concluída e eu devo repetir. Mas não aparece mais no site e ainda não consigo sacar meu dinheiro."
505,sportsbet-io,"A partida já encerrou e meu ganho não foi creditado, isso já faz mais de 24 horas! Preciso que resolvam !iD da aposta:",aposta_6SULJ6oD_OWddEj9,"A partida já encerrou e meu ganho não foi creditado, isso já faz mais de 24 horas! Preciso que resolvam !iD da aposta: 615cc15180436b3761b0f0ed"
506,sportsbet-io,Quero parar de apostar,quero-encerrar-minha-conta_ppeREHVfUwBjf7gl,Quero parar de apostar
507,sportsbet-io,"Tomem cuidado caso decidam entrar nesta casa de apostas. Eu jogo, e jogo valendo muito, mas muitas vezes sou prejudicado pelo próp",placar-nao-atualiza_uCVPOPltv-8i9CJ9,"Tomem cuidado caso decidam entrar nesta casa de apostas. Eu jogo, e jogo valendo muito, mas muitas vezes sou prejudicado pelo próprio site por não atualizarem o placar em tempo real. Acompanho volei de praia e tênis de mesa, e de um segundo para o outro soma-se 3, 4, 5, 6 pontos na partida e eu me sinto jogando às cegas. É horrível, me sinto [Editado pelo Reclame Aqui]."
508,sportsbet-io,"Bom dia, teriam como novamente resolver esse problema constante? Isso é insatisfatório para um jogador nao poder sacar depois de u",nao-consigo-sacar_DCVOstQlKeKggPY0,"Bom dia, teriam como novamente resolver esse problema constante? Isso é insatisfatório para um jogador nao poder sacar depois de uma quantia ganha"
509,sportsbet-io,"No dia 28/09/21 coloquei R$50 no site, porém hoje dia 03/10 o dinheiro ainda não foi debitado no site e nem estornado no cartão, g",dinheiro-nao-cai-no-site_XmPC2QFX2kAhReAq,"No dia 28/09/21 coloquei R$50 no site, porém hoje dia 03/10 o dinheiro ainda não foi debitado no site e nem estornado no cartão, gostaria de saber o que aconteceu, o nome da conta no site é gabriellemattioli"
510,sportsbet-io,"Boa tarde, alerto a todos os apostadores  do sportsbet.ioQue tomem muito cuidado com seu dinheiro . Eu tinha uma valor",nao-me-devolveram-meu-dinheiro_EoBCkGOHjK_9fRWE,"Boa tarde, alerto a todos os apostadores  do sportsbet.ioQue tomem muito cuidado com seu dinheiro . Eu tinha uma valor em meu saldo que sumiu , eles alegam que fiz uma duplicata.....Nunca fiz tal aposta desse tipo E a última que eu tinha feito foi no valor de 10 reaisSobrou 20 reais, do nada sumiu , tomou doriu. E eu não consigo nem se quer ter meu dinheiro devolvidoRepito mais uma vez , eu não fiz aposta nenhuma de duplicata E fácil dizer que fiz alterar qualquer coisa E pegar meu dinheiro Se isso acontecer com todos os apostadores vão ficar ricos .Tirando um pouco de cada umPior jogo que já ouvi falar Pior jogo que conheço na minha história de vida Grande covardes Atenção a todos os apostadores Vejam seus valores Cuidado , derrepente pode fazer uma duplicata sozinha e sumir seu dinheiro !Como podem ver na foto postada, saldo zero . Perdi meu dinheiro de vdd O verdadeiro jogo de azar sportsbet.io"
511,sportsbet-io,"Sempre que coloco pra sacar, aparece uma mensagem dizendo que ocorreu um erro inesperado.",nao-consigo-sacar-o-dinheiro_TP_YZN4sM6K_5Flx,"Sempre que coloco pra sacar, aparece uma mensagem dizendo que ocorreu um erro inesperado."
512,sportsbet-io,Estou tentando fazer um saque na minha conta já tem um tempo e até hoje não tive sucesso. Depositei um dinheiro e fiz uma aposta n,problema-com-saque_dD5CesfokXvNCtHd,"Estou tentando fazer um saque na minha conta já tem um tempo e até hoje não tive sucesso. Depositei um dinheiro e fiz uma aposta no valor do deposito, mas mesmo assim não consigo efetuar o saque. A casa de aposta tem que melhorar urgentemente isso, vejo muitas reclamações referentes a esse problema. Resolvam meu problema logo, estou precisando urgentemente do dinheiro !!!!"
513,sportsbet-io,"Boa tarde,Estou tentando realizar um saque de apostas que fiz e ganhei mas não consigo. Aparece uma mensagem dizendo que foi",saque-rejeitado_rBIeNNf57DTP5GJY,"Boa tarde,Estou tentando realizar um saque de apostas que fiz e ganhei mas não consigo. Aparece uma mensagem dizendo que foi rejeitado por atividade insuficiente e me orientando a apostar o valor total do meu saque para depois conseguir sacar porém isso é arriscado e não existe condicionar uma atividade a outra. Gosto muito da casa de apostas mas estou muito decepcionado, acabaram de perder um cliente porque sei que não vou conseguir esse dinheiro hoje. Apesar de saber que para eles não vai ter a mínima diferença um jogador a menos está registrada minha insatisfação e aguardo o retorno para sacar o dinheiro que é meu."
514,sportsbet-io,"Foi feito um depósito no Sportsbet.io em 25.11.2020, realizei algumas apostas, agora apareceu um saque do valor total em 25.08.202",dinheiro-foi-retirado-da-conta-via-saque-nao-autorizado_mBg4u4WXjTggpBst,"Foi feito um depósito no Sportsbet.io em 25.11.2020, realizei algumas apostas, agora apareceu um saque do valor total em 25.08.2021, sendo que não pedi e nem está em conta alguma minha. Aparece tão somente ""saque manual"" mas não demonstra para que banco/conta foi feito.Nem pelo site, nem pelo aplicativo solucionam ou explicam o ocorrido, foi tentado contato via email constante no site, mas sem retorno."
515,sportsbet-io,"Recentemente estou tendo muitos problemas com a casa de aposta, isso está me causando um transtorno e um cansaço fora do normal, e",novamente-nao-consigo-sacar_eOFuqSCrnlfx992S,"Recentemente estou tendo muitos problemas com a casa de aposta, isso está me causando um transtorno e um cansaço fora do normal, eu jogo para me diverti, pois nem lucro estou tendo, porém ao tentar realizar um saque no valor de 500 R$ no qual quase nunca realizo pois é difícil ter um ganho me aparece a seguinte mensagem "" Note por favor que o seu saque foi rejeitado por atividade insuficiente. Você deve apostar 1x o valor do seu depósito para sacar "" Mas o que é isso? eu não tenho direito de sacar o dinheiro que ganhei? isso é um absurdo, e-mail do suporte não responde, sempre demora muito a responder, quando responde é pela metade, eu preciso de resposta urgente, caso não resolva meu problema irei me retirar da casa de aposta junto com vários amigos, e relatar em todas redes sociais, grupos de whatsapp, telegram, infelizmente estou muito insatisfeito com essa situação"
516,sportsbet-io,Estou tentando sacar o dinheiro pois me arrependi de usar a casa de apostas porém diz que só posso sacar se eu apostar o valor dep,saque_R06Tb04NEvcI6m4k,Estou tentando sacar o dinheiro pois me arrependi de usar a casa de apostas porém diz que só posso sacar se eu apostar o valor depósitado gostaria que pudesse ajudar a retirar meu dinheiro por favor 
517,sportsbet-io,"Sou iniciante de comecei através das publicidades na televisão. A casa exige que você faça um depósito mínimo de R$ 50,00, mas par",cuidado-com-essa-casa_b1z1wQ_OPoVRIBg_,"Sou iniciante de comecei através das publicidades na televisão. A casa exige que você faça um depósito mínimo de R$ 50,00, mas para sacar, você precisa ter R$ 100,00 na conta kkkk. Ou seja: Para jogar precisa de 50 mas para sacar tem que ser 100. Um enorme caça níquel. Resumindo: Só entre se você for uma pessoa muito experiente com apostas, caso contrário, ira simplesmente dar o seu dinheiro para eles. "
518,sportsbet-io,Então eu fui fazer um saque de 500 reais e nao me retornaram to esperando e o dinheiro ta na conta e nao sai,nao-estao-me-devolvendo-meu-dinheiro_7x5z_EMk964y3Pcn,Então eu fui fazer um saque de 500 reais e nao me retornaram to esperando e o dinheiro ta na conta e nao sai
519,sportsbet-io,"Boa tarde , venho desabafar com muita tristeza o que fizeram comigo.Coloquei a primeira vez 50 reais para fazer minhas apost",sumiu-meu-dinheiro_UiQv89OYy4z6x3Mb,"Boa tarde , venho desabafar com muita tristeza o que fizeram comigo.Coloquei a primeira vez 50 reais para fazer minhas apostas Perdi o valor depositado.Depois fiz um depósito de mais 50reaisFiz uma.aposta no valor de.20 reais Sobrou 30 ok Daí fiz uma aposta no valor de 10 reais Sobraria 20 correto Os 20 reais sumiu sem ao menos eu ter feito nenhuma apostaPelo e-mail alegaram que fiz aposta em dobro sei lá o que !Tenho toda certeza que não fiz nenhuma aposta , até pq teria que escolher os times , etc.....Só queria honestidade Independente de ser uma valor baixo Não dá o direito de sumirem com meu dinheiro .São covardes Estou consultando um advogado Com toda certeza se tiver que entrar com uma ação judicial irei entrar .Nunca fiz lucro turbinado , não sei nem como e isso .Lutando pelo meu direito ."
520,sportsbet-io,"Estou tentando sacar dinheiro da minha conta, entretanto, eles não liberam e pedem para entrar em contato com o suporte, porém, o ",nao-liberacao-do-saque_DW8l-6kgCDlzKpsl,"Estou tentando sacar dinheiro da minha conta, entretanto, eles não liberam e pedem para entrar em contato com o suporte, porém, o suporte ao cliente é horrível."
521,sportsbet-io,"Tenho um saldo a sacar de 500 reais que preciso para pagar dívidas, estou tentando entrar em co tato com suporte, mas eles aparent",nao-realizacao-do-saque-da-conta_SPGVFHpX3S7Meuwl,"Tenho um saldo a sacar de 500 reais que preciso para pagar dívidas, estou tentando entrar em co tato com suporte, mas eles aparentemente não auxilian e nem facilitam, cuidado com o Sportsbet.io não aconselho, plataforma feita para criar problemas."
