,company_name,description,href,full_complain
700,sportsbet-io,"Entrei para realizar o saque, e preenchi todos os campos pedidos e simplesmente não aparece a opção para sacar. E não tem nenhum c",nao-consigo-sacar_GaB5wp2qJNxvH4_H,"Entrei para realizar o saque, e preenchi todos os campos pedidos e simplesmente não aparece a opção para sacar. E não tem nenhum contato para ajuda "
701,sportsbet-io,Pix não entrou ,fiz-o-pix-tem-mais-de-3-horas-e-nao-entrou_gTLkLqsHxofWrXIE,Pix não entrou 
702,sportsbet-io,"Fiz o cadastro para participar da promoção da euro, fiz a aposta qualificadora, o clube venceu e não recebi minha aposta grátis de",apostas-gratis-nao-creditadas_enCkInAE1ndm9txO,"Fiz o cadastro para participar da promoção da euro, fiz a aposta qualificadora, o clube venceu e não recebi minha aposta grátis de 10 reais "
703,sportsbet-io,"Depositei o valor de 50 reais no site, fiz algumas apostas e obtive 1 real de lucro. Para sacar o dinheiro o site diz que precisa ",saque-declinado_AWdtSJD8e0eBJdxt,"Depositei o valor de 50 reais no site, fiz algumas apostas e obtive 1 real de lucro. Para sacar o dinheiro o site diz que precisa de no mínimo 100 reais depositados na conta. Realizei hoje um depósito de mais 50 reais para eu poder sacar o meu dinheiro. Tentei sacar 3 vezes e não obtive sucesso."
704,sportsbet-io,"Fiz uma aposta em um jogo da NBA, 2 horas antes do jogo começar tentei cancelar a aposta, em um botão  que eles disponibilizam par",prejudicado-por-instabilidade-no-site_aKldbP9b8aVgSB9u,"Fiz uma aposta em um jogo da NBA, 2 horas antes do jogo começar tentei cancelar a aposta, em um botão  que eles disponibilizam para cancelar alguma aposta que vc tenha feito, entretanto, por conta de uma instabilidade no site, a minha aposta não cancelava de jeito nenhum, ficava carregando infinitamente.Chamei o suporte no mesmo momento para tentar me ajudar a cancelar a aposta, disseram para continuar tentando, que, de fato, o site estava com problemas. Eu perguntei o que aconteceria caso minha aposta não cancelasse e eu a perdesse, me disseram que provavelmente a aposta seria anulada.Porém, através do email me disseram que não poderiam cancelar a aposta pois, o cash out, a ferramente para cancelamento das apostas, é uma ferramente bônus. Sim, essa foi a desculpa deles para justificar o erro."
705,sportsbet-io,"criei a conta ontem, fiz um deposito de 50 reais e apostei meu dinheiro, lucrei e agora quero retirar mas meu email nao estava ver",nao-consigo-verificar-o-meu-email_v1LNXR5BwrAsO1xH,"criei a conta ontem, fiz um deposito de 50 reais e apostei meu dinheiro, lucrei e agora quero retirar mas meu email nao estava verificado, peço pra receber o email mas o email nao chega pra mim, nao esta no spam tambem"
706,sportsbet-io,"O sistema do sportsbet.io relatou erro na aprovação do meu saque, porém não fez a devolução do dinheiro para que eu pudesse tentar",erro-na-aprovacao-do-saque_Kc35uP2XkwoV6jw_,"O sistema do sportsbet.io relatou erro na aprovação do meu saque, porém não fez a devolução do dinheiro para que eu pudesse tentar sacar por outra via"
707,sportsbet-io,"Depositei 50 reais via Qrcode / pix , e só está aparecendo na minha carteira +50 confirmado , minha moeda est em EUR e não consigo",deposito-via-pix_opFBzriHYh5AuTOL,"Depositei 50 reais via Qrcode / pix , e só está aparecendo na minha carteira +50 confirmado , minha moeda est em EUR e não consigo trocar por BRl"
708,sportsbet-io,"Dia 05/06/2021 fiz um Pix de R$20,00 para o Sportsbet e após isso não consigo fazer login no site. Coloco o usuário e senha corret",erro-no-login_xIIqSTVSNrT-vkR8,"Dia 05/06/2021 fiz um Pix de R$20,00 para o Sportsbet e após isso não consigo fazer login no site. Coloco o usuário e senha corretamente e acusa que está incorreto. Solicitei alteração de senha as 15:10 do dia 05/06 e até o momento não enviaram o email para alteração da senha."
709,sportsbet-io,"Ontem fiz um pix de 50 reais e o saldo se encontra em conta, mas ao efetuar aposta dá sem fundos suficientes, já mandei email para",saldo-nao-disponivel_eWUO91Nt5h0ujO5u,"Ontem fiz um pix de 50 reais e o saldo se encontra em conta, mas ao efetuar aposta dá sem fundos suficientes, já mandei email para segurança@sportsbet.io sem sucesso"
710,sportsbet-io,"Depositei 100 reais 29/05 sábado, hoje dia 02/06 e ainda não caiu o dinheiro. Sendo que foi debitado da minha conta!!!!",editado-pelo-reclame-aqui_e3xdsb22F3w-TT6z,"Depositei 100 reais 29/05 sábado, hoje dia 02/06 e ainda não caiu o dinheiro. Sendo que foi debitado da minha conta!!!!"
711,sportsbet-io,"Fiz um saque na final da libertadores e agora não consigo sacar, toda hora dá saque declinado e pede pra entrar em contato com o s",nao-liberam-meu-saque_2Zs8Gym0WgMfAvgC,"Fiz um saque na final da libertadores e agora não consigo sacar, toda hora dá saque declinado e pede pra entrar em contato com o suporte, sendo que o chat só tem mensagens já programadas e o email diz que o domínio não existe. Quero meu dinheiro!"
712,sportsbet-io,"ESTOU PASSANDO PARA DEIXAR REGISTRADO A TODOS PARA NÃO APOSTAREM NESSA CASA DE APOSTA. SISTEMA CHEIRO DE ERROS, PRINCIPALMENTE QUA",corram-dessa-casa-de-apostas--sistema-cheio-de-erros_n-ewo7UuHhJW3uWl,"ESTOU PASSANDO PARA DEIXAR REGISTRADO A TODOS PARA NÃO APOSTAREM NESSA CASA DE APOSTA. SISTEMA CHEIRO DE ERROS, PRINCIPALMENTE QUANDO VC VAI ENCERRAR APOSTA NO FINAL DO JOGO."
713,sportsbet-io,No dia 27/05/2021 fiz uma aposta de 20 reais em uma partida de futebol no sportsbet.io. ocorre que o site computou a mesma aposta ,fiz-uma-aposta-e-o-site-computou-a-mesma-duas-vezes__cJ4mFNksKsW08uV,"No dia 27/05/2021 fiz uma aposta de 20 reais em uma partida de futebol no sportsbet.io. ocorre que o site computou a mesma aposta duas vezes. Com o resultado negativo, perdi dinheiro duas vezes com a mesma aposta. Sendo que nem era pra ser possível fazer duas apostas exatamente iguais. Entrei em contato com o suporte e me foi dito que nada poderiam fazer, mas claramente a falha foi do próprio site e o certo seria descontar a derrota apenas uma vez. "
714,sportsbet-io,"Boa tarde, estava jogando blackjack, fiz uma aposta de R$ 250, quando fui pedir a proxima carta, que eu provavelmente iria ganhar,",partida-no-cassino-travou-na-hora-de-pedir-a-carta-ou-seja-um-prejuizo-de-500-reais_NHuBBH0LkUYlV97u,"Boa tarde, estava jogando blackjack, fiz uma aposta de R$ 250, quando fui pedir a proxima carta, que eu provavelmente iria ganhar, misteriosamente o jogo travou,  quando voltou nao dava + tempo para pedira proxima carta, ai fica dificil né sportbet.io como vai confiar na casa desse jeito, na hora de apostas maiores o jogo trava.quero o cancelamento da mão, é o minimo que voces podem fazer.Mesa: Bombay Club Blackjack 4          Numero de Jogo: #15:29:18Valor apostado: R$ 250Espero que voces tenham bom Senso e no minimo cancele a partida!caso ao contrario vou achar que voces estão [Editado pelo Reclame Aqui] seus jogadores!"
715,sportsbet-io,Fiz o pix pra apostar e até agr não entrou no app,fiz-o-pix-e-nao-caiu_7gg69aTk3Mm53pi-,Fiz o pix pra apostar e até agr não entrou no app
716,sportsbet-io,"Olá meu saldo era 30 reais e agora está zerado,ontem eu tinha colocado 50 e gastei 20 em apostas cadê os 30 ? Sumiu quero ele de v",meu-saldo-sumiu_bxi-EFIjYIk1lvN3,"Olá meu saldo era 30 reais e agora está zerado,ontem eu tinha colocado 50 e gastei 20 em apostas cadê os 30 ? Sumiu quero ele de volta para eu poder apostar"
717,sportsbet-io,"Fiz uma aposta tipo Money line no jogo de basquete entre Trotamundos e Broncos de Caracas.O Trotamundos venceu, mas a aposta apare",sportsbetio_akhhoUr3XCGX5a7A,"Fiz uma aposta tipo Money line no jogo de basquete entre Trotamundos e Broncos de Caracas.O Trotamundos venceu, mas a aposta aparece como perdida.1Y1Z7A1JD4 id do cupom."
718,sportsbet-io,"Eu estava com uma certa quantia na conta, fiz algumas apostas algumas perdi mas algumas ganhei só que o valor estava mudando toda ",dinheiro-sumiu_SJQVE_lk50wlEZzK,"Eu estava com uma certa quantia na conta, fiz algumas apostas algumas perdi mas algumas ganhei só que o valor estava mudando toda hora as vezes para mais ou para menos até que eu fiz uma aposta e ganhei estava com um saldo por volta de 180, só que logo depois o valor sumiu e fiquei somente com 50 reais de saldo. Sportingbet.io eu quero meu dinheiro!!!"
719,sportsbet-io,"Eu cliquei em encerrar a aposta o site ficou carregando e não finalizou como eu pedi, eu estava vencendo e não deixaram mais eu en",nao-deixam-voce-encerrar-a-aposta_KfFBPEMOsYwNRSzf,"Eu cliquei em encerrar a aposta o site ficou carregando e não finalizou como eu pedi, eu estava vencendo e não deixaram mais eu encerrar, procurem nos logs o exato momento que eu encerrei, não é a primeira vez que acontece e dessa vez eu não vou aceitar ja vi casos parecidos e há jurisprudência. Quero o dinheiro referente ao momento que eu encerrei, reclamei no chat da empresa e disseram que a aposta só é encerrada quando a página acaba de carregar porém ela só para de carregar quando vc perde, cai num [Editado pelo Reclame Aqui]  Usuário Cleyton406ID 60a935a84219f7f613d16b77"
720,sportsbet-io,"Ganhei uma aposta dizendo que ia ter mais de 2,5 cartoes no jogo e perdi outra dizendo que ia ter menos que 4,5. Logo se eu perdi ",ganhei-uma-aposta-e-nao-foi-computada-ainda_4kSORIeQswbev7QS,"Ganhei uma aposta dizendo que ia ter mais de 2,5 cartoes no jogo e perdi outra dizendo que ia ter menos que 4,5. Logo se eu perdi a segunda, singnifica que venci a primeira. A perda já foi computada, mas tem quase 24h que o acerto não foi computado,"
721,sportsbet-io,"Dia 27/04 comprei fichas através de um agente indicado pelo Sportsbet. Passado um tempo, decidi sacar uma parte dos ganhos porém o",nao-consigo-sacar_t1wiRp9jYt2U5qlS,"Dia 27/04 comprei fichas através de um agente indicado pelo Sportsbet. Passado um tempo, decidi sacar uma parte dos ganhos porém o saldo para saque estava zerado. Desde então, mesmo após tendo registrado várias apostas meu saldo para saque continua zerado.Entrei em contato com o suporte para solicitar o resgate mas sem sucesso, impossível contatar a empresa.Infelizmente, mesmo sendo um apostador assíduo e gostar da plataforma, vou migrar de plataforma."
722,sportsbet-io,"Tenho R$ 316,00 disponível para saque em minha conta, mas não consigo sacar. Aparece a mensagem: ""Saque negado. Id referência",saque-negado-id-referencia_ffrBEQI2kDxx82UB,"Tenho R$ 316,00 disponível para saque em minha conta, mas não consigo sacar. Aparece a mensagem: ""Saque negado. Id referência: 567514599"".  Desejo o saque do dinheiro, já uso a plataforma a algum tempo e é a primeira vez que isso acontece.Meu usuario cadastrado na plataforma é arsenalecommerceAguardo solução rápida."
723,sportsbet-io,"Oi, boa noite. Eu cadastrei minha conta há uma semana e estava hoje mexendo no site de vocês vendo as odds para os próximos jogos ",jogos-rapidos--aposta-nao-intencional_sUiKVDJMaC7Xt55k,"Oi, boa noite. Eu cadastrei minha conta há uma semana e estava hoje mexendo no site de vocês vendo as odds para os próximos jogos da premier league. Eis que eu vejo uma aba com o escrito ""Jogos Rápidos"" e vou ver o que é. Fui em Super Flip e esperei abrir. Quando abriu eu apertei em um botão e girou uma roleta, apertei de novo e girou de novo.Quando fui ver meu saldo estava com quase 30 reais a menos! Como isso? Não ficou claro para mim, não foi avisado e nem fui instruído a colocar valor nenhum! Pra mim isso era algo para distração, não sabia que envolvia dinheiro. Estragou meu dia e minha experiência com vocês foi pro ralo!Estou profundamente chateado e incrédulo com isso. Eu estava apenas navegando no site e de repente eu perco 30 reais??? Por favor, quero que resolvam isso o quanto antes.Sou o usuário cowritewe, cpf: 45846911854"
724,sportsbet-io,"Olá! Estou tentando excluir minha conta permanentemente na SportsBet.io e infelizmente não consigo, tentei dois e-mail ligados ao ",exclusao-de-conta_kZMvYASBi5MU3aGe,"Olá! Estou tentando excluir minha conta permanentemente na SportsBet.io e infelizmente não consigo, tentei dois e-mail ligados ao suporte e nada, sendo um compliance@sportsbet.io e o outro suporte@sportsbet.io.Gostaria que excluíssem minha conta. Entrem em contato comigo pelo e-mail: thalesvalentimc@hotmail.com"
725,sportsbet-io,"Tentei verificar minha conta que eu tô com saldo no site, e estou querendo sacar, já mandei todos os requisitos para a verificação",cadastro-nao-aceito_Y6ETVuHklwmG6STC,"Tentei verificar minha conta que eu tô com saldo no site, e estou querendo sacar, já mandei todos os requisitos para a verificação, e eles não aceita. Sendo que eu enviei tudo que eles pedem corretamente."
726,sportsbet-io,"No dia 18/05/2021,  fiz a aposta no intuito de ""EMPATE"", no Jogo Zvezda São Petersburgo X Rodina Moscovo, onde o jogo te",aposta-nao-validada--18052021_YNxOIzwJZjhjn4H8,"No dia 18/05/2021,  fiz a aposta no intuito de ""EMPATE"", no Jogo Zvezda São Petersburgo X Rodina Moscovo, onde o jogo terminou em empate. Minha aposta não foi efetivada, ficou carregando e carregando, mas não efetivou, o jogo terminou e ainda ficou carregando. Peço que verifiquem esse ocorrido, pois minha aposta foi assertiva e estou adequado a receber a premiação."
727,sportsbet-io,Realizei um depósito de LTC e não caiu na minha conta. Já tem 2 dias. ,deposito_LC1THy-gRJbh00hR,Realizei um depósito de LTC e não caiu na minha conta. Já tem 2 dias. 
728,sportsbet-io,"Todos os boletos foram pagos, tenho os comprovantes e no próprio site diz que foi confirmado. Tenho certeza que vocês não liberari",boleto-pago_0CwjM_jNlak6Z5Ry,"Todos os boletos foram pagos, tenho os comprovantes e no próprio site diz que foi confirmado. Tenho certeza que vocês não liberariam o valor caso o boleto não tivesse sido pago. Infelizmente, a empresa vai aplicar um [Editado pelo Reclame Aqui] e aparentemente vai ficar por isso mesmo. Muito indignado com esse site!!"
729,sportsbet-io,"Fiz 3 apostas , ganhei e até hoje não resgatei meu dinheiro pois eles não pagam quando eu ganho apenas quando eu perdoeles I",fiz-3-apostas--ganhei-e-ate-hoje-nao-resgatei-meu-dinheiro-pois-eles-nao-pagam-quando-eu-ganho-apenas-quando-eu-perdoeles-nao-debitam_DpBtqFmO2GSBRNcs,"Fiz 3 apostas , ganhei e até hoje não resgatei meu dinheiro pois eles não pagam quando eu ganho apenas quando eu perdoeles Id das apostas:609f1e6a9b465bd3d10eb0cc609f1d1a338b0b8311035d27609f11e59b465becf80ea687"
730,sportsbet-io,"boa tarde Ganhei aposta mais de 3,5 jogo acabo 2X2 Roma X Manchester  ganhei a aposta o dinheiro foi creditado depois ",ganhei-aposta-mais-de-35-jogo-acabo-2x2-roma-x-manchester--ganhei-a-aposta-o-dinheiro-foi-creditado-depois-sumiu-e-sumiu-o-dinheiro-da-minha-conta--valor-20250_Je0FlzB8tNdyvT0h,"boa tarde Ganhei aposta mais de 3,5 jogo acabo 2X2 Roma X Manchester  ganhei a aposta o dinheiro foi creditado depois sumiu e sumiu o dinheiro da minha conta  Valor 202,50 tentei contado diversas vezes e-mail não me responde ."
731,sportsbet-io,"Hoje ao fazer uma aposta no valor de R$500 em dois jogos, tive a mesma aposta duplicada pelo aplicativo sem o meu consentimento, a",fiz-uma-aposta-conclui-e-a-mesma-aposta-foi-duplicada-pelo-aplicativo-sportsbetio-sem-o-meu-consentimento_4xAQVgMyYXhLzhyr,"Hoje ao fazer uma aposta no valor de R$500 em dois jogos, tive a mesma aposta duplicada pelo aplicativo sem o meu consentimento, acredito eu, que por erro de sistema.Quero uma solução imediata para esta situação, visto que estou sendo [Editado pelo Reclame Aqui] por este aplicativo.No aguardo de resposta condizente e que resolva esta situação que denigre a imagem de um bom aplicativo de apostas."
732,sportsbet-io,"Efetuei uma aposta em Tachira x Internacional, o valor foi descontado do saldo, o resultado foi favorável, porém não recebi o valo",site-de-apostas-nao-confiavel_EaL5VgNeHkJWo6eO,"Efetuei uma aposta em Tachira x Internacional, o valor foi descontado do saldo, o resultado foi favorável, porém não recebi o valor correspondente ao ganho da aposta, voltou apenas o valor apostado.No site aparece seguinte  a informação: ""Manutenção de emergenciaNosso site está sob manutenção emergencial no momento, por isso, você pode enfrentar problemas técnicos. Estamos trabalhando para finalizar a manutenção o mais rápido possível, sentimos muito pelo transtorno.""Contudo tento contato pelo chat e a mensagem é a seguinte: ""No momento, não há nenhum Agente de Suporte em Português disponível. Por favor, entre em contato por e-mail ou inicie um chat em Inglês.""Ou seja, tem que mandar um e-mail para sabe-se lá quando obter um retorno.Não recomendo este site, para quem gosta de apostas tem outros melhores."
733,sportsbet-io,"Faz uma semana que tento utilizar o site para fazer algumas apostas. Mesmo com o saldo na conta, aparecia um erro que não possibil",erro-no-site-e-pior-suporte_dzhPhgccdwfafHbh,"Faz uma semana que tento utilizar o site para fazer algumas apostas. Mesmo com o saldo na conta, aparecia um erro que não possibilitava entrar nos jogos. Perdi algumas entradas bem consideráveis.Tentei contato com o suporte algumas vezes e eles nunca responderam. Agora para minha surpresa, o site sumiu combina parte do meu dinheiro e o suporte ainda parece que não existe.Pela estrutura do site e patrocínio de grandes clubes, achei que seria um site confiável, mas aparentemente, eles não tem respeito nenhum aos clientes e nenhuma responsabilidade com o que estão fazendo."
734,sportsbet-io,"Olá bom dia, gostaria de uma resposta sobre o meu depósito via pix em uma conta disponibilizada por vocês feita no ultimo sábado d",compensacao-de-deposito_P7dc9djE55KQ3Izu,"Olá bom dia, gostaria de uma resposta sobre o meu depósito via pix em uma conta disponibilizada por vocês feita no ultimo sábado dia 08/05/2021. Hoje já é dia 11/05/2021 e até agora o valor não foi disponibilizado na plataforma e pagamentos via pix nao demora nem 10 minutos para constar quero que resolvam, pois ja entrei em contato via email e nao obtive resposta. O depósito foi de R$ 250,00 via pix meu email cadastrado: jonathanpaulo1596@hotmail.com."
735,sportsbet-io,Apostei em uma múltipla 4  quando estava começando o segundo tempo do último  jogo resolvi encerrar para pegar o dinheiro fui cliq,apostei-em-uma-multipla-4--quando-estava-comecando-o-segundo-tempo-do-ultimo-jogo-resolvi-encerrar_eZs_-9nYYGshcQ2V,"Apostei em uma múltipla 4  quando estava começando o segundo tempo do último  jogo resolvi encerrar para pegar o dinheiro fui cliquei em encerrar quando estava 105,31 aí a ordem já não aparecia como apostada Aí quando o time empatou que aí pra ia ser um certo prejuízo a ordem voltou a abrir Fui falar com eles e eles falaram que não teve nenhuma ordem de encerramento ou melhor dizendo manipularam o jogo Porque a ordem só abriu quando o real empatou  "
736,sportsbet-io,"Fiz uma aposta no dia 08/05/2021 no jogo entre Bahia x Ceará,apostei no número de gols que iria ser marcado na partida,o jogo term",aposta-encerrada_-7SuZhzPkCHDXn3s,"Fiz uma aposta no dia 08/05/2021 no jogo entre Bahia x Ceará,apostei no número de gols que iria ser marcado na partida,o jogo terminou 2 x 1, porém as equipe  equipes empataram e decidiram a partida nos pênaltis onde o Bahia saiu vencedor,ID da aposta 6096df4b7b020895ed3cbbbc,desde agradeço pelo atendimento."
737,sportsbet-io,"Tenho saldo em conta, mas quando clico na opção de saque sou informado de que não tenho saldo suficiente para saque.",nao-consigo-sacar_iiEg4HD6SWkNrIa0,"Tenho saldo em conta, mas quando clico na opção de saque sou informado de que não tenho saldo suficiente para saque."
738,sportsbet-io,Não consigo sacar o meu dinheiro que está no Sportsbet io.O que preciso fazer para sacar?,nao-consigo-sacar-meu-dinheiro_ZtpDlqGbgD1E8vFc,Não consigo sacar o meu dinheiro que está no Sportsbet io.O que preciso fazer para sacar?
739,sportsbet-io,"Fiz a solicitação do saque, mas se passaram uma semana e ainda não recebi o dinheiro e não retornou para minha conta",saque_Mh0S7p_Ujzw1lWf7,"Fiz a solicitação do saque, mas se passaram uma semana e ainda não recebi o dinheiro e não retornou para minha conta"
740,sportsbet-io,"Fiz um depósito para fazer uma aposta no paredão do BBB. Quando fui sacar, tinha um limite mínimo de 100,00, sendo assim, transfer",nao-devolvem-o-meu-dinheiro_aCIX12eWJuFDDQ0Z,"Fiz um depósito para fazer uma aposta no paredão do BBB. Quando fui sacar, tinha um limite mínimo de 100,00, sendo assim, transferi mais 50,00 para retirada.Hoje fui verificar a transação e na plataforma aparece a mensagem de que eu preciso apostar o valor total do depósito para poder sacar, sendo que no momento do depósito não há essa informação e nem no pedido de saue, nem mesmo no FAQ do site fala sobre isso. Pura enganação! No chat online tem apenas mensagens automáticas.Quero o meu dinheiro de volta! "
742,sportsbet-io,"Fiz um depósito na casa de aposta de 50$, daí fui tirar o dinheiro porque estava precisando, a casa me fala que o mínino de saque ",perdi-meu-dinheiro_QoIcjViPDs1nz1Md,
743,sportsbet-io,"Fiz um saque de 100 reais foi aprovado só n chegou na minha conta,é hoje foi entrar no aplicativo é chegou uma notificação falando",saque-declinado__5Ynvxp7CIM4Vvy_,"Fiz um depósito na casa de aposta de 50$, daí fui tirar o dinheiro porque estava precisando, a casa me fala que o mínino de saque é 100$, coloquei mais 50$ para pode fazer o saque, mas o incrível é que eles me falam que só pode sacar os 100$ depois que eu fizer jogo em aposta, eu não quero fazer essas aposta, então quer dizer que meu dinheiro vai ficar pra sempre?"
744,sportsbet-io,"Fiz uma aposta no valor de R$ 10,00 no time de basquete Memphis Grizzlies com retorno 2.0 ODDS. O time mencionado, logo venceu o P",aposta-nao-paga_AG5PVpAbI-3FbCaT,"Fiz um saque de 100 reais foi aprovado só n chegou na minha conta,é hoje foi entrar no aplicativo é chegou uma notificação falando q meu saque foi declinado "
745,sportsbet-io,"Efetuei uma transferência via PIX no valor de R$5.000,00, seguindo todas as orientações, porém o prazo máximo(até 1 dia) já passou",transferencia-via-pix-nao-creditada-em-minha-conta-apos-o-prazo-maximo-informado_DfVWf64uYEuf-4QN,"Fiz uma aposta no valor de R$ 10,00 no time de basquete Memphis Grizzlies com retorno 2.0 ODDS. O time mencionado, logo venceu o Portland Trail Blazzers por 120 x 113, mas consta na aposta feita por mim no dia de hoje que perdi. Preciso de apoio por parte da Sportsbet.io nessa questão, tentei anexar o print mas não consegui.Aguardo retorno o mais breve possível."
746,sportsbet-io,"Criei minha conta no dia 03/04, no dia 11/04 nao consegui mais apostar, recebendo a mensagem: ""saldo insuficiente"", send",nao-consigo-sacar_6hls_zynojwGyIOT,"Efetuei uma transferência via PIX no valor de R$5.000,00, seguindo todas as orientações, porém o prazo máximo(até 1 dia) já passou e até agora o valor não foi creditado na minha carteira do sportsbet. Enviei e-mail para o suporte, porém não obtive retorno.Peço ajuda para resolver o mais rápido,  principalmente por ser um valor alto."
747,sportsbet-io,"Eu apostei nesse site, e n consigo entrar de nenhum jeito, pedi pra uns amigos tentarem tb e nd.. sendo q isso vai me prejudicar, ",o-site-nao-entra-e-tenho-aposta-feita_p9j745lLVV2paJw3,"Criei minha conta no dia 03/04, no dia 11/04 nao consegui mais apostar, recebendo a mensagem: ""saldo insuficiente"", sendo que eu ainda possuo dinheiro na conta, diante disso, verifiquei minha conta e tentei fazer o saque, contudo a resposta foi ""Houve um erro, por favor entre em contato com o suporte. O suporte nao dá nenhum posicionamento!Tenho quase 2mil reais parados no site sem conseguir retirar e sem obter nenhum retorno de um suporte totalmente precário!Estou a mais de 2anos utilizando casa de apostas e com toda certeza essa foi a pior que ja utilizei!Tomem cuidado aos que estao comecando agora.Aguardo no minimo o pagamento da minha verba retida"
748,sportsbet-io,"A empresa, da qual comecei a usufruir no começo de março, não me trouxe problemas. Um apostador iniciante ao começo estava nervoso",avaliacao-apos-um-mes-de-uso_ggNBZ0Q8ow5CNUWz,"Eu apostei nesse site, e n consigo entrar de nenhum jeito, pedi pra uns amigos tentarem tb e nd.. sendo q isso vai me prejudicar, pois tenho uma aposta em potencial e n consigo ver nem retirar o dinheiro, n sei se essa reclamação vai mudar algo, mas estou indignado com esse site, assim q esse site abrir eu vou retirar meu dinheiro de la, isso se abrir o site.. e com isso vou deixar o cashout q poderia tirar.. me prejudica pq tenho q ficar acompanhando, se n acabo perdendo aportunidades.."
